 DH AH N IH R, AA R,1
 DH AH N IH R, EH R,1
R AH S T S IH N AH,R G Y AH,1
R AH S T S IH N AH,R AH,1
AH G AO G M,AH M,1
T B IY W IH DH IH N,T EY SH AH N,1
N W AO K IH,N IH,1
IH NG D IH S T AH N S,IH Z,1
AY Z F R EH SH M IH L,AY S AH L,1
L K IY CH W IY K D,L EY T AH D,1
D EY M AO R N IH NG,D,1
AE T AH S T R AA F,AE Z AO F,1
F IH K EH,F AH N EH,1
F IH K EH,F EH,1
AE K S N AH G L,AE L,1
L EH K T DH AH,L AH,1
T IH N G R IY S IY W,T AH NG Z W,1
T IH N G R IY S IY W,T W,1
T IH N G R IY S IY W,T AH W,2
 S AH M AH V DH, T UW DH,1
Z S P,Z P,1
Z M EY HH AE,Z DH AH AE,1
AE V S,AE S,1
S AH M M EH,S EH,1
EH R AH T AH,EH V ER D AH,1
T AE M B,T AH V B,1
G Y UW AH S,G,1
IY W EY,IY M EY,1
K HH IH,K IH,1
IH M,IH T,1
 D UW, T UW,1
UW AH V OY,UW B OY,1
OY D P,OY P,1
AH NG K CH ER IH,AH T R IH,1
IH NG AO R K AH,IH SH AH,1
AH T IH NG IH,AH N IH,1
N T UW M IY T S,N S,1
S T EH S,S AH L AH N S,1
S T DH EH M,S AE Z,1
AH L AH N S F,AH Z F,1
W AY B AY,W AH T M AY,1
W EH N Y UW AO,W IY AO,1
AE N D P,AE M P,1
R G AH N AH Z,R AY Z,1
AH M OW T,AH B AW T,1
AH B AO R,AH R,1
V AH L IH,V IH,1
S UH P ER B S,S S,1
S L IY P,S UW P,1
P IH NG P IH L,P AH R N AH L,1
S IY W AA SH W AO T ER AO L Y IH R,S,2
L IY R AE G L,L AH L,1
T S AY AH N,T P AA N,1
K S AE M P L,K AH L,1
L IH NG W AA Z IH N T R AH,L AH,1
AH D UW S T,AH T,1
T IH N P L EY S AH V S,T IY Z S,1
T IH V S AE M P L IH NG,T DH IY Z,1
 AE K S AH D AH N, IH N,1
N T M ER,N ER,1
ER D ER S UW AH,ER SH AH AH,1
D T EY K Y AO R P,D EH P,1
 B EH S T S AH, DH AH,1
UW SH AH,UW S AH,1
AH N IH Z T,AH T,1
T UW F AY N D AE N,T EY N,1
N EH R IY,N IY,1
AH DH AE,AH AE,1
AE T IH Z P R IH D,AE D,1
D AA M,D AH M,1
M AH N AH,M AH,1
N L AY T AO R SH EY D,N Z,1
IY F AY L R IH L,IY P AW ER L,1
EY T IH D,EY D,2
D T UW M AY AA D AH T,D AW T,1
D T UW M AY AA D AH T,D IY AE T,1
 AE L, L,1
L AH S,L EH S,1
S AH Z AH,S AH,1
K W IH TH AW T,K AE T,1
 B AA B P EY P ER D OW V ER DH, DH,1
M Y UH R,M AO R,1
 W EH R W, W,1
S AH S AY AH,S EY SH AH,1
AH T IY W AA Z B EY S T AA N,AH N,1
N HH AY R AA R K IY Z,N P AW ER,2
 DH AH R AE M AH F AH K, IH N V OW K,1
 DH EY D, AY D,1
R B UH L,R AO L,1
 T R IH, IH,1
IH M EH,IH N EH,1
S K L EY F R AH,S AH,1
AH M,AH N AA M,1
AH M,AH D,1
M ER AW N D L,M AH L,1
L IH P AH,L IY AH,1
V M OW,V OW,1
S EH T AH S,S IY S,1
D W AY L AH S,D AA R S,1
S EH M B AH,S AH N AH,1
AH L IH NG L,AH L,1
L IH D,L,1
S EH M B ER,S ER,1
ER AH N,ER IY N,1
N D JH AE N Y UW EH R IY,N AH L IY,1
M AH N TH S,M EH S,1
S T UW S P EH N,S IY N,1
N D IH N,N IY AH N,1
 HH AW G UH D, D,1
IH Z Y AO,IH S AO,1
R EH N D,R D,1
 IH F P IY, HH IY,1
 IH F P IY, IY,1
IY P AH L W,IY W,1
W ER M AO,W AO R AO,1
R JH EH N,R G AH N,1
R JH EH N,R IY N,1
N ER AH S,N AA S,1
S DH EH R,S HH IH R,1
R W UH D B IY N OW N IY D F,R T AH F,1
R W EH L F EH R,R T UW,1
 B AA R B B ER N, AH N,1
Z IH N AH,Z AH,1
AH B IH G,AH G,1
G B AA N F AY ER,G R EY T ER,1
 B AE S K AH, DH AH,2
AE N B IY AE N,AE R AH N,1
N EH N,N T IH N,1
N T ER T,N T,1
N IH NG S P AO,N Z AO,1
 W IY AH V DH AH, AH,1
AH L L,AH L,1
L EH D,L AE D,1
D W ER,D M ER,1
ER L,ER AH L,1
D G AA T AO,D AO,1
T F AO R P IY,T DH IY,1
IY S AH N D R,IY Z R,1
R IY HH AH,R EH V AH,1
AH B IH L,AH L,1
L AH T EY,L EY,1
 HH IH Z S AA, AA,1
R K AE Z AH,R S AH,1
AH M W AA Z F AA L OW,AH N OW,1
OW D B,OW B,1
AH S T UW P AH D G R IH N AH,AH SH AW ER AH,1
Z TH IH K M,Z S T EY T M,1
M AW TH AH,M AH,1
N D B AE D T,N T,1
IY TH,IY,1
L Z M IY,L IY,1
IY T AA,IY AA,1
AH B IH SH,AH SH,1
 T R AH D IH, V IH,1
 T R AH D IH, IH,1
Z P ER EH N T AH L,Z R IY L,1
L AH P R,L R,1
R UW V AH L,R IY L,1
L F AO,L AO,1
ER EY JH M EH R IH JH,ER AH P ER CH,1
ER EY JH M EH R IH JH,ER IY,1
 IH T S HH, HH,4
ER T UW K UH K W IH TH AW T SH UH G ER,ER AE Z,1
AH K R AE N B EH R IY B AA G G EH T,AH T,1
T S V EH R,T IH R,1
IY P R IH T IY,IY AH L IY,1
IY IH N AO T AH M,IY Z D,1
IY IH N AO T AH M,IY,1
AE F D AE,AE V T UW AE,1
AE N S,AE S,2
S AH N D S,S K S,1
S AH N D S,S EH S,1
S IH,S EY IH,1
S IH,S IY IH,1
IH F F,IH T F,1
R CH AH N S M,R HH IH Z M,1
AH P AA N,AH N,2
N Y UW,N,2
 M AA M S, S,1
 M AA M S, AO L S,1
 M AA M S, AE S,1
R AO NG L,R OW L,1
R AO NG L,R AH L,1
IH S L AY K S AE P AH T AY Z ER Z,IH NG,1
 DH AH P L EY N, IH N,1
AH F IH N S,AH S,1
S EH G,S AE G,1
R AH G,R IH G,1
G EY SH,G AH SH,1
DH EY K EY M AH,DH EH R AH,1
N CH IY T AH L D,N D,1
D IH R,D R,1
R AE T W UH D L AE,R AE,1
N D P UW L Z,N,1
 T R, F AO R,1
 T R, R,1
R IH M AH W,R W,1
EY EH K S,EY S,1
S EH S K L,S T L,1
L EY R IY IH N,L AY N,1
N F AO R S S IY M W,N W,1
K OY L AH V K L EY,K AA P IY,1
 T R AH D IH SH AH N, AA N,1
Z P ER EH N T,Z R AH T,1
R UW V AH,R N IY M AH,1
R UW V AH,R AH,1
AH L F AO R,AH R R,1
AH L F AO R,AH G R,1
R AH N D ER EY,R EY,1
EY JH M EH R IH JH,EY JH,1
 IH T S HH EH L, AH L,1
L TH IY ER T UW K UH K W IH,L IH,1
IH TH AW T SH,IH SH,1
SH UH G ER,SH AH,1
AH K R AE N,AH N,3
N B EH R IY B AA G G EH T,N D AY AE JH AH T,1
T S V EH R IY P R IH T IY IH N AO T,T EY T,1
 L AE F D AE N S AH, AH,2
D S IH NG IH F F AO R CH AH,D P AE N T AH,1
AH N S M,AH M,1
AY L Z AH P AA N Y UW,AY M,1
 M AA, P R AA,1
AA M S T R AO NG L,AA B AH B L,1
IY D IH,IY HH IH,1
IY D IH,IY T IH,1
IH S L,IH Z L,1
IH S L,IH L,1
AY K S AE,AY F AE,1
AE P AH T,AE T T,1
AY Z ER Z,AY M Z,1
AY Z ER Z,AY T,1
Y AO R D AA R K S UW T IH,Y IH,1
R IY S IY W AA SH W AO T ER AO L Y IH R,R Z,1
 DH IH S IH Z N, N,1
OW N AE Z K AA N F ER M EY SH AH N AH L EH N T R AH P IY,OW,1
 DH AH K L IH R L IY AY D EH N T AH F AY AH B AH L EH N AH M IY K AH N T, T,1
T IH N Y UW,T UW,1
UW D AA N AE,UW S AE,1
AE Z IH F N,AE N,1
N OW W AH,N S AH,1
AH N EH L S W ER ER AW N,AH N,1
N D,N,1
 K AA M P ER AH B AH L T R, HH AO R,1
R EH N D Z K AE N B IY N OW T,R T,1
AH D EH L S,AH N S,1
S W EH R,S,1
IH SH AH N R IY K W AY ER Z P ER EH N T,IH T,1
T AH L AH P R,T AO R,1
T AH L AH P R,T R,1
R UW V AH L F AO R,R G R,1
R AH N D ER,R EH G ER,1
S HH EH L TH IY ER T UW K UH K W IH TH AW T SH UH G ER,S OW,1
AH K R AE N B EH,AH V EH,1
IY B AA G G EH T S V,IY OW L D IH Z V,1
IY B AA G G EH T S V,IY V,1
N AO T AH M,N D,1
N AO T AH M,N,1
 L AE F D AE N, DH EH N,1
 L AE F D AE N, IH N,1
N S AH N D S,N HH IY S,1
S IH NG,S AE NG,1
NG IH F F AO R CH AH N S M AY L Z AH P AA N Y UW,NG K,1
S T R AO,S AO,1
AO NG L IY D IH S,AO R T S,1
AY K S AE P AH,AY T AH,1
AH T AY Z ER Z,AH D,1
AE S K M IY T UW K AE R IY AE N,AE V N,1
 IH T K AE N, AH N,1
N P R,N D R,1
R AA JH,R IH JH,1
T L AO NG R,T R,1
EY N JH G OW L Z F AO,EY S HH AO,1
R IH T S,R S,1
S EH L F,S,1
 HH IY W AA Z G IH, IH,1
F T,F IH T,1
W IH DH AE,W ER AE,1
AE G N,AE N,1
N AH T IH,N IH JH IH,1
Z AH M AH,Z AH,1
D AH P OW,D HH ER OW,1
OW T AH N,OW N,1
L UH R F AO R W IH M AH N AH,L ER AH,1
AH V EH N,AH N,1
N IY R EY S,N S,1
 V EH R IY AO, AO,1
S T IH R Y EH T,S T,1
R EY S IY,R IY,1
N AH F AH R Z B Y UW G AH,N ER AH,2
L S K,L K,1
R D DH,R DH,1
DH AH AE,DH AE,1
N T AH L OW P,N,2
N T AH L OW P,N S ER,1
W EY AH N D F R,W AO R,2
R IY W EY M IY N,R AH N,1
R IY W EY M IY N,R T EH N,1
N DH AH S EY M TH IH NG,N T,1
AH F AA G P R IH V,AH V,1
V EH N T,V DH AE T,1
V EH N T,V AH T,1
T IH D DH EH M,T AY AE M,1
M F R,M P R,1
AH M ER AY,AH V AY,1
NG AA N T AY M,NG,1
 D AE F N Z S, S,1
 D AE F N Z S, AH S,1
 D AE F N Z S, DH AH S,1
W IY D IH SH N IY,W IY,1
IY D AH L P OY N T,IY T,1
T S K AA,T HH AA,1
R F M,R T M,1
R F M,R M,1
AE CH T,AE S T,3
AE CH T,AE Z W AO T,1
T HH ER S K ER,T ER,3
 IY V IH N AH S IH M P AH L, Y UW L,1
L V OW K AE B,L B,1
B Y AH,B AH,1
AH L EH R,AH R,1
R IY K AH N T EY N,R IH N,1
AA R K S UW T IH N G R,AA R,1
T AE S,T UW AH S,1
 W IY M EY S, AY S,1
T HH IH,T DH IH,1
IH Z P,IH S P,2
B L AH,B AH,1
AH M W AA Z D AY AH G N OW S T B,AH B L IY B,1
B AH T DH AE,B AE,1
AE T HH IY R AH F Y UW Z D T R IY T M AH N,AE N,1
 W IY K AE N G EH T IH T IH F W IY D IH G HH, HH,1
D P EY SH AH N T L IY,D AY,1
 D UW W IH TH AW T F AE N S IY, P IY,1
T EY B AH L K L AO TH S,T,1
DH AH B EH S T,DH AE T,1
T W EY T UW L ER N IH Z T UW S AA L V EH,T M AY K EH,1
EH K S T R,EH R,1
AH P R AA B L,AH L,1
L AH M Z,L AY N,1
IY W AO R,IY R,1
R W AO,R M AO,1
R M F L IY S,R S,1
S IY W UH L AH,S AH,1
AH N OW V ER AO L,AH L,1
 R AE L F K AH N T R OW L D DH AH S, HH IY S,1
S B R OW SH UH R IH Z P AA R T IH K Y AH L ER L IY IH N F AO R M AH,S AH,1
AH T IH V F AO R P,AH P,1
P R AH S P EH K T IH V B AY ER,P OW Z,1
 W AY CH AA R JH M AH N, L ER N,1
N IY F AO R S,N IH NG T UW S,1
CH G AA R B IH JH,CH AH,3
CH G AA R B IH JH,CH AE Z,1
SH W AO T ER AO L,SH EH R AH L,1
SH W AO T ER AO L,SH AH L,1
 M EY B IY T, AY AH T,1
D EY L B IY AH,D AH,1
AH G UH D N UW Z D,AH D,1
D EY,D,2
S P AW T AH D AH,S EY IH NG HH ER N AE SH AH,1
AH M AW TH F UH L,AH N AE L,1
AH V W AO T,AH T,1
T ER IH N T UW DH AH EH R,T IY,1
 T UW M, S OW M,1
IY N UW TH,IY TH,1
T T UW B IY AH,T DH AH,1
K F UH L,K W IH L,1
L M AH N T,L,1
UW L ER N IH Z T,UW AE R AH S T,1
T UW S AA,T AA,1
AA L V EH K,AA K,1
K S T R,K R,1
M F L IY S IY W UH L AH,M R IH K AH,1
AH N OW V,AH V,1
N T R OW L D,N D,1
D DH AH S,D AA S,1
S T AA P W AA CH F R AH,S AH,1
AH M DH AH,AH AH,1
AH B L IY CH ER Z,AH T OW M AY,1
AH B L IY CH ER Z,AH Z,1
S B R OW SH UH R IH,S IH,1
N F AO,N AH M AO,1
R M AH,R AH,1
T IH V F AO R AH,T AH,1
R AH S P EH K T IH V B AY ER,R,1
 W AY CH AA R JH M, AE Z M,1
 W AY CH AA R JH M, DH AE T M,1
IY F AO R S,IY W AA Z S,1
IY F AO R S,IY T UW S,1
N G R IY S IY W AA SH W AO T ER,N ER,1
N G R IY S IY W AA SH W AO T ER,N HH ER,1
N G R IY S IY W AA SH W AO T ER,N OW P ER,1
 D AA N T AE S K M IY T UW K, HH ER AO R AH K,1
 D AA N T AE S K M IY T UW K, DH AH K,1
K AE R IY AE N OY L IY R AE G L,K AH L,1
 S UW N, W AH N,1
AH AO F AH S W,AH V W,1
ER K K L EY M D AO L,ER R AH L,1
 N EH K S T DH, DH,1
DH AH HH EH,DH EH,1
EH S T,EH K T,1
AH D AH,AH AH,1
AH N D AO L S IY M D W EH L,AH R,1
HH EH V IY,HH IY,1
N D AH S,N S,1
S T R IY S,S IH S,1
S L AE N T,S T,1
D T AH W AO,D F AO,1
N IH G,N AH G,1
G Z AO S,G R AE S,1
S T AH B AH L G AH V ER M AH N T K AA,S HH AA,1
AA F ER,AA P ER,1
ER Z AH,ER AH,1
AH T R AE,AH HH AE,1
T AH D HH IH M,T,1
 AA R Y AO R G R EY D Z HH, AE T HH,1
N N AE N S AH Z,N HH IH Z,1
K T D IH V EH L AH P M AH N,K AW N,1
T W AA Z P R AH,T ER AE K SH AH,1
AH S IY D IH NG T UW S L OW L IY,AH N,1
S ER V,S EH V,1
V DH AH,V R AH,1
AA AE F T ER AY AE D,AA R AH N D,1
N OY Z P R,N AA S T R,1
R AA B L AH,R AH,1
M G R OW,M OW,1
OW Z M AO R AH N OY IH NG IY CH D EY,OW,1
 IH N, AH N,1
W EY Z,W AA Z,1
N D IH D DH,N AH V DH,1
T S S AY,T AY,1
AY K IH,AY S IH,1
L B L,L L,1
AY N D N,AY N,1
N AH S M,N IH Z M,1
T IH T S EH L F,T AH D,1
 IH T W UH D B IY AH K AH, DH AH,1
L AA S AH,L OW K AH,1
M T UW TH R OW AH,M AH,1
AH W,AH V G ER L W,1
W EY AH S T,W AO T,1
T AO R IY L,T ER L,1
S D R AY S,S T UW S,1
AH V JH,AH JH,1
S K EH R D DH,S T ER DH,1
 HH AY W, AH W,1
EY M IY N,EY V IH NG IH N,1
AH S EY M TH IH NG,AH,1
 DH AH F, F,1
F AA G P,F AO R P,1
R IH V,R AY V,1
IH D DH EH M F R,IH R,1
R AH M ER AY V IH,R IH,1
 D AE, S AE,1
AE F N Z S W IY D IH SH N IY D AH,AE T ER AH,1
AH L P OY N T,AH S T,1
S K AA,S AA,1
S K AA,S T AA,1
S K AA,S AH Z AA,1
F M AE,F AE,1
IH M P AH,IH V AH,1
L V OW K AE,L W AO R T AE,1
R IY K AH N,R IH N,1
N T EY,N S EY,1
D AA R K S UW T IH N G R IY S IY W AA SH W AO T ER AO L Y IH R,D,1
L IY R AE G,L D G,1
L IY R AE G,L AH G,1
G L,G ER L,1
AH N S IY N,AH N,1
N G OW S T L AY K R AY,N AY,1
AY F AH,AY AH,1
L M AH N EY,L EY,1
EY M D AH L IH,EY T IH,1
IH T AH L HH,IH NG HH,1
ER DH,ER D W IH DH,1
DH AH TH ER,DH HH ER,1
ER D T AY M,ER IH N,1
 IH T S AW N D AH, DH AH,1
AH D S,AH S,1
AY G OW AA N,AY T,1
 AE N AA K T IH, HH IY F IH,1
L Y AH,L AH,1
AH N AE T AH M Z N AW L EH T,AH P T,1
T AH S S IY W EH R DH IH S P AW ER K AH M Z F R AH M,T,1
S AW N D AH V JH EH N AH F AH R Z B Y UW G AH L S K,S OW K,1
K EH R D DH AH AE,K AE,1
AE N T,AE P T,1
AH L OW P,AH N,1
AY W EY AH N D F R,AY R,1
IY W EY M IY,IY L IY,1
IY N DH AH S,IY S,1
S EY M TH IH NG,S,1
S EY M TH IH NG,S T AY N,1
 DH AH F AA G P R IH V, OW V,1
V EH N T IH D DH EH M F R AH M ER,V ER,1
ER AY V IH NG AA N,ER L AE N,1
 D AE F N Z, HH IH Z,1
Z S W IY D IH,Z M Y UW Z IH,1
IH SH N IY D AH,IH K AH,1
IH SH N IY D AH,IH R AH,1
L P OY N T S K AA R F M AE CH T HH ER S K ER T,L,1
 IY V IH N AH S, S,2
S IH M P AH L V,S EH V,1
V OW K AE B Y AH L EH R IY K AH,V AH,1
N Z S IH M B AH L Z,N,2
 AH W, W,1
IY L S,IY S,1
S K W IY,S L IY,1
IY K T AA,IY P AA,1
HH AH B W AA,HH AA,1
AA Z,AA R D AE Z,1
T IH L,T EH L,1
L AH N D S K W IY K T AH,L AH,1
AH G EH N,AH,1
OW DH AH T AY,OW AY,1
AY M AH V,AY HH AE V,1
V D EH,V T EH,1
EH TH,EH N,1
HH AW Z IH,HH AE V IH,1
IH NG DH,IH N DH,1
R AH V M,R M,1
M EY S AH,M AH,1
AH N R IY AH N,AH Z AE N,1
D F R,D AH R,1
D F R,D R,1
R EY M K AH,R AH,1
DH AH M IH S K W,DH IY Z W,1
W OW T W,W ER W,1
W OW T W,W ER K W,1
W AA Z R,W AY L D R,1
DH AE N AH P,DH P,1
P AA L,P EY L,1
L AH JH IY,L,1
L AH JH IY,L IY,1
K AH L ER,K ER,1
ER D DH AH B EH D R,ER IH R,1
R UW M W AO L W IH,R IH,1
IH DH K R EY AA N Z,IH NG,1
 HH EH L P G, AH G,1
R EH G T,R EY T,1
T UW P IH K AH P EH,T EH,1
EH K AH,EH R AH,1
AH V P AH T EY T OW Z,AH S,1
 SH EY, T EY,1
 SH EY, S EY,1
EY V IH,EY K IH,1
NG K R IY M IH Z,NG AE Z,1
P AA P Y AH,P UW R IH D IY AH,1
AH L ER AY T,AH T,1
T AH M AA N HH AE L AH W IY N,T,1
T AH M AA N HH AE L AH W IY N,T ER,1
DH EY OW N AH B IH G HH,DH EH R HH,1
N DH AH R IH M,N EH M,1
M OW T K AH,M ER S AH,1
AE N OY L,AE L,1
AW AH D EY Z,AW AE Z,1
K AE Z DH OW DH AH B L IH T,K T,1
T S W,T W,1
W ER JH,W IY JH,1
T AH SH,T SH,1
 P R AH P R, HH AA R,1
R AY AH T IY,R D IY,1
Z S AH N,Z IH N,1
N AA N AH M,N AO R M,1
S W IH DH R,S R IY P R,1
R IH CH UW AH,R AY Z AH,1
 JH AA R Z AA, S OW AA,1
S EH M B AH L D IH,S IH,1
IH N B OW L,IH L,1
L AH V,L V,1
V B AH T ER,V ER,1
ER M OW L D,ER,1
 P IY T S, K EY S,1
 P IY T S, ER IH S,1
AH Z AA,AH K AA,1
R K AH N V IY,R D IY,1
IY N Y AH N T F AO R AH K W IH K,IY AE K,1
K L AH N CH,K,2
 P UH T DH, DH,3
AH B UH CH ER,AH P ER,1
AH B UH CH ER,AH M IH Z ER,1
ER B L AA K T EY,ER AH R EY,1
N DH AH G ER AA ZH,N HH IY R OW Z,1
 D R AA P F AY V F, F,2
R M Z IH,R IH,1
AA K S,AA S,1
S B IH F AO R Y UW G OW AW T,S T,1
S B IH F AO R Y UW G OW AW T,S ER SH AH N,1
ER W AO R,ER AA R,1
R D R OW B K AH,R G AH,1
S IH S T S AH,S AY Z AH,1
V OW N,V W AH N,1
N L IY S K ER T,N P AA R T,1
L AW S,L AE S,1
 EH L D ER, AY T EY K HH ER,1
ER L IY P,ER AH P,1
P IY P AH L AA R AO F AH,P IH N Y AH,1
N IH K S K L UW D AH D,N,1
N IH K S K L UW D AH D,N M EH T,1
W AA,W IH DH L AA,1
AH B EH T ER K,AH K,1
DH IY Z L,DH AH L,1
L AY N Z K,L AA R JH K,1
T EY N F AA S F EY,T AH M P L EY,1
T B IH L D ER Z,T S,1
AY P IH,AY TH IH,1
M IY F AO R,M EH R,1
R Y AO R P,R IY P,1
T S IY,T,1
 P UH T AA, AA,1
Z OW L D B,Z B,1
R D ER OY K,R AH K,1
OW T AH N D IH T W AA Z AO L,OW L,1
L R EH D,L D,1
D IY S,D S,1
OW K T,OW,1
B AH NG G AH,B AH,1
OW W AA Z,OW Z,1
R EH M P L OY,R AH B OY,1
OY M AH N T,OY,1
IY AE M B AH L D TH R UW DH AH F AA R M Y AA R D,IY,1
 IY T IH NG S P IH N, AE N,1
AH CH N AY T,AH M AH L AH T,1
T L IY,T IY,1
N K R,N R,1
R IY S AH,R AH,1
AH Z S T R EH NG K TH M ER AE K Y AH L AH,AH SH AH,1
AH S L IY,AH,1
AH T W,AH W,1
EH L F TH D,EH T D,1
EY W EH L HH AE V SH AH,EY IY Z AH,1
AE D Y AO R D AA,AE Z HH IY AA,1
 Y UW W UH D D R, G R,1
V AH S,V S,1
N T UW SH EY M HH IY D IH K L EH R D,N D,1
K L AW D Z B AH,K AE S AH,1
AH L JH D D AW N,AH N,1
N W ER D AH,N OW V AH,1
N D B ER,N F ER,1
S AH D,S EH D,1
D AH N L,D L,1
L IY IH N T UW AH G R EY,L EY,1
EY T B,EY B,1
K F AH N AH L,K IH Z,1
 F OW L, AO L,1
IH N T UW W IH P T,IH Z S OW L AE S T,1
T K R IY M AH N,T IH NG AE N,1
N D AE D AH D AE SH,N EY V IY EY SH,1
S AO L T,S T,1
T AH N D S P R,T R,1
R IH NG K L,R EY N JH L,1
L IH NG AH,L IY AH,1
P AE P,P OW P,1
P R IY K AH,P,1
 DH AH M IH, HH IH,2
IH S K W OW T,IH Z P AA R T,1
T AH D W IH,T IH,1
IH DH AE N AH,IH S AH,1
AY K AH L K AH L ER,AY HH AW EH V ER,1
ER D DH AH B EH D R UW M W,ER W,1
W AO L W IH,W AA Z IH,1
IH DH K R EY AA N,IH N,1
 SH EY V IH NG K R IY M IH Z AH, DH AH,1
AH P AA P Y AH L ER AY T AH M AA N,AH EH N,1
N HH AE,N AE,1
AE L AH,AE K SH AH,1
AH W IY N,AH N,1
AH W IY N,AH T,1
DH EY OW N AH,DH AH,1
IH N G R IY S IY,IH NG L IY,1
AE S K M IY T UW K AE,AE Z N AE,1
AE S K M IY T UW K AE,AE Z AE,1
 AH F, R AE DH ER F,1
F L EY M W UH D Y UW S AH P EH R,F AA R,1
IY M UW V M AH N T SH IY M,IY D EY AY M,1
EY D S IY M D AH N N,EY K ER N,1
N EH S,N IH S,1
S AH S EH R AH L IY,S T IY,1
N OY Z IY,N,1
HH IH Z HH IH S T ER,HH IY ER,1
ER IY IH Z HH IH Z AH L OW N,ER AW N D W EY N,1
N Y EH T IY CH M,N AH M,1
M AE N,M OY N,1
N M AH S T R EH K AH,N AH,1
AH G N AY Z HH IH Z OW N HH IH S T ER IY IH N,AH N,1
 DH AH M IH S K W, W,1
W OW T W AA Z,W EH L AE Z,1
Z R IY T R AE,Z AY HH AE,1
AE K T AH D W IH DH AE N,AE V HH EY N,1
AH P AA L AH JH IY,AH S,1
 M AY K, K,1
L K AH L ER,L AE T ER,1
ER D DH AH,ER AH,1
AH B EH D R,AH L P R,1
UW M W AO L W IH DH K R EY AA N Z,UW F,1
 HH EH L P G R, IH R,1
 HH EH L P G R, AH R,1
 HH EH L P G R, R,1
R EH G T UW P IH K AH,R AE D AH,1
AH P EH K,AH K,1
K AH V P AH T EY,K EY,1
T OW Z,T,1
 SH EY V IH NG K R IY, M EH N IY,1
IY M IH,IY TH IH,1
IH Z,IH NG Z,1
Z AH P,Z P,2
P AA P Y AH L ER AY T,P EY T,1
T AH M AA N HH AE L AH,T R IY AH,1
 DH EY OW N, EH N,1
 DH EY OW N, AA N,1
N AH B IH G HH,N HH,2
HH AW S IH N DH AH R,HH AA R,1
R IH M OW T,R T,1
S K M IY T UW K AE R IY,S L EY V ER IY,1
N D IY D IH,N DH AH IH,1
IH T IH,IH N D IH,1
P AA S,P EH N S,1
S AH B,S IH B,1
EH P ER EY T,EH T,1
T IH L EH K T,T R AY T,1
T R AA N P AE R AH,T DH AH,1
AH M AE G N EH T IH K F R,AH CH AY L D HH AE R,1
R AH M N UW K L IY,R IY,1
IY ER IH F EH,IY EH,1
 L AY, AY,1
AY T AH D,AY D IH D,1
D W IH,D M IH,1
N D OW Z G L OW D JH UW AH L B R AY T,N IH S T,1
T TH R,T IY R,1
R UW DH AH,R IY AH,1
AH D AW N P AO R,AH L,1
 S AE L V EY SH AH N R, AA R,1
R IY K AH,R AH,1
N S IH D ER D,N T,1
K L AH,K AA N T AH,1
K L AH,K AH,1
AH M Z IY K AH S T,AH N EH N T,1
L D S,L N EH S,1
AH M IH K S,AH S,1
EH N S IH V P ER F Y UW M,EH R IY Z,1
 DH AH V Y UW P OY N, IH N,1
N T OW V ER,N AH DH ER,1
L UH K T DH AH OW SH AH N,L IH V Z,1
 P L, L,1
L IY Z D,L AE T AH T UW D,1
D IH G M AY P,D EH P,1
R AY D DH AH,R AE SH AH,1
AH B W EY B AH T AY,AH L AY,1
T IH N AH F CH,T CH,1
CH EY N JH,CH AE NG,1
 G R AE N, AH N,3
N D M AH,N AH,3
T G R UW HH ER AH,T K AH M AH,1
AH P B R,AH V R,1
R IH NG IH NG IH N,R AE N,1
N P EH T IY,N JH AH HH IY,1
IY K OW T,IY T,1
IY K OW T,IY HH AA T,1
T AE S K M IY T UW K AE R IY AE N,T ER N,1
T AE S K M IY T UW K AE R IY AE N,T EY N,1
 DH AH P, P,2
ER CH AH,ER S AH,1
AH S ER Z R IH JH EH K,AH K,1
T IH D DH AH AO R D ER,T ER,1
UW L EH T ER Z R,UW V AH R,1
R IH T AH N IH N V IH,R D IH,1
G ER AH,G R AH,1
L OW ER P AO R SH,L UW SH,1
SH AH,SH EY AH,1
AH N P R AH V,AH S IY V,1
V AY D Z AH R EY T IH,V IH,1
IH NG AE,IH N AE,1
IH N F AH,IH M AH,1
N S IY AH,N D AH,1
N D AH,N AH,2
N D AH,N T AH,1
AH D AH L T HH UH D,AH DH ER,1
AY AH K Y UW,AY L UW,1
UW Z,UW IY Z,1
Z AH SH IH P M EY T AH,Z IY AE N IY AH,1
AH V B IY IH NG B IH HH AY N,AH N,1
N D DH IH S,N Z,1
AH V P Y UW T,AH F EY T,1
T ER AA R B,T AH V B,1
P AY D ER W,P IH T W,1
W EH B G L IH,W ER V IH,1
W EH B G L IH,W AH T IH,1
AH N D IH N DH AH,AH T AH,1
AH S AH N,AH D,1
AH S AH N,AH T IH D,1
AH S AH N,AH Z IH N,1
S T AA K IH NG Z R,S ER P R,1
R AH N DH AH F ER S T T AY,R AY,1
T D UW,T UW,1
UW CH AA,UW S AA,1
AA R L,AA L,1
L IY Z D ER T,L AH T,1
IY D IH SH AH Z,IY Z,2
T IY TH S T R,T EH R,1
R AO NG,R IH NG,1
R AO NG,R AH,1
AH L AY F T,AH W AO T,1
T EH N AH N T Y UW D IH D AH K T,T ER T,1
T AH L AW,T AW,1
AW AH B AH L D IH P R IY SH IY EY SH AH N AH N D D IH P L IY SH AH N,AW N,1
 G EH T IH NG DH AH, AH,1
AH B AA S R,AH R,1
R AE T,R UW T,1
T AH L S N,T IY N,1
N EY K T UW HH EH L P Y UW,N,1
T DH AH TH,T TH,1
Z W IY D UW T UW IH,Z IH,1
IH S K EY P AW ER F IH R,IH N AH R,1
R Z AH N D T UW F ER,R AE DH ER,1
ER G EH T AW,ER AW,1
ER IY Z,ER D Z,1
M EY D AH V P Y UW T,M AE N AE F T,1
M AO R N IH NG D UW AA,M AA,1
AH S P AY D ER W EH B G L IH S AH N D IH N DH AH S AH N,AH F IY AO R IY,1
T AA K IH NG Z R AH,T AH,1
AH N DH,AH G EH DH,1
DH AH F ER,DH ER,1
ER S T T AY M TH EY R W AO R,ER DH EH R,1
N T D UW CH,N CH,2
R L IY Z D ER T,R T,1
 K AE L S IY, HH IY,1
IY AH M M EY,IY EY,1
EY K S B OW N Z AH N D T IY TH S T,EY T,1
R IY S IY W AA SH W AO T ER AO L Y,R Y,1
R IY S IY W AA SH W AO T ER AO L Y,R AE K AH R OW Y,1
 B R AW N, AH N,1
N AY Z,N D AE Z,1
AY B R,AY R,1
R AW M AH S T,R IY CH T,1
T AE SH,T,1
 R EH K T ER W AA Z AO F AH, AH,1
S AO F AH,S AH,1
AH N T EH M P,AH V P EY P,1
P T AH D T,P IY T,1
T UW AE S K K,T K,1
Z B AH T HH,Z F AO R HH,1
 F Y UW R, HH IY R,1
R UH R AH L,R UW L,1
L EH R IY AH,L Z AH,1
AH Z AA R P R AH,AH V DH AH,1
EH K T AH,EH N AH,1
AH D B AY Z OW N IH NG,AH T,1
R AH D IH,R IH L IH,1
Z P ER EH,Z R EH,1
R AH N D,R EY D,1
D ER EY JH M,D M,1
HH EH L TH IY,HH IY,2
IY ER T UW K,IY K,1
K UH K W IH TH AW T SH UH G ER,K AH L ER,1
 DH AH K R AE N B EH, EH,1
EH R,EH V R,1
AA G G EH T S V EH R IY,AA D IY,1
AH N D S IH NG IH,AH K OW T IH,1
IH F F AO,IH L AO,1
AO R CH AH N,AO N,1
N S M AY L Z AH P AA N Y UW,N HH IY,1
 M AA M S T R, AO L P R,1
R AO NG L IY D IH,R AA B AH B IH,1
R AO NG L IY D IH,R IH,1
L AY K S AE P AH,L AH,1
T AY Z ER Z,T IY Z,1
T AY Z ER Z,T EY T AH S,1
N G R IY S IY W AA SH W AO T ER AO,N D AO,1
 DH AH SH, HH IY SH,1
ER K AH N S IH S T S AH V T UW P,ER IY DH ER HH IY P,1
P AA R T S AH F AE,P AE,1
T OW P,T AH P,1
P AH N,P IH N,1
N IH NG P AA R T AH,N Y AH,1
N D AH F AE S T,N EY T,1
T K,T IH D K,1
 Y AW V G AA T, DH AE T,1
T N OW B,T B,1
AH P HH,AH V HH,1
 DH IH, HH IH,1
 DH IH, M IH,1
IH S TH IH R,IH Z V EH R,1
IH V EH N,IH N,1
N CH AH W AH,N T AH,1
L IY P R UW V D IH N IH,L EH K T IH,1
UW AO TH ER AY Z,UW IH Z,1
Z D DH AH AH N L,Z EH L,1
L IH M AH T AH,L AH,1
ER HH,ER Z HH,1
HH IH Z,HH EH Z,1
Z P R EH S T,Z IH T,1
T IY ZH HH IY AH K EY,T EY,1
EY ZH AH N AH L IY R IY D,EY T IH D,1
D Z DH AH W AO,D T UW AO,1
 L AO R, R,1
R IH S K AA S T UW M N IY D AH D B L AE K G L AH V Z,R OW Z,1
Z T UW B IY K,Z IH K,1
K AH M P L,K L,1
L IY T L IY EH,L EH R EH,1
AH G AH,AH M AH,1
AY Y EH L,AY L,1
L AO R W ER IY OW,L OW,1
OW V ER,OW ER,1
N F R AH M DH AH AE N,N IH N T EH N,1
AA N T AE S K M IY T UW K AE R IY AE N OY L IY R,AA R,1
 Y EH T W IY N, N,1
ER F IY L AH N IY Z IY,ER HH IY,1
 HH IY D R, G R,1
R OW V AH N D DH AH R OW D W AA B AH L D F AH M IH L,R AW L,1
L Y ER S IY N Z K R EH P T P AE S T AA N IY DH ER S AY D,L D,1
D Z F,D AH D F,1
R F AH N D Z T UW K L,R P AE L,1
L IH R S L AH M Z AH,L IY AH,1
N D HH EH L P K AA,N T AA,1
L IH JH,L AH JH,1
JH IH Z B IH L D D AO R M AH,JH AH,1
T AO R IY Z,T S,1
 S P EH SH AH L, IH L,1
 S P EH SH AH L, AY T OW L,1
AE S K F AO R S IH Z R EH S K Y UW HH AA S T AH,AE B ER EY SH AH,1
AH JH AH Z F R,AH N AO R,1
R AH M K IH D N AE P ER Z,R,1
B AH N W,B ER T W,1
R AH Y EH L OW L IH,R B IH,1
 S T R AO, AO,1
AO HH,AO L HH,1
R AW T,R AE T,1
AH T UW TH,AH ER TH,1
TH F EH R IY F ER G AA T T UW K AH,TH AH,1
EH N R,EH R,1
R AA JH ER Z T UW TH F EH L AW T,R,1
AY AH G R AE M M EY K S S,AY S,1
S OW N L,S IH R L,1
L IY AE F T ER M AH CH S T AH D IY,L IY,1
Y AO R D,Y UW D,1
W UH D IH,W ER IH,1
SH N OW S EH,SH T DH EH,1
EH N S ER SH IH P,EH R,1
S EH Z HH EH L B IY HH IY R,S OW F R,1
R AA N,R OW N,1
N DH AH W AH N AA K L AH,N IY AH,1
AH K P L EY N,AH,1
AY HH IY R,AY R,1
D P R,D G R,1
IY B IH K AO Z,IY AE Z,1
Z DH AE T S N,Z AY N,1
IY F AO R AH JH EH N T AH L M AH N,IY SH IY,1
R AA B S AE T B AY DH AH P AA N D AH,R AH,1
S K EH,S EH,2
EH CH T,EH T,1
T DH AH S,T S,1
R W AH N,R N,1
R W AH N,R AE N,1
N G AE L AH N AH,N IY AH,1
AH V G AE S,AH S,1
AH V G AE S,AH,1
DH IY Z SH UW,DH AH Y UW,1
DH AE N B IY OW,DH AH OW,1
OW V ER CH,OW L D CH,1
JH D,JH,1
D EY K S,D S,1
S W EH,S EH,1
EH N EH V ER,EH P ER,1
ER DH AH B AE R AH M EH T,ER EY T,1
T R IH K P R EH SH ER CH,T S CH,1
IY HH AE D Y AO R D AA,IY K AA,1
S K M,S T M,1
D B IH K AH M,D D UW M,1
M L EH S G EY,M Y UW Z D,1
 W EH R OW, OW,1
Z T UW W,Z HH IY W,1
F L ER IH SH HH,F AO R S HH,1
HH EH N S F,HH IH Z F,1
R TH,R,1
 N AW DH AH S, IH T W AA Z S,1
S K UW L W,S OW W,1
Z IH N D IY,Z HH IY,1
IY D B ER EH F T,IY R,1
S T R,S P AH R,1
R OY EH,R EH,1
EH V ER IY,EH L IY,1
IY F AY L R IH L EY T IH D T UW M,IY M,1
AY AA D,AY HH AE N D,1
AY AA D,AY AH D,1
AY AA D,AY D,1
D AH T S,D Z,1
 AE L AH S, HH AW S,1
Z AH B,Z B,1
AH T IY T UW W ER K W IH TH AW T S UW P ER V IH ZH AH,AH F AH,1
N IH Z N,N AH N,1
N OW,N D OW,1
OW T W ER,OW V ER,1
ER D OW,ER OW,2
IH V IH NG R UW M M Y UH R AH,IH B ER AH,1
 W EH R W ER Y UW W, W,1
IY HH AE D,IY D,1
T IH N G R IY S IY W AA SH W AO,T AH AO,1
AE S K M IY T UW K AE R IY,AE Z EH V ER IY,2
 IH T HH, AY HH,1
AE D AH,AE M P AH,1
AH T IY N IY,AH L K OW Z IY,1
IY EH N,IY N,1
N V AH,N AH,1
AH L OW P T AY D T UW IH T S R IH S,AH S,1
IY L UH K T K R,IY W AO R,1
R EH S T F AO,R AO,1
L AH N AE,L AE,1
Z IH F HH,Z Y EH T HH,1
AW D IH S AH P OY N T IH D DH,AW DH,1
L HH Y UW M AH N,L IH N,1
N R,N K R,1
R EY S,R IY S,1
 DH EH R Z IH Z AH S, S,1
F B AY ER TH L IY S T,F AA R T,1
T AE N,T AH Z AH N,1
N D ER D Z,N Z,1
AE T S,AE S,1
HH ER T S M AY IH R,HH IY R,1
 K L IH F W AA Z S, T EH S,1
S UW DH D B AY DH AH,S T AH,1
S UW DH D B AY DH AH,S T IH V AH,1
ER IY AH S M AH S AA ZH,ER Z,1
T AY M L IY IH N K AH M,T AE M,1
M L AO S K OW AH,M AH,1
M L AO S K OW AH,M P AE SH AH,1
N S AY D AH D W IH DH DH AH,N EY SH AH,1
AH B R EY K D AW N,AH N,1
N AH V AH HH IY T IH NG S IH S T AH M P AA R T,N,1
 JH EY, DH EY,1
EY N M EY ER N M AO R,EY AA R,1
R M AH N IY B AY W,R W,1
 Y AH NG S T ER Z, AE Z,1
V K AA M AH N K AE N D IY AE Z T R IY T S,V,1
IY T UW K AE,IY HH AE,1
 W IY N, AY N,1
Z AE Z R,Z AH R,1
R IY AH SH UH R,R EH R,1
R AH N S DH AH,R AH,1
AH AY R AA N IH K F R,AH R,1
R UW T AH V AH D IY,R IY,1
IY P L,IY L,1
L IY M AO R AH,L Y AH,1
AH L N EY CH ER,AH,1
 K AH V ER, P ER,1
ER AH JH AH V P R AY,ER D AY,1
AY M EH R IY L IH T ER AH,AY SH AH,1
AH CH ER W IH L F AA L OW,AH N,1
DH AE T AE,DH AE,1
AE D AH D T,AE T,1
T R AE F IH,T IH,1
IH K M IY N Z,IH Z,1
Z R,Z P AA R,1
Z R,Z AA R,1
R AY Z IH NG S,R S,1
S T R IY M Z AH,S AH,1
AH V D AY M,AH M,1
M Z AH N,M OW N,1
N D K W AO R T ER Z AE T T OW L G EY T S,N IY AH S,1
 D IH D Y UW B AY EH N IY K AO, AO,1
R D ER OY OW V ER,R AH T ER,1
R AH B R AY T R EH,R IY EH,1
