F AH N,F AE N,1
M AH K R,M IH NG R,1
V AE Z,V IH Z,1
T S IH,T IH,1
AH N T,AH D,1
AH N T,AH TH IH NG AE T,1
AH W IY,AH M IY,1
DH AH P AA,DH EH M AA,1
D S K EH,D G EH,1
EH CH T DH,EH S DH,1
R EY G IY,R IH NG CH IY,2
R EY G IY,R IY,1
IY S,IY Z,2
IY S,IY N AY S,1
IY S,IY CH N UW S,1
 B, DH AH B,3
B EH G,B IH G,2
B EH G,B AE G,1
IY OW,IY IH NG OW,1
ER AO L Y,ER AA R Y,1
ER AO L Y,ER DH AH Y,1
ER AO L Y,ER Y,1
N OY L IY R,N DH AH R,6
N OY L IY R,N AO R,1
N OY L IY R,N D N OW R,1
N OY L IY R,N D M AO R N IH NG R,1
N OY L IY R,N AA N DH AH R,1
N OY L IY R,N AO R DH AH R,1
AY K DH AE T,AY N,2
 F L AY Z S W AO R M D ER AW N D DH AH B OW L AH V L EH N T AH L Z IH, IH,1
M AA P T TH IH K B,M AH N D IY B,1
R EH D,R AE N D,1
AH P AH L S,AH M OW S,1
S IH NG G L OW AH,S T AH,1
AH V AH,AH N D AH,1
AH V AH,AH N D AA N AH,1
AH V AH,AH M AH,2
 DH EH R P R AA P S W ER T UW S T EH P L AE D ER Z AH CH EH R AH N D AH P AA M F AE N,,1
 S P EH SH AH L T AE S K F AO R S IH Z R EH S K Y UW HH AA S T AH JH AH Z F R AH M K IH D N, N,1
N AE P ER,N EY B ER,1
OW L IH L,OW B EH L,1
 S T R, Y AO R,1
R AO HH,R HH,1
AE T S AA R AW,AE N D Z AW,1
S Y IH R,S,1
T UW TH F EH,T ER N B EH,1
M W EH N,M AA N,2
T UW TH F EH L AW T,T AY M,1
DH AE T D,DH EH N D,1
S UW T IH N G,S OW G,1
IY W AA SH W,IY W,1
IY W AA SH W,IY IH M ER JH IH NG W,1
T ER,T ER M AA D ER,1
T ER,T AE N AW ER,1
G AE N,G IH N,1
 D UW L, DH AH L,1
B OW L,B AO L,1
T HH IY T,T DH AH,1
Z F R AH M K,Z IH N K,1
R AH,R IH NG AH,1
R AH,R AO F AH,1
R AH,R M AH,1
UW TH F EH,UW S P EH,2
UW TH F EH,UW S EH,1
 SH IY B L UW HH, HH,1
N D DH,N DH,1
UW HH OW,UW OW,1
OW L D AO R F,OW N ER F,1
S T,S T T,2
S T,S DH AE T,1
S T N,S N,1
S AH B T EY,S N EY,1
EY N P AA,EY M AA,1
AA P Y AH L,AA N M IH L,1
L EH R AH T IY,L ER,1
IH SH B,IH S B,1
IY P F,IY V F,1
IY P F,IY G F,1
G R IY S IY W,G L IH SH W,1
R,R Z,1
R,R OW,1
IY T UW K AE R,IY DH AH G EH R,1
IY T UW K AE R,IY D UH R,1
R IY AE N,R IH N,2
R IY AE N,R AH N,3
R IY AE N,R IH NG AH N,1
 IH T W AA Z, DH OW Z,1
AA D ER N,AA R T AH N,1
EY IH N F R AH,EY S M AH,1
 L UH K S, S,1
T HH AA R,T AO R,1
R T S,R S,1
F UW L W,F AO R W,1
 V Y UW T, T,1
N F,N D F,3
N F,N S F,1
 K AA M B AY N AO, DH AH AO,1
S IH N AH L,S L,1
B S AE T B,B B,1
AH N D S,AH NG S,1
AH N D S,AH S,1
CH T DH,CH DH,2
G AA R D F,G OW IH NG F,1
 IH D R AE DH, DH,1
DH ER N AA T B AY DH IY Z SH UW Z DH AE N B IY OW,DH AH OW,1
 HH ER R, AO R,1
 HH ER R, R,2
R AY T HH AE,R IH N AE,1
N D EY,N EY,1
EY K S,EY S,2
S W EH N,S N,1
DH EH N,DH AE N,3
 D IY N Z K, DH AH S K,1
K AE N,K IH N,1
K AE N,K EH N,1
K AE N,K AH N,1
Z D G,Z G,1
L R IH L,L L,1
T IH D T,T T,1
OW T W ER DH IY,OW,1
 B AA B P EY P, IH M AH P,1
P ER D OW V,P R UW V,1
V ER DH AH,V AH,1
UW M M,UW M,1
R AH L Z,R Z,1
N HH AY R,N IH R,1
R AA R K IY Z,R AH N Z,1
IY T UW K AE R IY AE N,IY N IH NG AH G EH N W EH N,1
L IY R AE,L AE,1
AE G L,AE NG L,4
ER AA R,ER AO R,1
 AH N UW AY D IY AH D R IH F T AH D IH N F R AH M N, N,1
 K UH D DH, DH,1
DH IH S S,DH AH S,1
IH R D,IH G Y ER,1
 K AO L AE N, AA N,1
M B Y,M Y,1
 P L, K L,1
L AE N,L IH N,1
N D P EH R AH,N T AH,1
T HH UH D AO,T AO,1
Z P R AH,Z AH,2
M OW T B ER TH K AH N,M UW N,1
T R OW L,T IH NG,1
T R OW L,T,1
 AH B AO, F AO,1
R IH NG N,R AH N,1
AH S UH P ER B S,AH N D F R AH M S,1
N OY,N D OY,1
T HH ER R,T R,1
 AA N, W AH N,1
EH M B L,EH L,1
UW OW B,UW B,1
B EY G,B IH G G,1
T AO R D,T W OW L D,1
D ER Z,D N T,1
IY L AO,IY W AO,1
AO Y ER,AO R IY ER,1
 HH IH, DH IH,2
IH Z SH OW L D ER F,IH S S AO R T AH V F,1
IH T W ER B,IH M B,1
K AH N,K,1
K AH N,K AA N,2
 S OW IH F AO, AO,1
Z T,Z N T,1
Z T,Z S T,1
T UW G,T IH N G,1
IH T,IH D N T T,1
IH T,IH NG,1
IH T,IH Z N T,1
D T UW F,D DH AH F,1
L HH ER,L,1
 HH ER S, AO R S,1
K AE T S M,K IH D Z F R AH M,1
M IY AW AO L W EY Z,M Y AE AY Z,1
AY IH,AY HH IH,1
AY IH,AY Y IH,2
R Z,R OW Z,1
IH F W,IH P W,1
IH F W,IH R W,1
 IY CH AH N, JH AA N,1
M L AO S,M R AA S,1
M L AO S,M AA S,1
N D IY AE Z T,N Y UW S T,1
ER AO L,ER HH OW L,1
ER AO L,ER V AA L,1
P AE S,P OW S,1
S CH ER,S T ER,1
AA R DH AH AH DH ER,AA N EH N ER,1
ER CH IY,ER JH IY,1
IY F S,IY S,1
S AH Z AH V,S L IH V,1
V L,V Z L,1
K F IY,K M IY,1
L AH,L DH AH,1
L AA R,L AO R,1
T AH D T,T IH NG T,1
UW OW B EY,UW M EY,1
EY G,EY K G,1
EY G,EY T G,1
L AH V M,L OW N M,1
 IH F K AE R AH L, G ER L,1
Z T AH,Z F R AH,1
M AA R OW,M AW ER OW,1
OW HH,OW N HH,1
S IH Z IH M P AO R T AH N,S W OW L D N,1
N T T,N T,2
T UW M,T M,1
T UW M,T AH M,1
AY TH IY M,AY N D,1
 HH IY S EH D DH AH K R, G R,1
EY Z IY F UW L HH AE F AH L AW D,EY T,1
 B EY, DH EY,1
N HH AE F AW ER L AO NG G ER,N AH N D,1
AA R N,AA N N,1
N TH S T,N IY T,1
AY AE M IY,AY AH N D,1
 HH AW G UH D IH Z Y AO R EH N D ER AH N S,,1
 IH F P IY P AH L W ER M AO R JH EH N ER AH S DH EH R W UH D B IY N OW N IY D F AO R W EH L F EH R,,1
 B AA R B B ER N D P EY P ER AH N D L IY, HH IY,1
Z IH N AH B,Z B,1
IH G B AA N,IH N,1
N F AY ER,N,2
 B AE S K AH T B AO L K AE N B IY AE N EH N T ER T EY N IH NG S P AO R T,,2
 F AE, DH AE,1
D IH,D HH IH,1
IH N L,IH M L,1
SH ER T,SH UH R,1
IY P S,IY M S,2
IY P S,IY S,1
OW P,OW,2
OW P,OW N,2
AH L UW M AH,AH AH,1
M S IH L V ER W,M W,1
W EH R K AE N,W AH N IH N,1
N B IY,N M IY,2
N B IY,N P IY,1
IY F L,IY T L,1
IY F L,IY P AH L,1
IY F L,IY N Z L,1
L IH M Z IY,L AE N D R IY,1
L IH M Z IY,L,1
 P AE, T AE,1
AE M G,AE N G,1
G IH V Z D,G EH T S D,1
S AH P R,S K R,1
Z AH L,Z IY,1
Z AH L,Z L,1
W EH N T D,W ER D,1
Z L OW D AH D AH T,Z T UW T,1
EY L AE,EY N AE,1
AE V IH,AE D M IH,1
SH L IY,SH AH N,1
 N EH V ER HH AE P IY ER IH N M AY L AY F,,1
 HH UW AO TH ER AY Z D DH, DH,1
DH AH,DH AH R AH,1
AH AH,AH S IH P IY AH,1
AH AH,AH AA N AH,1
 T UW F ER DH ER HH IH Z P R EH S T IY ZH HH IY AH K EY ZH AH N AH L, L,1
L IY R IY D Z DH AH W AO L S,L AE S,1
R IY T JH ER N AH L,R,1
 L AO R IH S K, K,1
S T UW M N IY D AH D B L AE K G L AH V Z T UW B IY K AH M P L IY T L IY EH L AH G AH N T,S T,1
 W AY Y EH L AO R W ER IY OW V ER S, S,1
IH L IY,IH R IY,1
IY AY T AH,IY AH,1
AH M Z,AH,1
AH M Z,AH N IY,1
 G EH S DH AH K W EH S CH AH N F R AH M DH AH AE N S ER,,1
 SH IY HH AE D Y AO R, G R,1
 SH IY HH AE D Y AO R, R,1
AO T ER,AO R N ER,1
B AW T IH,B AA B IH,1
IH T S AE,IH Z AE,1
P L AH K AH,P AH,1
 T UW F, F,1
ER HH IH,ER IH,1
IH Z P,IH T S P,1
R IY D,R EH D,2
D Z DH,D DH,2
R IH S,R AH N S,1
R IH S,R IY AH S,1
K AA S,K AH S,1
W ER IY,W IH R IY,1
 G EH, Y EH,3
AH K W EH S,AH F ER S,1
S CH AH,S T AH,1
 P OW AH T S M AO R OW V ER D W EH L AA N HH Y UW M AH N P AE SH AH N Z,,1
 IH T W AA Z N AA T IH G Z AE K T L IY P AE N IH K DH EY G EY V W EY T UW B AH T DH EY K UH D N AA T JH AH S T S IH T DH EH R,,1
AY T UW W IY K AE N D,AY D,1
D AY L AY K R IY L P IY P AH L,D,1
 DH AH K L AH M Z IY K AH S T AH M ER S P IH L D S AH M IH K S P EH N S IH V P ER F Y UW M,,1
 DH AH V Y UW P OY N T OW V ER L UH K T DH AH OW SH AH N,,1
D IH G M AY P AH T EY,D EY,1
EY T OW Z,EY Z,1
EY T OW Z,EY N ER Z,1
EY T OW Z,EY N Z,1
Z AH P B IH F AO R F R AO S T,Z,1
 IH D R AY D DH, DH,1
 IH D R AY D DH, W EH L DH,1
DH AH S,DH IH S,3
S AH B W EY B AH T AY HH EY V AH N T IH N AH F CH EY N JH,S,1
ER AW T G R UW HH,ER AH N D HH,3
EH T IY K,EH L IH K,1
EH T IY K,EH N D IH NG K,1
K OW T S,K AH N Z,1
K OW T S,K IH D Z,1
 SH IY HH AE D Y AO R D AA R K S UW T IH N G R IY S IY W AA SH W AO T ER AO, AO,1
T AE,T HH AE,1
AH TH IY M,AH N EY M,1
EY B IY,EY M IY,1
IY DH,IY N DH,1
EY P F,EY M F,1
F R AH,F AH,1
AH M W,AH L W,1
P S IH V AA L,P T L,1
L V,L IY V,1
V,V AO F,1
S UW DH IH NG L,S OW N EY M L,1
R L,R AH L,1
R L,R AE L,1
L AH K W,L AA T W,1
IY S T,IY T,1
T EH P IH N,T AE M B IY AH N,1
S UW DH D,S OW B AE D,1
D B AY DH,D DH,1
S M AH S,S S,1
AA ZH,AA R JH,2
AA ZH,AA N,1
 IY CH AH, F AE M AH,1
 IY CH AH, IH T S AH,1
AH N T AY M L,AH L,1
 JH EY N M, Y AE M,1
B AY W,B AH T W,1
B AY W,B AW T W,1
NG HH AA R,NG T AH W AO R,1
R IY T S,R EY N,1
R IY T S,R EY N JH,1
M IY T UW K AE R IY AE,M AE,2
W AH T SH AE L DH,W AA CH DH,1
S B IY,S M IY,1
Z DH AH AE,Z AE,1
AH V B,AH N D B,1
M Z P,M S P,1
P IY S,P EY S,1
S F AH L IY,S,1
 B OW, DH OW,1
OW N Z AH,OW AH,1
T P UW R L,T L,1
L IY AH N,L EY N IH N,1
M M Y UH R,M N IH R,1
UW W AY L,UW F AO L,1
 SH IY HH AE D Y AO R D AA R K S UW T IH N, N,1
S IY W AA SH W AO T ER AO L Y IH,S TH IH,1
 N AA T S ER P R AY Z IH NG L, L,1
L IY DH IH S AH P R OW CH D IH D N,L AE N,1
N AA T W ER K,N,1
 W AH N TH IH NG HH IY TH AO T N, N,1
IH T Y EH T,IH T,1
 IH N SH AO R T, DH AE T,1
T AH N D T UW B AA R OW AE N,T S N,1
N AA R B AO R IY AH L F R EY Z S,N AY S,1
S L AE SH T IH M B ER,S,1
 DH AH S AW N D AH V JH EH N AH F AH R Z B Y UW G AH L S K EH R D DH AH AE N T AH L OW P,,1
 HH AY W EY AH N D F R IY W EY M IY N DH AH S EY M TH IH NG,,1
 DH AH F AA G P R IH V EH N T IH D DH, DH,1
DH EH M F R AH,DH AH,1
AH M ER AY V IH NG AA N T AY M,AH,1
AE F N Z S W IY D IH SH N IY D AH L P OY N T S,AE S,1
S K AA R F M AE CH T,S T,1
T HH ER,T ER,2
ER S K ER T,ER Z,1
ER S K ER T,ER Z G AY D,1
 IY V IH N AH S IH M, EH M,1
M P AH L V OW K AE B Y,M Y,1
L EH R IY K AH,L EY T IH NG AH,1
N T EY,N D G EY,1
EY N Z S IH M,EY M,1
M B AH L Z,M Z,1
M B AH L Z,M,1
M B AH L Z,M ER Z,1
HH AE D Y AO R D AA R K S UW T IH N G R IY S IY,HH IY,1
AA SH W AO T,AA Z L EY T,1
AA SH W AO T,AA R T,1
AA SH W AO T,AA CH M OW T,1
AA SH W AO T,AA CH M AA T,1
N T AE S,N AY S,1
N T AE S,N AW N S,2
AE G L AY K,AE N B AE K,1
D DH AH P,D T UW P,1
IY HH IH,IY IH,1
 IH Z DH, DH,1
ER AH V,ER EH V,1
V AE N AO T IH,V ER K IH,1
S T IH K CH,S CH,1
D AE T F,D AH N D F,1
F AO L T,F OW N,1
 HH IY W IH L AH L AW AH R EH R L AY,,1
R IH SH,R AE SH,1
T AY M F,T AE B F,1
R AE G L AY K,R TH AH M EH R AH K,1
Z AH,Z DH AH,3
AH V AY,AH AY,1
IY AO R W IH M Z IH K AH L,IY,1
 HH IY R, DH AH R,1
ER D DH,ER DH,2
M HH IH,M AH T EH N D IH,1
IH Z HH AE P IY P,IH NG P,1
 M AO R HH IY K UH D T, T,1
T EY K AE,T AE NG DH AE,1
AE T L EH ZH ER,AE N M IY,1
S IH CH,S AH CH,1
CH UW EY,CH AH W EY,1
T IH D N,T UW EH N,1
N IH R DH AH SH,N SH,1
 AH B IH G G OW T AY D L IY AE M B AH L D TH R UW DH AH F AA R M Y AA R D,,1
 IY T IH, AE D IH,2
P IH N,P AE N,2
N AH CH N,N IH SH N,2
TH M,TH AH M,1
M ER AE K Y AH,M EH R AH,1
AH L AH,AH K AH,1
AH S L IY,AH N,1
T W EH L F,T AH F,1
F TH D,F D,1
EY W EH L HH AE V SH,EY SH,1
SH AH B L IY,SH IH P IH NG,1
W AA,W AY AA,1
AA SH W AO T ER AO L Y,AA R Y,1
 D AA N T, DH AE T,2
N D AH D,N D,2
 K IY P DH, DH,1
T S S,T S,2
M P AH,M B AH,2
M P AH,M AH,1
T D AH,T AH,1
T D AH,T DH AH,1
AH Z N,AH N D N,1
R IH M,R AH M,1
R UW V IH,R IH N T IH,1
NG N,NG IH N,1
N UW,N T UW,1
UW T R IH,UW IH,1
L T R IY T M AH N T,L,1
AA SH AH,AA S AH,1
AH Z AA R V,AH S AH V,1
 P AE M G IH, T EH N IH,1
IH V Z,IH Z,1
IH V Z,IH D Z,1
 IH F HH IY EH, DH AH EH,1
SH EH D D,SH IY D,1
N AE,N D AE,2
 D AA N T AE S K M IY T UW K AE R IY AE N OY L IY R, AH R,1
 TH AE, DH AE,1
T L B,T HH AE V B,1
B IY P L EH N,B IH N,1
N T IY T UW IY T B,N AH B,1
 Y UW S, S,1
N T IH,N IH,4
T DH,T IH NG IH N DH,1
AH IH N,AH AH N,1
N F IY L D T UW D UW,N UW,1
N IH T D IH D L,N DH AH L,1
 AA R Y AO R G, G,1
N N AE,N DH AH AE,1
 P R AA JH EH K T D, HH AW Z IH NG D,1
Z P R,Z R,1
Z P R,Z B R,1
Z P R,Z F R,1
IY D IH,IY V IH,1
NG T UW S,NG S,1
S L OW L IY,S AH M TH IH NG,1
 S ER V DH AH K, K,1
 S ER V DH AH K, B IH K,1
AY AE D,AY AH N D,1
D DH AH OY L,D,1
D DH AH OY L,D D IY L,1
SH W AO T ER,SH M AA D ER,3
SH W AO T ER,SH ER,1
SH W AO T ER,SH M AY ER,1
SH W AO T ER,SH AW ER,1
R IY AE N OY L IY R,R IH NG DH AH R,1
L AY K DH AE T,L ER AH N D,1
L AY K DH AE T,L AH N D AH N,1
 D AH, DH AH,1
AH Z S,AH S,1
V AA K,V AW ER K,1
AY W,AY V W,1
DH L,DH AH L,1
SH UH G ER B OW L,SH AH N DH EH M AO L,1
 AH B, B,4
T AY,T UW AY,1
 IY, DH AH IY,1
 AE, DH AE,2
T T W,T S W,1
AY T AA,AY IH NG AA,1
EY W EH L HH,EY HH,1
V SH AH B L,V S IH M P L,1
IH N G R,IH NG K R,1
IH N G R,IH NG R,1
IH N G R,IH NG R EY Z R,1
W AA SH W,W AO T ER W,1
W AA SH W,W AH T Y UW W,1
W AA SH W,W AY F S W,1
W AA SH W,W AY W,1
 B R IH NG M IY DH AH F AY ER K R AE K ER Z,,1
ER SH OW N W UH D P R AH,ER S AH,1
AH V AY D AO L M,AH M,1
M OW S T AE,M AE,1
T F AO L,T K AA L,1
L AW T P R AH,L AH M AH,1
EH K SH,EH N SH,1
 HH IY L, DH AH L,1
D AH N,D IH N,2
N D B R IY DH D F,N F,1
DH AH M AY N IH NG K AH,DH AH,1
N IH Z T UW S,N S,1
S AA L V EH,S AH M EH,2
AH P R AA B L AH,AH M AH,1
 R AE L F K AH N T R OW L D DH AH S T AA P W AA CH F R AH M DH AH B L IY CH ER Z,,1
 DH IH S B R OW SH UH R IH Z P AA R T IH K Y, Y,1
Y AH L ER L IY IH N F,Y UW F,1
R M AH,R AH,2
AH T IH V F AO R AH P R AH S,AH M S,1
EH K T IH,EH N D IH,2
IH V B,IH NG B,2
L AY K,L AE K,1
AY Z L,AY L,1
HH AH N,HH ER N,1
M AW N,M AE N,1
L Z,L,3
 S T IY V, D EY V,1
K EH P T,K AE N T,1
T HH IH Z V IH K,T S P AE NG K,1
K T AH M,K DH EH M,1
T G,T AH G,1
T G,T UW G,1
G AH N,G EH N,1
W AA N,W AH N,1
N AH Z AH,N DH AH,1
N D AE,N AE,2
AE L AH,AE V AH,2
Z AA R T R,Z AH N D R,1
Z AA R T R,Z AH N D D R,1
R AA P IH K AH,R AO NG AH,1
AH L R EH P T AY,AH N D M AE N K AY,1
AY L Z,AY N D,1
R AE G L,R EH D L,2
R AE G L,R AY T L,1
AY K DH,AY T DH,1
AY K DH,AY N Z DH,1
 IH T IH Z AA IH N S, AY S,1
AY R IH NG,AY,1
D S,D N T S,1
D S,D Z AA N S,1
 AE T R, R,1
AH K,AH N D K,2
AH K,AH M AE K,1
R AH SH,R AE SH,1
T AH N,T AA N,1
N D W,N W,1
W AY T,W AH N AE T,1
L EH DH ER,L AE N T AH,1
 R AA B S AE, DH AE,1
T B,T S EH D B,1
AY DH AH,AY Z AH,1
AY DH AH,AY D AH,1
T DH AH S,T UW S,1
R EY,R AY K K EY,1
EY G IY S,EY S,1
 B EH G DH, DH,1
 B EH G DH, DH AH DH,1
DH AE,DH EY TH AE,1
DH AE,DH AH D AY AH G R AE,1
AE T G,AE NG K G,1
AA R D,AA D,1
Z DH AE N,Z AH N,2
N B,N D B,2
R IY S IY W AA SH,R IH Z UW M OW SH,1
SH W,SH AH N W,1
D F EH,D V EH,1
AA R DH,AA N DH,1
L P R,L R,1
R AA D AH K,R EH L IH K,1
S AA R,S AO R,2
D IH S,D AH S,2
R IH B Y AH T AH D,R IY,2
L EH R,L AE R,1
L EH R,L IH R,1
R ER Z,R AH B Z,1
R ER Z,R Z,1
R AH S T S,R S,1
T DH AH P UW R,T,1
HH EH N,HH AE N,1
N AE N,N D AH N,1
B D W,B W,1
UW W ER IH,UW IH,1
N IH T,N AH N D,1
Z P R EH,Z B EH,1
IY ZH HH IY,IY T IY,1
HH AE D,HH ER D,1
HH AE D,HH EH JH ER D,1
HH AE D,HH AH N D,1
F ER M,F AO R M,1
N T AH D B EH,N IY M EH,1
EH V R,EH R,1
M D R,M R,1
OW P L,OW M L,1
R B AE,R M AE,1
EY EH N,EY AH N,1
D AH B R,D R,1
P T L,P AH D L,1
S L IY,S,1
UW D AW ER AO,UW AO R AO,1
W AO T,W AA N T,2
W AO T,W AH T,4
T ER AO,T AH D M AO,1
T ER AO,T AA R AO,4
P IH Z S,P AH S,1
P IH Z S,P S,1
T AH N D DH EH R P,T P,1
M T EH,M G EH S EH,1
N D Z T UW B IY,N IY,1
IY T EH K N AH L,IY TH IH NG L,1
AA JH,AA R JH,1
JH IH K AH L,JH ER,1
 DH AH S K, K,1
K AA L AH P T EH JH IH Z P AA R T IH,K IH,1
IH K Y AH L ER L IY AH P IY L,IH L,1
R EH M P L OY M,R W IH M,1
G OW T AY,G UH D AY,1
L IY AE M,L IH NG HH IH M,1
M B AH L D TH R,M F AO R,1
R UW DH,R DH,1
F AA R,F AO R,1
Y AA R D,Y AH L AH,1
R EH NG,R IH NG,2
NG K TH M,NG Z M,1
NG K TH M,NG M,1
N DH AH T,N T,1
L F TH D EY W EH L HH,L V N OW HH,1
HH AE V SH AH,HH IH M P ER S AH,1
T AE S,T S,1
M IY T UW K AE R,M EY D AH G EH R,1
EY T,EY N T,1
T AO S,T AE S,1
S K,S K K,1
Z HH IY M,Z IH T M,1
M AH G,M G,1
K W AH T,K DH AE T,1
D W AA Z S,D S,1
N D IY,N IY,1
AE K T S,AE N S,1
S AH V S K UW L D,S ER Z D,1
D IH S T R IH K T S,D OW N EY SH AH N Z,1
AY EH N IY K,AY K,1
R AH B,R B,1
T HH IH Z,T AE Z,1
Z V IH,Z B IH,1
IH K T AH M K,IH G K,1
ER D AE T,ER T,1
G AH N P OY N T,G EH T,1
T F AO,T M AO,1
R TH,R DH AE N TH,1
R TH,R T,1
IY AW ER Z,IY AE M,1
 IH G, G,1
G W AA N,G Y UW AH N,1
Z AH N,Z N,1
P IH K AH L R,P T R,1
R K S UW T IH,R M Z IH,1
R IY S IY W,R EY Z IH NG W,1
R IY S IY W,R IH CH IH NG W,1
 W AY SH UH D DH IH S B IY, M AH CH AE Z M IY,1
S AE T DH,S EH D DH,1
Z S W,Z W,1
CH EH S T,CH EY N JH D,1
AH T AA,AH P AA,1
R G AH,R K AH,1
AH T CH AA R,AH N D JH AO R,1
R T K W IH K L IY AH,R D AH,1
N D B R,N R,1
R IY F L,R IH L,1
IY T EH L Z,IY D OW AH Z,1
Z Y UW W,Z N T W,1
W IH CH AE D AH T,W AA N T T,1
T IH V Z D,T UW D,1
UW W AH T,UW,1
R AO,R AH M AO,1
 HH IY W, DH AH W,2
 HH IY W, DH EH R W,1
JH ER Z,JH M IH SH AH N,1
G L AY K DH AE,G W AH N M AE,1
G L AY K DH AE,G M AE,1
OW L ER AE,OW AO R AE,1
V F,V AH F,1
AH D AO R D R AW,AH T ER ER AW,1
AW T,AW N D,1
 D EY, DH EY,1
T AH D,T IH NG,3
T AH D,T IH D,1
N D T R,N F R,1
IH SH P,IH JH P,1
S M ER JH ER,S OW N ER,1
D AA R K S UW,D AO G F UW,3
IY W AA SH W AO,IY M AO,1
AO T ER AO,AO R S M AO,1
AO T ER AO,AO R M AO,1
AO T ER AO,AO R AO,1
L Y IH R,L ER AW ER,1
L Y IH R,L,1
 M EH N IY S K AW ER IH, DH AE T IH Z G OW IH,1
NG P AW,NG AW,1
AW D ER Z N AW,AW T DH AH M AW,1
AW AO L S,AW S,1
OW K AH N T,OW V ER T,1
T EY N F,T AY M F,1
F AA S,F AE L S,1
S F EY T S,S HH UH D Z,1
R AH V DH,R DH,1
UW S IH,UW Z IH,1
R EY N,R AY T,1
 N OW P AH L, L,1
T AH K AH,T AH,1
L AO,L M AO,1
R D,R AH N D,2
R D,R D D,1
R D,R AH D D,1
D ER AO,D M AO,1
M IH Z S,M DH AH S,1
N EY CH ER,N AY T AH N D,1
AA R AH N,AA N,1
N IY V AH,N AH,1
AH N L IY D IH,AH IH,1
IH S T R IH B Y AH T AH D,IH Z,1
 AH L, M AY L,1
L AW L,L D L,1
W EY HH IY R B AH T R,W ER IH N R,1
Z AO L EH R ER,Z AW ER,1
Z AO L EH R ER,Z AA N ER,1
N IH R AH S T S,N ER S,1
G AO G M,G OW M,1
 G R, B R,1
R EH G B AY Z,R AW Z,1
IH K K,IH K,1
K AH T B,K B,1
K S N AH G L,K L,1
EH K T DH AH P UW R,EH G B IH F AO R,1
SH W AO T ER AO,SH HH UW AA R AO,1
SH W AO T ER AO,SH AH L AA N AH N D AO,1
SH W AO T ER AO,SH M AY HH EH R AO,1
 D UW, T UW,1
NG AO R,NG AA R,1
AH M OW T,AH B AW T,1
AH V S,AH Z S,1
S AE M,S EY M,1
M P L IH NG,M,1
AE K S,AE T S,1
S AH D AH N,S IH T IH N,1
N T M,N M,1
AY D,AY D AH N D,1
D T EY K Y,D Y OW Y,1
P IH,P EY IH,1
UW F AY N D,UW B AE D,1
L AY T AO R SH,L AE D ER SH,1
F AY L,F AW L,1
M AY AA D AH,M AW N T AH,1
M Y UH R,M AO R,1
R W ER Y,R AA R Y,1
UW W AY L W,UW AA R W,2
N HH AY R AA R K IY,N AW ER N IY,1
UW AA R,UW AO R,1
R IH,R AE N IH,1
B UH L,B OW L,1
M EH K,M AE K,1
L IH P AH,L IY AH,1
M OW L D AH,M AH AH,1
IH D,IH N,1
 B AA, M AA,1
N D P EY P ER,N AH M ER,1
ER AH,ER IY N AH,1
F AY ER,F AH N,1
 B AE, DH AE,1
AE S K AH T,AE T,1
T B AO L,T IH N V AA L,1
L K AE N,L V D IH N,1
IY AH V,IY HH AE V,1
L L EH D W,L DH AE T W,1
 HH IH Z S AA R K AE Z AH M W AA Z F AA L OW D B AY AH S T UW P AH D G R IH N AH V HH IH Z TH IH K M AW TH AH N D B AE D T IY TH,,1
IY T AA,IY N AA,1
ER T UW K UH K W,ER DH AE N L ER N W,1
SH UH G ER,SH ER,1
SH UH G ER,SH AH N,1
SH UH G ER,SH UW Z,1
ER,ER M AH N,1
B AA G G,B AO L G,2
B AA G G,B AH G,2
IY IH N,IY AH N,9
N AO T AH M,N D AA N HH IH M,1
NG IH F F,NG AH F,4
NG IH F F,NG AH N D F,3
L IY R AE G L AY K DH,L ER AW N D DH,1
 DH AH P L EY N T AH, W AY AH,1
DH EY K EY,DH AH G EY,1
AH P AA N,AH B OW N,1
AH P AA N,AH N D B OW N,1
IY T AH,IY D AH,1
R AE T W,R IH N W,1
T R IH M,T ER M,1
EY EH K,EY AE K,1
S K L,S P L,1
S IY M,S EY M,2
AH K OY L,AH G OW L,1
V K L EY,V M AY N,1
 T R AH D IH SH AH N R, R,1
T SH UH G ER,T CH IH L D R AH N,1
AA G G,AA G,2
G EH T,G IH T,4
AE F D,AE P D,3
AE F D,AE S T D,2
AE F D,AE T D,1
 SH IY HH AE D Y AO, M AO,1
 SH IY HH AE D Y AO, N AO,1
R D AA R,R F R,1
R D AA R,R N AO R,1
R D AA R,R UW N AO R,1
R K S UW T IH N,R AH M W AH N,1
R K S UW T IH N,R JH AH N,1
N G R IY S IY W AA,N AA,1
N T AE S K M IY T UW K AE R IY AE N OY L IY R AE G L AY K DH AE T,N ER Z,1
Z K AA N,Z T R AE N,1
L EH N,L AH N,1
N T R AH P IY,N D,1
 DH AH K L IH R L IY AY D EH N T AH F AY AH B AH L EH N AH M IY K AH N T IH N Y UW D AA N AE Z IH F N OW W AH N EH L S W ER ER AW N D,,1
 K AA M P ER AH B AH L T R EH N D Z K AE N B IY N OW T AH D EH L S W EH R,,1
 T R AH, DH AH,1
 T R AH, AH,1
SH AH N R,SH M AA R,1
R IY K W AY ER Z,R Z,1
Z P ER EH N,Z AH N,1
N T AH L AH P R,N D F R,1
R UW V AH,R AH,1
AH L F AO R,AH N T R,1
N D ER,N ER,1
ER EY JH M EH R IH JH,ER,1
IH T S HH EH L,IH L,1
L TH IY ER T UW K UH K W IH TH AW T SH UH G ER,L D R AH N,1
B AA G G EH T,B AO L IH T,1
N AO T,N D AW T,1
T AH M,T,1
M AY L,M EH L,1
Z AH P AA,Z AA,1
 M AA, AA,2
AA M,AA R M,2
R AO NG,R AA NG,2
NG L IY D IH S L AY K S AE P AH T AY Z ER Z,NG,1
S UW T IH N G R,S IY B R,1
 IH T K, DH EY K,1
OW L Z,OW Z,1
S EH L F,S OW,1
OW T AH,OW N AH,1
T AH L UH R,T AA N DH EH R,1
R W IH M,R AH M OW M,1
IY AO S,IY L AE S,1
Y EH T R,Y AE R,1
B Y UW G AH L S,B IY S,1
B Y UW G AH L S,B IY IH NG S,1
D DH AH,D AH,2
D DH AH,D R AH,1
AH AE N,AH N,2
AH AE N,AH AH N,2
N T AH,N D AH,2
 HH AY, AY,1
IH D DH,IH NG DH,1
IH D DH,IH N DH,1
N Z S,N IY S,3
N Z S,N S,2
N Z S,N AY S S,1
N Z S,N T S,1
R F M,R M,2
S IH M,S EH M,2
B AH,B L AH,1
W IY M EY,W EH N DH EY,1
HH IH Z,HH AE Z,1
Z P R AA B L AH M W,Z W,1
T B AH T DH,T W IH DH DH,1
AE T HH IY R AH F Y UW Z D T R IY T M AH N T,AE T,1
 W IY K AE N G EH T IH T IH F W IY D IH G HH IY S EH D P EY SH AH N T L IY,,1
 D UW W, W,1
AH L K L,AH L,1
L AO TH S,L,1
N IH Z T,N T,3
EH K S T R AH P,EH N IY P,1
W AO R W AO,W AA Z M AO,1
R M F L IY S,R S,1
S IY W UH L,S IH M AH L,1
L AH N,L ER N,2
L AH N,L IH N,1
OW V ER AO,OW N F AO,1
AO L Z,AO R AW ER Z,1
R AE L F K AH,R AO TH M AH,1
R AE L F K AH,R UW T AH,1
N T R OW L D,N D,1
D DH AH S,D AA N T S,1
CH F R AH M DH,CH IH NG DH,1
AH B L IY CH ER Z,AH N UW Z,1
Z P AA R T IH K Y AH,Z D AE NG G AH,1
AH L ER L,AH L,1
L IY IH,L IH,2
IH N F,IH NG F,1
AH T IH V F AO R P R AH S,AH M S,1
K DH,K AH N D DH,1
EY L B IY AH,EY DH AH,1
AH G UH D N,AH AA N,1
N UW Z D,N S AH N D,1
P AW T,P AE T,1
T AH D AH M,T IH N M,1
M AW TH,M AE TH,1
TH F UH L AH V W,TH AA N AA N W,1
 T UW M, M,1
IY W AO,IY M AO,1
M F L,M L,1
M F L,M P L,1
W UH L,W IH L L,1
W UH L,W EH L,1
W UH L,W AY L,1
S T AA,S L AA,1
AA P W AA CH F,AA JH IH K F,1
F AO R M,F AA M,1
AH T IH V F,AH G EY M F,1
W AY CH,W AH N CH,1
IY F AO R S,IY L AE S,1
S AH CH G AA,S T N AY T D AA,1
R B IH,R L IH,1
IH JH,IH NG,1
 S UW N DH, DH,1
AH HH EH N,AH IH N,1
N D AO,N AO,1
D HH,D T UW HH,1
DH AE N N,DH AH N,1
N AE N S AH Z,N IY D Z,1
K OW L S L,K AO Z L,1
L AA AE F T ER AY AE D,L AW D AH N D,1
AH OY L,AH N EH N IY M AO R,1
P R AA,P AA,1
AA B L AH M G,AA P G,1
G R OW,G OW,2
NG IY CH D,NG IH N S T EH D,1
D EY,D,1
 IH N, AH N,1
N W,N D W,1
N D IH D DH,N DH AE T DH,1
K IH,K L IH,1
D N AH S,D DH IH S,1
 IH T, DH AE T,2
AY S,AY V S,1
AY S,AY Z,1
Y AO R D AA,Y UW N AA,1
IH N G R IY S IY W,IH NG DH AH W,1
 D AA N T AE S K M, M,2
 D AA N T AE S K M, DH AH EH G Z M,1
S IY N G OW S T L,S EY M AE Z L,1
K R AY F AH L M AH N,K W AA Z N,1
DH AH TH,DH AE N TH,1
 IH T S, S,1
 AE N, N,1
N AA K T IH L Y AH,N OW AH,1
N AE T AH M Z N AW L EH T AH S S,N D S,1
D AH V JH EH N AH F AH R Z,D W AA Z,1
Z B Y UW G AH L S,Z S,1
N T AH L OW P,N D,2
 HH AY W EY AH N D F R, L IY V R,1
R IY W EY M,R UW M,1
M IY N,M IH N,1
M TH IH NG,M N EY M,1
AH F AA G P R IH V,AH TH AO T AH V,1
V EH N T,V IH T,1
T IH D DH,T AE T DH,1
T IH D DH,T DH,1
EH M F R AH M,EH M,1
AE F N Z S,AE T S,1
AE F N Z S,AE P T L IY S,1
AE CH T,AE S T,1
 IY V IH N AH, DH AH,1
AH S IH M P AH L V OW K AE B Y AH L EH,AH DH EH,1
EH R IY K AH N T EY N Z S IH M,EH M,1
K T AA,K G AA,1
HH AH B W,HH AE V W,1
T IH L,T EY L,1
 OW DH, DH,1
HH AW Z IH,HH AE V IH,1
S AA R AH V M,S M,1
M K AH N,M IH N,1
S K W OW T W,S W,2
R IY T R AE K,R IH JH EH K,1
DH AE N,DH IH N,2
N AH P AA L AH,N DH AE T AH,1
AH JH IY,AH M AW N T,1
AH JH IY,AH N TH,1
HH EH L P G,HH AE V G,1
T UW P IH,T B IH,1
IH K AH P EH K,IH G K,1
AH V P AH T,AH N T,1
R AE G L AY,R AY Z ER IH M D AY,1
AW AH D,AW D,1
 P R AH, DH AH,1
P R,P AA R,1
R AY AH T,R T,1
R AH S,R S,1
R AH S,R IH S,1
R AH S,R EH S,1
S EH M,S IH M,1
L D IH,L Z IH,1
OW L D,OW D,1
 P IY T S ER IY, DH AH EH R IY,1
Z AA R K AH,Z AH,1
N V IY N Y AH,N D DH AH,1
 D R AA P F AY V F, DH AE T DH AE T F,1
OW AW T,OW AH N D,1
OW AW T,OW,1
M IY T,M IH N AH T,1
M IY T,M AH N T,2
AY P IH K,AY TH AE NG K,1
OW L D B,OW N B,1
R D ER,R N ER,1
ER OY K,ER AA N K,1
OW T AH N,OW N,1
OW K T,OW,1
AY D L,AY T L,1
IY AE M B,IY L EY B,1
L D TH,L TH,1
 AE T T W AY L AY T AA N DH AH T W EH L F TH D EY W EH L HH AE V SH AH B L, S IH M P L,1
S UW T IH N,S IY N,1
 Y UW W UH D D R AY V AH S IH N T UW SH EY M HH IY D IH K L EH R D,,1
Z B AH L JH D,Z P AW N D,1
D D,D Z D,1
K F AH N AH L,K,1
 F OW L D IH N T UW W IH P T K R IY M AH N D AE D AH D AE SH AH V S AO L T AH N D S P R IH NG K L IH NG AH V P AE P R IY K AH,,1
DH AH M IH,DH IH,1
Z R IY T R AE K T AH,Z AH,1
 M AY K AH L, P L,1
L K AH L ER D DH AH B EH D R UW M W AO L W IH DH K R EY AA N,L AE N,1
 HH EH L P G R EH G T UW P IH K AH P EH K AH V P AH T EY T OW Z,,1
 SH EY, S EY,1
EY OW N,EY AA N,2
R D AA R K S UW T IH N G R IY S IY W AA SH W AO T,R AY T,1
T ER AO L Y IH R,T,1
S AH P EH,S EH,1
M UW V M AH N,M AE N,1
N T SH IY M,N Y UW M,1
EY D S,EY S,1
M D AH N N,M DH AE T N,1
 HH IH Z HH IH S T ER IY IH Z HH IH Z AH L OW N Y EH T IY CH M AE N M AH S T R EH K AH G N AY Z HH IH Z OW N HH IH S T ER IY IH N IH T,,1
K W OW T,K L AW D AE T,1
T W AA Z R,T L AH S R,1
AY K AH L K,AY K,1
L ER D DH,L DH,1
 HH EH L P G, G,1
G T,G AH N D T,1
T UW P IH K,T EY K,1
K AH V P AH,K IY D AH,1
AH T EY T OW Z,AH,1
DH EY OW N,DH AH AA N,1
 L AY T AH, DH AH,1
Z G L,Z K L,1
OW D,OW Z D,1
D JH UW,D T UW,1
UW AH L B R,UW T R,1
T TH R UW,T UW,1
N P AO R,N,1
 S AE L V EY, DH AH B EY,1
EY SH AH,EY S AH,1
N R,N D R,1
N R,N AH L R,1
T OW V,T AH V,1
V ER L,V IH L,1
L UH K,L EH K,1
T DH AH OW SH AH N,T IH V Z,1
Z D IH,Z S T IH,1
Z AH P B,Z B,1
HH EY V,HH AE V,3
V AH N,V B IH N,1
V AH N,V EH N,1
V AH N,V AE N,1
IY HH AE D,IY EH N D,1
S ER Z,S AH Z,1
ER IH N,ER AH N,1
N IH N,N AH N,1
N V,N D V,1
P AO R SH,P OW SH,1
EY T IH NG AE,EY D IY OW AE,1
IY AH N,IY IH N,1
Z AH SH,Z IH Z SH,1
T AH V,T HH AE V,1
B IY IH,B IH,2
IH NG B,IH N B,1
L IH S,L EH S,1
S AH N D IH,S IH NG IH,1
 CH IY, K IY,1
 CH IY, SH IY,1
T AA K IH NG Z,T M IY N Z,1
M TH EY R W AO R,M DH EH R,1
IY TH S,IY CH S,1
 D AA, DH EH R AA,1
AA N T AE,AA R AE,1
L AY F T,L AA T,1
T EH N AH,T AH V AH,1
N T Y,N D Y,1
D AH K T,D N T,1
AW AH B,AW B,1
B AH L D,B OW TH D,1
D D IH P,D DH AH P,1
P L,P AH L,1
IY SH AH N,IY S,1
 G EH T IH NG DH, Y AE DH,1
HH EH L P Y UW,HH IH M,1
 L UH K AE T DH AH TH IH NG Z W IY D UW T UW IH S K EY, G EY,1
EY P AW ER F,EY M AO R F,1
D T UW F ER G,D G,1
 AA B JH EH K T, IH T,1
V P,V K AH M P,1
ER AA R B Y UW,ER N UW,1
UW T AH F AH L,UW Z,1
IH N DH,IH NG DH,1
S AH N,S AY D,1
S AH N,S IH N,1
AA K IH NG Z R,AA R T AH D R,1
M TH EY,M DH EY,1
EY R,EY AA R,1
 D AA N T D UW CH, CH,1
 D AA N T D UW CH, DH AH CH,1
 K AE L S IY AH M M EY K S B, B,1
Z AY B R,Z IH M R,1
AW M,AW N D M,1
 R EH, V EH,1
S AO F AH,S AH P AH,1
D T UW AE,D AE,1
