D Y AO R D,D HH ER D,18
D Y AO R D,D EH N D,1
D Y AO R D,D D,7
D Y AO R D,D AH D,11
D Y AO R D,D N OW D,3
D Y AO R D,D ER AW Z D,1
D Y AO R D,D T UW D,1
T IH N,T AH N,18
T IH N,T EY N,2
T IH N,T N,1
T IH N,T AY N,1
T IH N,T AA N,1
N G R,N D B R,2
N G R,N R,5
N G R,N D R,5
N G R,N K R,8
N G R,N B R,1
N G R,N AO R,1
N G R,N P R,1
IY S IY W AA SH W,IY DH D W,1
IY S IY W AA SH W,IY Z AE T W,1
 D AA N T AE S K M, DH AH HH ER M,1
 D AA N T AE S K M, EH Z M,1
 D AA N T AE S K M, AH M,1
 D AA N T AE S K M, M,1
M IY T,M EH T,1
M IY T,M T,1
M IY T,M AH T,2
T UW K,T IH K,2
T UW K,T K,1
T UW K,T DH AH K,1
K AE R IY,K AH L IY,1
IY AE N,IY AH N,12
IY AE N,IY D OW N,1
IY AE N,IY EY SH AH N,1
IY AE N,IY AA N,5
IY AE N,IY W AH N,4
IY AE N,IY OW N,3
IY AE N,IY IH NG AA N,1
IY AE N,IY IH NG OW N,1
IY AE N,IY N,2
IY AE N,IY IH T AA N,1
IY AE N,IY IH N,2
IY AE N,IY D AA N,1
N OY L,N D R IH L,1
N OY L,N ER L,3
N OY L,N T AH L,1
N OY L,N AH L,3
N OY L,N L,9
N OY L,N D W AO L,1
N OY L,N AE L,1
N OY L,N OW N L,1
N OY L,N AO L,1
N OY L,N EH L,1
AE G L,AE N L,1
AE G L,AE T L,2
 HH IH, DH IH,1
IH Z K AE,IH S HH AE,1
P T AH,P AH,1
N W AA Z TH IH,N D B IH,1
IH N AH N,IH L N,1
N D HH AE G ER D AH,N AH,1
AH N D,AH D,4
AH N D,AH S,1
D HH IH,D IH,1
IH Z B Y UW T AH,IH N AH,1
AH F AH,AH B AH,1
S W ER W AO R,S AA R,1
R N AH N D SH,R SH,1
DH IH S,DH AH S,2
S D AY,S AY,1
AY V S,AY D S,1
N M EY F AO L,N P OW L,1
L F AA R,L EH R,1
R B IH L OW EH K S P EH K T EY,R IY Z EY,1
N Z,N,9
N Z,N T S,1
 P IY, HH IY,5
IY T S,IY S,2
IY T S,IY,2
ER IY AH Z AA R K AH N V IY N Y AH N T,ER CH T,1
T F AO R,T EH R,1
AH K W IH K L AH,AH T AH,1
N CH,N S,1
N CH,N,1
 P UH T, B AH T,2
 P UH T, W AH T,1
UH CH ER B L AA K T EY,UH SH R EY,1
EY B AH L IH N,EY N,1
N DH AH G ER,N JH ER,1
ER AA ZH,ER AE Z,1
ER AA ZH,ER EY JH,1
ER AA ZH,ER Z,1
ER AA ZH,ER,1
 D R, B R,1
 D R, R,1
R AA P F AY V F AO,R AO D HH AO,1
R M Z,R N Z,1
Z IH N DH AH,Z AO F AH,1
Z IH N DH AH,Z AH,1
AH B AA K S,AH S,1
AH B AA K S,AH L AE S,1
AH B AA K S,AH AH S,1
S B IH F AO,S AH V AO,1
R Y UW G,R AH G,1
R Y UW G,R HH IY G,1
G OW AW T,G AH N,1
G OW AW T,G R UW AH P,1
 HH ER W, AH W,1
R D R,R G R,1
OW B K AH N S,OW S,1
S IH S T S AH V OW N L,S IY L,1
L IY S K ER T S AH,L AH,1
AH N,AH R Z IH N,1
AH N,AH,1
AH N,AH IH N,3
AH N,AH N IH N,1
AH N,AH S IY N,1
N D B L AW S,N M AE S,1
F AH N IH K S K L UW D AH D,F ER D,1
 SH IY, HH IY,61
D Y AO R D AA R K S,D HH ER AE T S,1
D Y AO R D AA R K S,D T UW G OW S,1
D Y AO R D AA R K S,D HH ER S,2
D Y AO R D AA R K S,D HH ER G AE S,1
D Y AO R D AA R K S,D AH S,3
D Y AO R D AA R K S,D P ER S,1
D Y AO R D AA R K S,D AE S,1
S UW T IH,S OW IH,5
S UW T IH,S IH,5
S UW T IH,S N IH,2
S UW T IH,S IY IH,1
S UW T IH,S OW R IH,1
S UW T IH,S IY N IH,1
R IY S IY W AA SH W,R EY W,1
R IY S IY W AA SH W,R OW Z W,4
R IY S IY W AA SH W,R EY K W,1
L Y IH R,L HH ER,16
L Y IH R,L AH S,1
L Y IH R,L,11
L Y IH R,L DH EH R,1
L Y IH R,L IY,2
L Y IH R,L AH R,1
L Y IH R,L Z,1
L Y IH R,L OW,1
L Y IH R,L DH AH,1
L Y IH R,L AY,1
 D AA N T AE, AE,65
 D AA N T AE, HH IY AE,3
 D AA N T AE, DH AE,1
 D AA N T AE, G AE,1
 D AA N T AE, S OW AE,1
 D AA N T AE, P AE,1
 D AA N T AE, HH IY HH AE,3
 D AA N T AE, HH AH R AE,1
 D AA N T AE, AY AE,4
 D AA N T AE, DH AH M AE,1
 D AA N T AE, DH AH AE,1
 D AA N T AE, AY HH AE,3
 D AA N T AE, L AE,1
 D AA N T AE, M AE,1
 D AA N T AE, DH AH L AE,1
 D AA N T AE, Y AE,1
AE S K M IY T UW K,AE Z DH AH K,8
AE S K M IY T UW K,AE Z K,2
AE S K M IY T UW K,AE Z AY K,2
AE S K M IY T UW K,AE Z IH N K,2
AE S K M IY T UW K,AE Z B IH N K,1
AE S K M IY T UW K,AE K,1
AE S K M IY T UW K,AE Z AH K,1
R IY AE N OY L IY R,R IH JH R,1
R IY AE N OY L IY R,R R,1
R IY AE N OY L IY R,R AH R,1
R AE G L AY,R AY,4
R AE G L AY,R EH D M AY,1
R AE G L AY,R AH N AY,1
AY K DH,AY T DH,4
AY K DH,AY N DH,3
AY K DH,AY DH,3
 HH AH S K IY Y AH NG M AE, AE,1
AE N,AE Z ER N,1
AE N,AE T AO F AH N,1
N HH IY S,N IH S,1
S EH D W,S T W,1
M AA K D IH S T,M AO R T,1
T EY S T,T AH L,1
AA HH AA,AA AA,1
AA HH IY TH AO T AH,AA AH,1
AH L AH,AH R AH,1
AH L AH,AH T AH,1
SH D AH,SH AH,1
V AO,V HH AO,1
S IY AE,S AE,1
 DH, AE Z DH,1
 DH, HH IY DH,1
DH AH S T,DH AE T,1
T EH,T R EH,1
EH K N IH K,EH K,1
L IH F IH SH AH N S,L EH K T S,1
S IY IH Z AH,S DH AH,1
AH CH IY V D AE,AH AE,1
AH IH K S P,AH P,1
P EH N S,P EY S,1
V AE,V DH AE,1
AE K CH AH W AH L IH,AE T IH,1
 AA B JH EH K T S M, HH IY M,1
 AA B JH EH K T S M, AY M,3
 AA B JH EH K T S M, AE Z M,1
AH V P Y UW T ER AA R,AH HH IH R,1
R B Y UW T AH F AH L,R OW IH K,1
R B Y UW T AH F AH L,R,1
NG D UW AA N,NG N,1
N DH AH,N IY AH,1
N DH AH,N AH,4
N DH AH,N T AH,1
N DH AH,N HH EH R AH,1
AH S P AY D ER W EH B G L,AH T AA L,1
L IH S AH,L AH M AH,1
AH N D IH N DH,AH S DH,1
 CH IY, SH IY,6
IY P S T,IY K AH N T,1
IY P S T,IY T,1
T AA K IH,T IH,1
IH NG Z,IH N Y UW Z,1
Z R AH N DH,Z T UW DH,1
AH F ER S T T AY M TH EY R W,AH W,1
R N,R,4
 D AA N T D UW CH AA R L, AY K AO L,1
 D AA N T D UW CH AA R L, K AE L,1
L IY Z D ER T IY D,L D,1
D IH SH AH Z,D,1
 K AE L, S AA L,1
L S IY AH,L AH,2
AH M M EY K S B OW N,AH N,2
N Z AH,N AH,3
AH N D T IY,AH S IY,1
IY TH S,IY AH S,1
S T R AO NG,S,1
D Y AO R D AA R K S UW T IH N G R,D V EH R,1
IY S IY W AA SH,IY EY SH,1
SH W AO T ER AO L Y IH R,SH AH N,4
SH W AO T ER AO L Y IH R,SH AH N D,1
SH W AO T ER AO L Y IH R,SH AY N,1
 D AA N, N,4
 D AA N, W AH N,3
 D AA N, HH EH N,1
 D AA N, AY N,1
 D AA N, AE Z N,1
 D AA N, IH N,2
N T AE S,N OW D EH S,1
S K M IY T UW K,S AH K,1
S K M IY T UW K,S OW DH AH K,1
S K M IY T UW K,S K,1
K AE R,K R,3
K AE R,K AA R,5
R IY AE N,R EY SH AH N,1
R IY AE N,R EH N,1
R IY AE N,R N,4
R IY AE N,R AH N,1
R IY AE N,R OW N,1
R IY AE N,R AH L IH N,1
N OY L IY R AE G L AY K DH AE T,N,7
N OY L IY R AE G L AY K DH AE T,N T,1
N OY L IY R AE G L AY K DH AE T,N AH T,1
N OY L IY R AE G L AY K DH AE T,N EH V ER AH,1
 IH N W EY JH N AH G OW SH, R AE SH,1
IY EY,IY OW S AH N EY,1
IY EY,IY Z EY,1
N Z DH AH IH,N IH,1
IH N D AH S T R IY B,IH Z B,1
G AH N Z AE Z AH Y UW N,G IH N,1
N AH T W IH DH AH S IH,N IH,1
NG G AH L Y UW N Y AH N,NG,1
 HH IY V AA N, W AH N,1
N DH OW Z,N HH AE Z,1
R OW P S DH AH B OW T S K AH M AH N S,R AA CH EH S,1
T AH K,T ER,1
T AH K,T K,1
 M AH T IH R, HH IY R,1
R IY AH L Z S,R S,1
S ER AE M IH K M,S AH M,1
M AA D AH L IH NG K L EY R EH D W,M W,1
W AY T AO R B AH,W AH,1
AH F,AH N,1
 AA R T, CH AE T,1
 AA R T, ER IH S T,1
T AH F IH SH AH,T AH,2
L IH N,L IY N,1
L IH N,L,1
L IH N,L AH N,2
N T EH L AH JH AH N S IH Z F AO R R IY L,N AY,1
 DH AH S, S,8
 DH AH S, Y EH S,1
S M AO L B OY P UH T DH AH W,S W,1
W ER M AA,W AA,1
W ER M AA,W AO R AA,1
AA N DH AH HH UH K,AA L OW,1
 AH CH OW Z AH N F Y UW W, SH IY W,1
B IH K,B IY K,1
K AH M JH EH,K AA N T EH,1
N ER AH L Z,N T,1
N ER AH L Z,N,2
 OW N L, AO L,1
L IY DH,L DH,1
K AA M P L IH SH T AA,K AH N F Y UW Z D AA,1
T S AH B T EY N P AA P Y AH L,T IH K L,1
L EH R AH T IY,L IY,1
L EH R AH T IY,L,1
L EH R AH T IY,L ER,2
 DH AH F IH SH B IH G AE N T UW L IY P F R AE N T AH K AH L IY AA N DH AH S ER, AY W EH ER,1
F AH S AH V DH AH S M AO L L EY K,F OW R,1
R D AA,R G AA,4
R D AA,R M AA,1
R D AA,R AH G AA,9
R D AA,R EY G AA,1
R D AA,R K AA,1
R D AA,R IH G AA,1
R K S,R D Z S,1
R K S,R D S,1
R K S,R S,19
R K S,R EY S,1
R K S,R T S,3
R K S,R D T UW S,1
R K S,R D AH D S,1
S UW T IH N G R IY S,S AH M EH S,1
S UW T IH N G R IY S,S OW S,1
S IY W AA SH W AO T,S T,10
S IY W AA SH W AO T,S AH S AY T,1
S IY W AA SH W AO T,S IH P IH T EY T,1
S IY W AA SH W AO T,S IH NG AE S T,1
Y IH R,Y UW,3
Y IH R,Y ER,2
N T AE S K M,N M,1
M IY T UW K,M EH D AH K,1
K AE R IY AE N OY L,K AH L,1
K AE R IY AE N OY L,K L,1
L IY R,L R,7
L IY R,L DH AH R,2
L IY R,L AY R,2
L IY R,L EH R,1
L IY R,L AH R,2
L IY R,L DH EH R,1
R AE G L,R EH D L,4
R AE G L,R AH B AH L,2
R AE G L,R AH L,1
R AE G L,R L,4
R AE G L,R EY AH L,1
R AE G L,R AY T L,1
R AE G L,R EH D AH L,1
R AE G L,R IH L,1
R AE G L,R EY JH L,1
R AE G L,R D ER D L,1
R AE G L,R D EY L,1
 D AE N S AH Z AO, AO,1
L T ER N,L IH N,1
N EY T,N T,1
T AH D W IH DH S AH,T OW N AH,1
AH NG AO,AH T F AO,1
R S P OW K AH N V ER S AH Z,R,1
 M AY F AA DH, AH DH,1
ER R AE N,ER M EH N,1
N HH IH,N IH,1
IH M AO F HH IY R S IH K S Y IH,IH N AH DH ER IH,1
 HH IY R HH, HH,1
Z K W AY T,Z B AH T,1
T P ER S W,T HH IY W,1
W EY S IH V L,W AA Z OW N L,1
IY DH AH,IY AH,1
IY EH M,IY M,1
M B AA,M AA,1
D IY M AH,D ER AH,1
AH N T,AH T,3
AH N T,AH R,1
T AH V M IY N N AH S AH N D S L,T L,1
N AH S,N,1
N AH S,N Z,1
DH AH K AE,DH AE,1
T S M IY AW,T N AW,1
T S M,T M,1
 K L IH F W, DH AE T W,1
UW DH D B,UW N B,1
B AY DH AH,B AH,1
AH L AH G ZH ER,AH JH ER,1
AH L AH G ZH ER,AH T ER,1
AH L AH G ZH ER,AH D ER,1
ER IY AH S,ER AA S,1
ER IY AH S,ER IH S,1
S M AH S AA ZH,S EY JH,1
S M AH S AA ZH,S T,1
S M AH S AA ZH,S IH V,1
 IY CH AH, AH,1
 IY CH AH, K AH,1
N T AY,N D F AY,1
N T AY,N HH AY,1
AY M L,AY N AH L,1
K AH M,K UW M,1
M L AO S,M AE S,1
M L AO S,M AA S,1
S K OW AH N S AY D AH D W,S IY W,1
DH DH AH B R,DH G R,2
EY K D,EY T D,2
D AW N,D OW N,1
D AW N,D AO N,1
N AH V AH HH IY T,N EY T,1
IH S,IH N S,1
S T AH,S DH AH,1
S T AH,S AH,4
AH M P,AH P,1
 JH EY N M, AY M,1
 JH EY N M, HH IY M,1
 Y AH NG S T, AE N T,1
T ER Z L AH,T AH,1
AH V K AA M AH N K,AH L OW P K,1
N D IY AE Z T,N T,1
T R IY T,T AA T,1
T S,T AH,2
T S,T,7
T S,T IH V,1
D AA R K S UW T IH N G R,D AO R,1
D AA R K S UW T IH N G R,D HH ER P AE R,1
R IY S,R S,1
R IY S,R AH S,3
R IY S,R EY S,7
R IY S,R IH S,1
R IY S,R AY Z M AE S,1
T ER AO L Y IH R,T,4
T ER AO L Y IH R,T EH R,1
T ER AO L Y IH R,T AH R,2
T ER AO L Y IH R,T R,2
T ER AO L Y IH R,T IY,2
T ER AO L Y IH R,T AH,1
T ER AO L Y IH R,T AH N,1
T ER AO L Y IH R,T AH D,1
T ER AO L Y IH R,T AH HH IY R,1
 D AA N T AE S K, DH AH K,3
 D AA N T AE S K, AH K,1
K M IY T UW K AE R,K AA R,2
K M IY T UW K AE R,K EH R,4
K M IY T UW K AE R,K Y UH R,1
K M IY T UW K AE R,K W AH D AO R,1
R IY AE N OY L IY,R T W IY,1
R IY AE N OY L IY,R IY,2
R IY AE N OY L IY,R UW AY AH D IY,1
R IY AE N OY L IY,R EH D IY,1
IY R AE G L,IY L,1
IY R AE G L,IY D L,1
IY R AE G L,IY AH L,1
IY R AE G L,IY AH N L,1
L AY K DH,L DH,8
L F D AH N EH N IY TH IH NG F,L F,1
F AO R W,F W,1
IH CH T,IH T,1
T UW B IY HH EY T AH D W IH CH AH V AH,T N AH,1
S HH AE Z,S T,1
 B IY IH, IH,1
D AH N D D AA N T AY D EH N T AH,D G OW B AH,1
AH F AY Y ER S EH L,AH L,1
L F,L,1
IY K OW AH,IY P AE L AH,1
AH N S AY D,AH D,1
AH D W IH DH M AY F,AH T IY F,1
ER Z B,ER B,1
 DH AH B AH NG G AH L OW W, AE Z W,1
Z P L EH,Z HH EH,1
Z AH N T,Z IH T,1
T L IY S IH CH UW EY,T EY,1
D N IH,D IH,1
IH R DH,IH N DH,1
R,R T,1
R,R D ER,1
R,R Z,1
R,R IY AH,1
R,R AE F T ER,1
R,R AH N,1
R,R D AH D,2
R,R HH ER,1
 AA, AY W AA,1
AA R Y UW L UH K IH NG F AO R EH M P L OY M AH N T,AA Z,1
 AH B IH G G OW T AY, HH IY AY,1
IY AE M B,IY EY B,1
L D TH R UW,L T UW,1
UW DH AH F AA R M,UW HH OW M,1
M Y AA R D,M ER,1
 IY T IH, F IH,1
 IY T IH, IH,3
IH NG S P IH,IH N IH,1
IH N AH CH N AY,IH SH T L AY,1
IY IH N K,IY EH K,1
K R IY S AH,K AH,1
AH Z S T R EH NG K TH M,AH N AA M,1
M ER AE K,M IH K,1
K Y AH L AH S L,K L,1
 AE T T W, AH W,1
 AE T T W, W,2
W AY L,W IH L,1
W AY L,W EH L,1
L AY T AA N,L Y AH M S AH N,1
DH AH T W EH L F TH D EY,DH EY,1
W EH L,W IH L,4
SH AH B L IY,SH UH D,1
SH AH B L IY,SH IH P,1
SH AH B L IY,SH EH D,1
AE D Y,AE Z Y,1
AE D Y,AE V Y,2
T IH N G,T G,3
IY R AE G,IY AH G,1
IY R AE G,IY G,1
L AY K DH AE T,L IH T,1
L AY K DH AE T,L D IH D,1
L AY K DH AE T,L,7
L AY K DH AE T,L AH N T,1
L AY K DH AE T,L EY T,2
T,T ER,4
T,T AH,3
T,T S,1
T,T AH S,1
T,T IY,2
T,T AH N,1
T,T UW,1
IY IH Z,IY AE Z,1
R D EH N,R T AH N,1
AH S P ER M,AH V F AO R M,1
AH EH G S,AH EY T S,1
AY Z D,AY D,1
D S IY D,D Z,1
 HH AW D IH D W, DH EH N W,1
D AA G Z D IH,D UW IH,1
IH D S,IH T S,1
IH D S,IH S,1
NG T UW W,NG W,1
N Z IY,N IY,1
G OW,G ER,1
 DH AH B EH S T W, AE Z W,1
M Z,M,3
M Z,M P OW Z,1
 SH IY W AO R, Y UW AA R,3
M F L,M L,1
M F L,M P L,2
S IY W UH L,S AH L,1
L AH N,L AE N,1
L AH N,L N,1
N OW V,N AH V,1
V ER AO L Z,V AH,1
AH B L,AH L,2
AH B L,AH N L,1
IY CH ER,IY D ER,1
S B R OW SH UH R,S P R,1
S B R OW SH UH R,S Y UW R,1
Z P AA R T,Z ER V AH T,1
Z P AA R T,Z T,1
T IH K Y AH L ER L IY,T OW R IY,1
T IH K Y AH L ER L IY,T UW Z D IY,1
AH T IH V,AH V,1
V F AO R AH,V DH AH,1
AH P R,AH R,2
AH P R,AH V K R,1
AH P R,AH Z AA R,1
R AH S,R IH S,2
R AH S,R S,1
AY ER,AY,2
AY ER,AY N,1
 W AY, AY,7
AY CH AA R,AY K EH R,1
R JH M,R M,1
D Y AO R,D R,26
D Y AO R,D M AE R,1
D Y AO R,D D EH R,1
D Y AO R,D HH ER AE R,1
R D AA R K S UW T,R IH T,2
R D AA R K S UW T,R IY P EY T,1
N G R IY S IY W,N D W,2
N G R IY S IY W,N JH W,1
W AA SH W,W IH DH W,7
N T AE S K M IY T UW K AE R,N V EH R,1
N T AE S K M IY T UW K AE R,N R,1
IY AE N OY,IY OY,6
N D AA M,N EH M,1
N T S T,N T,1
T R EH S S IH M P L,T L,1
D IH K,D AH K,1
T S AH,T AH,8
T S AH,T ER AH,1
AH S EH N,AH D P EY N,1
AH S EH N,AH N,1
N T ER IH NG AH,N AH,1
V AH T EH N,V AE N,1
N SH AH,N T AH,1
N AO R IH M OW SH AH N,N ER,1
EH F T,EH T,1
AY AH,AY R AH,1
AH L IH T,AH N M AH N T,1
T TH IH NG K IH NG F,T DH AE T HH IY F,1
IY W UH D JH EH,IY EH,1
T AH L HH ER,T ER,1
IH N T AY M,IH NG,1
 B R OY L AO, AY AO,1
R T OW S,R EH S,1
T AE Z,T IY Z,1
Z Y UW ZH AH W AH L,Z,1
DH AH EH M B L AH,DH AH,1
AH M D IH P,AH P,2
P IH K T S DH AH AH K R,P R,1
P AH L AH S AO L AH G L OW,P ER,1
 M IH L AH T EH R IY P, P,1
 M IH L AH T EH R IY P, OW V ER P,1
N EH L,N AE L,1
N EH L,N AH L,1
N EH L,N IH L,2
L AA R IH,L IH,2
IH K S P EH K T,IH T,1
T AH D T UW OW B EY G AH V ER M AH N T AO R D ER Z,T IY Z,1
 IH F K, K,2
R AH L K,R K,3
K AH M Z T AH M AA,K AA,1
V HH ER ER EY N JH F AO R AH M IY T IH,V IH,1
NG AE T T UW,NG,1
 HH IH Z SH OW, S OW,1
 HH IH Z SH OW, K OW,1
 HH IH Z SH OW, S OW R IY V OW,1
D ER F EH L T AE Z IH,D AH V IH,1
IH F IH T W ER B R OW K AH,IH L AH,1
AE D Y AO R D,AE D,7
AE D Y AO R D,AE V D,1
D AA R K S UW T IH,D IH,1
D AA R K S UW T IH,D EH Z IH,1
D AA R K S UW T IH,D DH AH IH,1
IH N G R IY S IY W AA SH W AO T,IH L AE B ER EY T,1
IH N G R IY S IY W AA SH W AO T,IH K EY T,2
IH N G R IY S IY W AA SH W AO T,IH T,1
T ER AO L Y,T AH D AH Y,1
T ER AO L Y,T AH R AH N D Y,1
T ER AO L Y,T AE N Y,1
R IY AE N OY L IY R AE G L AY K DH AE T,R IH JH,6
R IY AE N OY L IY R AE G L AY K DH AE T,R T AW T,1
R IY AE N OY L IY R AE G L AY K DH AE T,R OW,1
R IY AE N OY L IY R AE G L AY K DH AE T,R AH,1
R IY AE N OY L IY R AE G L AY K DH AE T,R IH JH W AA Z,1
 B AH T W IH DH IH, IH,1
T F R,T P R,1
R EY M,R IH M,1
M W ER K HH IY AH L AW D F AO,M AO,1
R AE Z M AH CH F L EH K S AH B IH L AH T IY,R D IY,1
IY AE Z P AA S AH B AH,IY AH,1
 W IY K EY M, AY AE M,1
N AE Z S,N AH S,1
S UW N AE Z W IY K UH,S T G UH,1
 IH F N EH S, AY S,1
S AH S EH R IY T UW R IY P,S EY P,1
S B OW TH HH AE,S T UW P AE,1
AE V Z AA N G R IH L S,AE S,1
S IH R K AH T S,S S,1
S AH N D AH L,S AO L,1
L AA T EH K S T R AH T,L T,1
T AY M,T,2
T AY M,T AH M,1
T AY M,T UW,1
S T OW L AH,S AO DH AH,2
S T OW L AH,S AO AH,2
D AY M F R AH M AH B EH G,D IH G,1
 B IH F AO, AO,4
R TH ER Z D EY Z IH G Z AE,R IY AE,1
R TH ER Z D EY Z IH G Z AE,R AE,1
R TH ER Z D EY Z IH G Z AE,R K AE,1
AE M R IY V Y UW EH V ER IY F AO R M Y AH L AH,AE N AH,1
 DH EY EH N JH OY IH T W EH N AY AA D IH SH AH N, HH IY,1
 JH EH F TH AO T Y, Y,2
R G Y UW D IH N F EY V ER AH,R AH,1
AH V AH S EH N T R AH F Y UW JH P ER CH AH S,AH L AY IH NG,1
 JH AA N K L IY N Z SH EH, S EH,1
 JH AA N K L IY N Z SH EH, AH S EH,1
SH F AO R AH L,SH L,1
L IH V IH NG,L IY,1
 SH IY HH AE, AE,2
 SH IY HH AE, D AE,1
AE D Y AO R D AA R K S UW T,AE T,1
T IH N G R IY S,T P ER S,1
T IH N G R IY S,T K EY S,3
T IH N G R IY S,T S,3
T IH N G R IY S,T AA S,1
T IH N G R IY S,T L AE S,1
S IY W AA SH W AO T ER AO L,S EH P AH L,1
S IY W AA SH W AO T ER AO L,S AH N AH L,1
 D AA, AA,4
 D AA, M AA,1
 D AA, K AA,1
 D AA, DH AH P AA,1
AA N T AE S K M IY T UW K AE R,AA R,3
R IY AE N OY L,R D EH L,1
R IY AE N OY L,R IH NG AO L,1
R IY AE N OY L,R IH L,1
R IY AE N OY L,R AH D L,1
R IY AE N OY L,R AA L,1
IY R AE G L AY K DH AE T,IY AH,2
IY R AE G L AY K DH AE T,IY,8
IY R AE G L AY K DH AE T,IY AH N,1
IY R AE G L AY K DH AE T,IY Z,1
 Y UW T UH K M IY, AY P IY,1
IY B AY S ER P,IY P,1
P R AY Z,P T,1
 DH AH HH, HH,1
HH EH V,HH AE V,1
V AH N Z R AH F Y UW Z D T UW G IH V AH P DH EH R W IY P IH NG,V AY,1
 DH AH AY D IY AH AH V AH S, Y AE S,1
EH N T,EH P ER EY T,1
EH N T,EH T,1
T R AH,T AH,1
AH L T AE NG K W IH DH L AY N Z T UW IY CH HH AW,AH B AW,1
AW S IH Z N AA T IH N IH T S EH L F AH N AA V AH L T,AW T,1
T IY,T,3
T IY,T EH R IY,2
T IY,T HH IY,2
T IY,T AH R IY,1
 D IH S T R OY EH V ER, EY M ER,1
IY F AY L R IH L EY T IH D T UW M AY AA D AH T S,IY,1
 AE L AH S AH Z AH B IH L AH, R EH N AH,1
AH T IY T UW W ER K W IH TH AW T S UW P ER V,AH V,1
V IH ZH AH,V EY SH AH,1
N IH Z N OW T W,N F AO R W,1
ER DH IY,ER D,1
ER DH IY,ER TH,2
ER DH IY,ER,1
ER DH IY,ER K,1
 B AA B P, P,2
 B AA B P, AH P,2
P ER D OW V ER,P ER,1
ER L IH V IH NG R UW M M Y UH R AH L Z,ER Z,1
W EH R W ER Y,W IH L Y,1
IY W ER AH W EY,IY R OW L D,1
 M IH, IH,1
 M IH, AY W IH,1
IH D IY V AH,IH N AH,1
AH L S AH S AY AH T IY W AA Z B EY S T AA N HH,AH OW HH,1
AY R AA R K IY Z,AY OW,1
AE D Y AO R D AA R K,AE Z DH AH AE K,1
K S UW T IH N G R IY S,K Y ER AH S,1
K S UW T IH N G R IY S,K AH S,1
K S UW T IH N G R IY S,K AE S,1
SH W AO T ER AO,SH B AO,2
SH W AO T ER AO,SH AO,3
SH W AO T ER AO,SH AE N AO,1
SH W AO T ER AO,SH IH NG AO,1
SH W AO T ER AO,SH AY N AO,1
K M IY T,K T,8
K M IY T,K IH NG IH T,1
T UW K AE R,T DH AH P AH R,1
T UW K AE R,T V EH R,2
T UW K AE R,T EH R,1
T UW K AE R,T R,1
T UW K AE R,T IH R,2
T UW K AE R,T HH ER W EH R,1
T UW K AE R,T EH S Y UH R,1
T UW K AE R,T V AH R,1
T UW K AE R,T AH R,1
AE T DH AH B EY S AH,AE Z AO R AH,1
AH V DH AH R AA K IY HH IH L S,AH N S,1
D AA N F UH T,D AH P,1
 Y UW Y, Y,1
M EH N,M AE N,3
M EH N,M AH N,1
N G EH T T UW B IY M AY,N AY,1
AY EY JH Y UW W,AY W,1
K F L UW S OW L AY T L,K W EH R AH L,1
 AH W UH M AH, AH,1
AH N M,AH M,1
EH T AH,EH R AH,1
AH F EY,AH K EY,1
EY M AH,EY N AH,1
AH S AO TH ER AE T AH L IH T ER EH,AH R EH,1
EH R IY T IY,EH N IY,1
 AA B JH EH K T, AE T,1
T S M EY D AH,T AH,1
AH V P Y UW T ER AA R B Y,AH F Y,1
UW T AH,UW AH,1
AH F AH L,AH V,1
AH F AH L,AH V OY L,1
AH F AH L,AH V M AY S,1
 DH AH M, M,5
NG D UW AA,NG G OW AA,1
NG D UW AA,NG AA,2
AH S P,AH P,1
P AY D ER W EH B G L IH,P IH,1
IH S AH,IH T IY AH,1
IH S AH,IH Z AH,1
AH N D IH N,AH S N,1
S AH N,S,2
S AH N,S IH N,2
 CH IY P S T AA, AA,1
AA K IH NG Z R AH N,AA N,1
M TH EY R W AO R,M DH EH R,1
IY Z D ER T IY D IH SH AH Z,IY R Z,1
 K AE L S, S,1
 K AE L S, HH Y UW S,1
S IY AH,S AH,2
S IY AH,S T AH,1
M M EY K S B OW N,M W AH N,1
N Z AH N,N EH N,1
N Z AH N,N S IH N,1
N D T,N T,8
T IY TH S T R AO NG,T ER,1
D Y AO R D AA,D HH IH Z AA,2
D Y AO R D AA,D K AA,2
D Y AO R D AA,D T UW AA,1
D Y AO R D AA,D HH ER K AA,2
D Y AO R D AA,D HH ER P AA,2
D Y AO R D AA,D N OW P AA,1
D Y AO R D AA,D N AA,4
D Y AO R D AA,D B AA,1
D Y AO R D AA,D P AA,1
D Y AO R D AA,D T UW T AA,1
D Y AO R D AA,D DH AH G AA,1
D Y AO R D AA,D HH ER HH AA,2
D Y AO R D AA,D AH P AA,1
AA R K S UW T IH N,AA D IY AH N,1
N G R IY S,N S,4
N G R IY S,N ER EH S,1
N G R IY S,N L AO S,1
N G R IY S,N D P ER S,1
S IY W,S W,5
S IY W,S IH NG W,7
S IY W,S AH W,1
S IY W,S IH N W,1
S IY W,S AH Z W,1
S IY W,S AH Z IH N W,1
ER AO L Y IH R,ER AA N HH ER,6
ER AO L Y IH R,ER AH N D HH IY R,1
ER AO L Y IH R,ER,15
ER AO L Y IH R,ER AW T HH IY R,1
ER AO L Y IH R,ER D,1
ER AO L Y IH R,ER OW V ER,1
ER AO L Y IH R,ER AA N,1
ER AO L Y IH R,ER AH N D HH ER,1
AE S K M IY T UW K AE R,AE Z W IH R,1
AE S K M IY T UW K AE R,AE Z N IH R,1
AE S K M IY T UW K AE R,AE Z HH EH R,2
AE S K M IY T UW K AE R,AE Z EH V R,3
AE S K M IY T UW K AE R,AE Z AH V EH R,3
AE S K M IY T UW K AE R,AE Z DH AH AH R,1
N OY,N D OY,1
 HH AW EH V, IY V,1
V ER DH,V IH N DH,1
ER R,ER EH R,1
R IH M,R IY M,1
M EY N,M AE N,1
M EY N,M IY N,2
M EY N,M EH N,1
M EY N,M AH N,1
N D AA,N AA,1
AA G M,AA R M,1
T AH D B AY S EH V R,T IY R,1
R AH L D AH Z,R Z,1
Z AH N,Z AA N,1
Z AH N,Z N,1
Z AH N,Z AE N,1
N L AH,N M AH,1
AH N CH,AH CH,1
CH R UW M S AH P ER Z,CH,1
 B UH K S, S,1
S AA R F AO R SH N UH K S,S OW L Z,1
 T UW M EH, DH EH,1
N IY EH K S P,N P,1
ER T S,ER S,1
S DH IH,S IH,1
R EH N,R AE N,1
N D W AA Z,N Z,1
Z IH,Z M IH,1
IH N EH V AH T,IH T,1
 AH M, M,3
 AH M, AY M,1
M AH S K Y,M Y,1
Y AH,Y UW T AH,1
L ER AE B D OW M AH,L EY T AH,1
AH N IH Z G UH D,AH D,1
D F AO R Y AO R B AE K,D,2
 DH AH K AA, P AA,1
 DH AH K AA, AY W AA,1
 DH AH K AA, AA,2
AA Z W EY EH N,AA L IY AE N,1
N D AH D,N D,3
D AH B R,D R,1
R AH P T L IY,R IY,1
IY AE T DH,IY AH V DH,1
Z M Y UW Z IH,Z IH D IH,1
Z M AA R V AH L,Z D L,1
Z M AA R V AH L,Z L,1
AH S L,AH V L,2
AH S L,AH L,2
 P L IY, HH IY,3
 P L IY, AE T V EH R IY,1
IY Z T,IY T,3
K DH IH S,K S,3
S D ER T IY,S V EH R IY,4
IY T EY,IY P EY,2
IY T EY,IY EY,1
EY B AH,EY P AH,1
EY B AH,EY SH AH,1
AH L K L,AH L,1
L AO TH T,L EH T,1
T UW DH AH K L IY N ER Z F AO R M IY,T,1
AA R P AH T K,AA Z K,1
K L IY N ER Z SH AE,K AE,1
P UW D AW ER AO R,P OW R,1
R IY EH N T AH L,R EY L,1
L R AH G,L,2
L R AH G,L Z,1
HH AE D Y AO R D,HH EH L D,1
S IY W AA SH W AO T ER AO,S AO,3
S IY W AA SH W AO T ER AO,S Y AH L AH R AO,1
S IY W AA SH W AO T ER AO,S B AO,1
 D AA N T AE S K M IY T, T,1
UW K,UW HH IH Z K,1
AH B S EH SH,AH P AE SH,1
N Z HH,N HH,1
IY P IH K T AH,IY AH N AH,1
AH P D UH R IH NG DH,AH DH,1
DH IY,DH ER HH IY,1
IY Z L,IY L,1
L AO NG N AY T S AH,L AA JH IH K AH,1
AH V T AO K,AH L,1
 AH N D P, P,1
F HH AW,F,1
 DH EY W, HH IY W,1
 DH EY W, AH W,1
W IH L T EY K AH W EH D IH NG T R IH P L EY T ER,W AA Z S ER,1
ER,ER IY N,1
 DH AH EH, EH,1
EH M B L AH,EH R AH,1
AH M D IH P IH K T,AH S T,1
T S DH AH AH K R AA,T AA,1
AA P AH,AA T AH,1
L AH S AO,L AO,1
L AH S AO,L Z AO,1
L AH G L,L B IH L,1
L AH G L,L AY L,1
L AH T EH R IY P,L P,1
L AH T EH R IY P,L HH ER P,1
L AA R IH K S P EH K,L IY AE K,1
T AH D T UW OW B EY G AH V,T IH V,1
V ER M AH,V AH,2
T AO R D ER,T ER,2
 OW N L IY L AO Y ER Z L AH V M, M,1
M IH L Y AH N EH,M EH,1
R Z,R IY AE N AH,1
R Z,R,1
 IH F K AE R, HH IY R,2
 IH F K AE R, R,1
Z T AH M AA,Z S AA,1
OW HH AE V,OW EH V,3
OW HH AE V,OW OW V,1
V HH ER ER,V ER,2
ER EY N,ER IH N,1
N JH F AO R,N HH EH R,1
AH M IY T,AH T,1
NG AE T T,NG T,2
 HH IH Z SH, AY SH,1
 HH IH Z SH, SH,2
SH OW L,SH AE L,1
L D ER F EH L T AE,L HH IH R AE,1
AE Z IH F,AE F,1
F IH T,F T,1
T W ER,T ER,1
ER B R OW K AH N,ER,1
S UW T,S AA T,1
S UW T,S EH T,2
S UW T,S AH T,3
S UW T,S ER T,1
S UW T,S T,13
S UW T,S ER CH L AY T,1
S UW T,S IH T,2
N G R IY,N IY,3
IY S IY W AA SH W AO,IY AH Z L AO,1
AO T ER,AO NG G ER,1
R IY AE,R AE,2
R AE G,R IH G,1
R AE G,R AH G,1
R AE G,R G,1
R AE G,R EH G,1
G L AY K DH AE T,G AA T,1
G L AY K DH AE T,G AH N,2
G L AY K DH AE T,G AH D,1
G L AY K DH AE T,G R EH T,1
G L AY K DH AE T,G AO N,1
G L AY K DH AE T,G AH T,1
G L AY K DH AE T,G IY,1
G L AY K DH AE T,G,1
G L AY K DH AE T,G AH N T,1
 HH IY HH, Y UW HH,1
AE D P L AH,AE V K AH,1
N JH D IH,N S IH,1
IH N T UW DH AH D,IH D,1
D AA R K W UH D,D ER D,1
D Z B IH AA N D,D Y UW,1
 W AH N HH, AY HH,1
D T UW B,D B,1
V IH,V D IH,1
V IH,V HH IH,1
N F AY N AH,N IH T AH,1
L IH V,L IY V,1
V EH N,V AH N,1
V EH N,V IH N,1
N T S AO R W AH N,N OW N,1
DH AH AH,DH AH,2
AH B IH S,AH V EH S,1
AH V N AH TH IH NG,AH L,1
L EH T S,L AE S,1
S B IY F AY,S AY,1
AY N S UW P IH R IY ER,AY T ER,1
L AH V G,L G,1
T D IH G N AH,T F AH,1
AH T IY HH IY S,AH L B IH S,1
S EH D,S AY D,1
D AE Z,D Z,1
D AE Z,D AH Z,1
ER JH OW K IH NG,ER T UW,1
AH D AY M F,AH G AH N F,1
F R,F AO R,5
R AH M AH,R DH AH,1
TH ER Z D EY Z IH G Z AE M R,TH AH R,1
R IY V Y,R AH S Y,1
UW EH V,UW HH AE V,1
V ER IY F AO,V AO,1
R M Y AH L AH,R,1
R M Y AH L AH,R AH,2
 DH EY EH N JH, JH,2
W EH N AY AA D IH,W ER IH,1
IH SH AH N,IH T,1
IH SH AH N,IH Z,1
IH SH AH N,IH Z N,1
IH SH AH N,IH N,1
 JH EH F TH AO T, T,1
 JH EH F TH AO T, DH AE T,1
T Y UW AA R G Y UW D,T OW EY D,1
D IH N F EY V ER AH V AH,D AH,1
AH S EH N T,AH T,1
T R AH F Y UW JH P ER,T ER,1
ER CH AH S,ER Z,3
ER CH AH S,ER,1
 JH AA N, AH N,1
N K L IY N D SH EH L F IH,N S AE T IH,1
IH SH F,IH S F,1
F AO R AH L IH V IH NG,F AY D,1
D AA R K S,D S,6
D AA R K S,D AH S,3
D AA R K S,D T UW S,1
D AA R K S,D UW S,1
IH N G R IY S IY W,IH W,1
IH N G R IY S IY W,IH NG W,5
W AA SH,W AH SH,1
W AA SH,W EY SH,1
 D AA N T AE S, Y EH S,1
 D AA N T AE S, S,8
 D AA N T AE S, G R EY S,1
S K M IY T UW K AE R,S HH EH R,1
S K M IY T UW K AE R,S P EH R,1
S K M IY T UW K AE R,S AH R,3
S K M IY T UW K AE R,S EH P AH R,1
AE N OY L IY R,AE R,2
R AE G L AY K DH AE T,R AH N T,1
R AE G L AY K DH AE T,R EH D IY S EH T,1
R AE G L AY K DH AE T,R,5
R AE G L AY K DH AE T,R EY S,2
R AE G L AY K DH AE T,R EY JH,1
R AE G L AY K DH AE T,R AH T,1
R AE G L AY K DH AE T,R AH,3
R AE G L AY K DH AE T,R D AH N D,1
R AE G L AY K DH AE T,R N EY T,1
R AE G L AY K DH AE T,R AA T,1
R AE G L AY K DH AE T,R EY T,1
 N AW DH AE, AE,1
S IH Z AE T,S DH AH AH S T,1
AA D Z W IH DH AW ER M IY N,AA N,1
IH NG M EY B IY SH OW N,IH SH T DH AH S AH N,1
N AE Z F AA L OW Z,N,1
 AW ER B OY D IH D N T CH, AH CH,1
T N OW S,T S,1
 V EY S AH Z M EY K S, HH IY S,1
S EY M AE,S AE,1
AE Z S,AE NG DH AH S,1
AO L T AH N D P,AO NG P,1
EH P ER SH EY K ER Z L IY V IH NG AO F T AA P P,EH P,1
P IY S AH,P AH,1
AH Z,AH N OW,1
AH Z,AH,2
AH Z,AH S,1
AH Z,AH S IY Z,1
AH Z,AH T IH Z,1
AH Z,AH S IH Z,1
P R AA,P AA,2
AA D AH K T,AA R T,1
AA D AH K T,AA N T,1
R AH N IY V AH N,R Y UW N,1
N L IY D IH S T R IH B Y AH T,N AY T,1
 AH L, AE L,3
 AH L, L,2
 AH L, S L,1
 AH L, W EH L,1
 AH L, AA L,1
L AW L IY W EY,L M EY,1
EY HH IY R,EY AH R,1
R B AH T R,R R,1
Z AO,Z D M AO,1
Z AO,Z D AO,2
AO L EH R,AO R,1
R ER Z,R,2
R ER Z,R IH SH,1
R ER Z,R Z,1
 DH AH N IH R AH S T S, HH ER S,1
IH N AH G AO G,IH NG G,1
G M EY N AA T B IY W IH DH IH N W AO K IH NG D IH S T AH,G AH,1
AH N S,AH L,2
AH N S,AH S,4
AH N S,AH R,1
 G R EH G B AY, AY,1
 G R EH G B AY, AE Z AY,1
AY Z F R,AY P R,1
EH SH M IH L K IY CH W IY K D EY M AO R N IH NG,EH S T,1
 K AE T AH S T R, P R,1
R AA F IH K EH K AH,R AH,2
AH N AA M IH,AH P IH,1
IH K K AH,IH SH AH,1
AH T B AE K S,AH S,1
S N AH G L EH K T DH AH P UW R,S,1
 SH IY HH, HH,4
 SH IY HH, Y UW HH,4
 SH IY HH, AY HH,1
D AA R K S UW T,D EH T,1
N G R IY S IY W AA SH,N EY SH,1
N G R IY S IY W AA SH,N HH IH Z AH SH,1
N G R IY S IY W AA SH,N P L AE SH,1
