 SH IY HH AE D Y AO R D AA R K S UW T IH N G R IY S IY W AA SH W AO T ER AO, AO,1
D,D Z,1
 M IH L K P, D OW P P,1
N M EY B IY,N AY D IY,1
IY IH,IY AH IH,1
S D R,S T R,1
R AH G,R OW K,1
 W AY L HH IY W AA Z IH, IH,1
IH N K AH S T,IH T,1
T AH D IY HH IH Z W AY F D IH V AO R S,T S,1
S T HH IH M,S M,1
M,M AY,1
AH EH,AH T EH,1
EH M B L AH M D IH P IH K,EH K,1
S DH AH AH K R AA P AH L,S CH ER AE T L,1
G L OW,G EH N,1
R AH S,R EH S,1
NG P,NG W IH DH P,1
Z S AA L V D,Z,1
L AH M D,L OW P D,1
 OW N L, AY L,1
L IY L,L AY K L,1
ER Z L AH V M IH L Y AH N EH R Z,ER Z,1
 AH B AH V HH IH M S L IH D DH AH IH V EY Z IH V SH AE D OW AH V AH S T AO R M K L AW D,,1
 CH IY F IH, IH,1
P T DH,P DH,1
EY T AH N T,EY T,1
T DH AE N IH,T IH,1
 DH AH IH, IH,1
M IH T,M AH N AH N T,1
 EY T F, F,1
F IY L D G,F Y UW ER G,1
 AH L UW M AH N AH M S IH L V ER W EH R K, AY K,1
N B IY F L IH M Z IY,N,1
R V EH R,R G R,1
R IY Y UW S F AH L IH,R EY T HH IH,1
 P AE, AE,1
AE M G IH,AE K T IH,1
V Z D,V D,1
L AH V DH,L DH,1
IY IH N AO T AH M,IY,1
IY D,IY HH AE D,1
K AO L B L,K P L,1
L AE NG,L EY IH NG,1
NG K,NG,1
 HH IY L, IH T AO L,1
L Z P,L S OW P,1
N DH AH L,N L,1
L AO NG L EH G AH,L AY K AH,1
AH D S,AH S,1
 AH M, M,1
