T IH N,T AH N,77
T IH N,T N,1
T IH N,T AH N D AH N,1
T IH N,T AH M AH N,1
T IH N,T EH N,1
N G,N D G,76
N G,N D DH AH G,1
N G,N T G,1
N G,N AH G,1
N W AA Z TH IH N AH N,N S T AE N,1
D HH AE G ER,D ER,1
D AH,D P AE K AH,1
D AH,D IY AH,4
AH N D HH IH,AH JH IH,1
N AH,N D AH,8
N AH,N DH AH,2
N AH,N T AH,1
N AH,N D DH AH,1
N AH,N ER AH,1
N AH,N K R UW AH,1
 P UH T, W AH T,1
 P UH T, B AH T,4
 P UH T, DH AE T,1
 D R AA P F, DH AE T F,1
 D R AA P F, F,1
R M Z IH N DH,R AH V DH,1
 HH ER W AO, DH EH R AA R N AO,1
R D R,R TH R,1
OW B K,OW D K,1
S AH N D B,S M AY AE B,1
B L AW S,B S,1
AH Z,AH N S,1
Y AO R,Y IH R,2
D AA R K,D AE K,1
K S,K S S,1
ER AO L Y,ER AH V Y,1
ER AO L Y,ER N Y,1
ER AO L Y,ER AA R Y,3
ER AO L Y,ER Y,1
ER AO L Y,ER AW ER Y,3
ER AO L Y,ER AA N Y,1
IY AE N,IY AA N,6
IY AE N,IY AH N,18
IY AE N,IY EH N,1
IY AE N,IY IH N,1
IY AE N,IY IH NG AA N,1
 HH AH S, AE S,1
K IY Y,K AH Y,1
M AA K D,M AY D,1
 AA HH AA HH IY TH, AY TH,1
T AH L,T L,1
D AH V AO,D UW M AO,1
T EH K,T UW K,1
K N IH K AH L,K AO L,1
Z AH,Z HH AE V AH,1
Z AH,Z AE K CH UW AH,1
Z AH,Z AH N D AH,1
Y UW T ER AA,Y UH R AA,1
R B,R AH B,1
R B,R AH N D B,1
M AO R N,M AA N,1
N IH NG D,N AH T ER D,1
Z R,Z B R,1
Z R,Z W IY R,1
R AH N,R AE N,1
R AH N,R AA N,1
N DH,N D DH,5
R W AO,R M AO,1
R N,R AA N,1
R N,R,1
 D AA N T D UW CH AA R L IY Z D ER T IY D IH SH AH Z,,1
 IH N W, W,1
 HH IY, IY,1
V AA,V IH N AA,1
S DH,S AH V DH AH DH,1
 M, DH AH M,5
S ER AE M IH K M,S EY DH AH M,1
EY R EH D,EY W ER D,1
 AA R T AH F IH SH AH L IH N T EH L AH JH AH N S IH Z F AO R R IY L,,1
W ER M,W AO R M,2
V DH AH,V AH,1
L EY K,L AY K,2
D Y AO,D G AO,1
AO R D,AO N D,1
K S UW,K T UW,1
K S UW,K F UW,1
UW T IH,UW R IH,1
UW T IH,UW IH,1
UW T IH,UW M D IH,1
UW T IH,UW N IH,1
UW T IH,UW V AH N IH,1
IH N G R IY S,IH S,1
S IY,S K IY,1
AA SH W,AA CH W,19
AA SH W,AA Z W,3
AA SH W,AA CH T W,2
AA SH W,AA ZH W,1
 D AE, DH AH AE,1
S AH Z,S ER Z,1
S AH Z,S IH Z,1
S AH Z,S,1
S AH Z,S IY,1
N EY T,N AH T,1
T AH D W,T W,2
AH NG AO R S,AH N W AA Z S,1
N HH IH M AO,N AO,1
T S M IY AW,T DH AH AW,1
AW AO,AW ER AO,1
Z HH ER T S M,Z M,1
AY IH R,AY IY R,1
R Z,R,2
IH F W,IH P W,1
IH F W,IH N T AH N W,1
UW DH D,UW D,2
V AH,V DH AH,1
V AH,V W AH,1
N K,N D K,6
N K,N T K,3
F D AH,F T UW AH,1
AH N EH N IY TH IH NG F,AH HH EY T F,1
F AO R W,F AH L W,1
 B IY IH, DH AH IH,1
T AY D L IY AE M B,T DH AH EY B,1
L D TH R UW,L T UW,2
 IY T IH NG S P IH N AH CH N AY T L IY IH N K R IY S AH Z S T R EH NG K TH M ER AE K Y AH L AH S L IY,,1
 AE T T, DH AH T,1
 AE T T, T,1
DH AH T,DH AE T,1
T W,T S W,1
W EH L F TH D EY,W AY DH EY,1
W EH L,W IH L,7
SH AH B L,SH UH D L,1
SH AH B L,SH IH P L,1
IY,IY V,1
 SH IY HH, DH EY HH,3
 SH IY HH, HH,4
 SH IY HH, DH AH HH,1
T IH N G,T G,21
T IH N G,T AH D G,1
T IH N G,T AH G,2
D EH N,D AH N,1
D AH S,D AA S,1
S P ER,S K W ER,1
 D, DH AH D,4
 D, DH EY D,1
 D, W ER L D,1
M Z,M IH T,1
M Z,M,1
 SH IY W AO R W AO R M F L IY S IY W UH L AH N OW V ER AO L Z,,1
L D DH,L DH,3
R IH Z,R Z,2
R AH P,R P,4
 W AY CH AA R JH M AH N IY F AO R S AH CH G AA R B IH JH,,1
AO L Y,AO R Y,9
D IH K,D AH K,1
T S AH S,T ER Z S,1
ER IH N,ER AH N,2
N V,N D V,2
L IH T,L EY T,1
T TH,T DH AH G L UW TH,1
NG F AH M IH L Y,NG Y UW N OW Y,1
Y EH R,Y AE P R,1
R AH T,R IH T,1
W UH D JH,W IH DH JH,1
 B R, DH AH R,1
OY L,OY AH L,1
L AO,L N AO,1
OW S T AE Z,OW Z IH N IH Z,1
Z Y UW ZH AH W AH,Z R IY AH,1
L AH G L,L AE Z W EH L,1
L AH G L,L AE T AO L,1
L OW,L,2
ER Z,ER IH Z,1
ER Z,ER,2
ER Z,ER TH,2
 IH F K, K,1
 IH F K, AH V K,1
V HH ER ER,V ER,4
JH F,JH D F,3
NG AE T T,NG IH N T,1
NG AE T T,NG AH N D T,1
 HH IH Z SH, DH AH SH,2
HH AE D Y,HH AW Y,1
HH AE D Y,HH AY Y,1
AA R K,AA K,2
AA R K,AA N K,1
S UW T IH,S AH M TH IH,1
IH N G R IY,IH NG W IY,1
IY S IY W,IY SH UH D W,1
W AO T ER,W AH N D ER,1
W AO T ER,W ER,1
W AO T ER,W AH N ER,1
ER AO L,ER F AH L,1
ER AO L,ER L,1
ER AO L,ER OW L,1
ER AO L,ER HH OW L,1
IY AE N OY L,IY IH NG AO L,1
IY AE N OY L,IY AO L,1
L IY R AE G L,L ER AW N D L,1
 B AH, DH AH,1
AH T W,AH W,1
R AE Z M,R M,1
AA N AE Z S UW N,AA N,1
 IH F N EH S AH S EH R IY T UW R IY P L EY S B OW TH HH AE V Z, K AA Z,1
Z AA N G R IH L S IH R K AH T S AH,Z AH,1
 B IH F AO R TH ER Z D EY Z IH G Z AE, HH AE,1
AE M R IY V,AE V,1
V Y UW EH V ER IY F,V AH F,1
AY AA D,AY AO D,1
AY AA D,AY AH D,2
N,N D,3
N,N D Z,1
N,N D M UW D,1
UW AA R G Y UW D IH N F,UW L AY V AH V M AY F,1
ER AH V AH S,ER IH T S,1
EH N T R AH F,EH D IH F,1
UW JH P,UW P,1
P ER CH AH S,P R AA G R EH S,1
IY N Z SH,IY S SH,1
IY N Z SH,IY SH,1
D Y AO R D,D T UW D,5
D Y AO R D,D D,6
D Y AO R D,D AH D,1
UW T IH N,UW N AH N,3
UW T IH N,UW N,5
UW T IH N,UW D AH N,1
W AO T,W AH T,2
T ER AO L Y,T AA R Y,1
Y IH R,Y UW,3
Y IH R,Y AE,1
AE R,AE R IY K AO R,1
N OY L IY R,N AO R DH AH R,1
N OY L IY R,N DH AH R,3
N OY L IY R,N AH B R,1
 Y UW T, IH T T,1
V AH S,V IH S,1
N T R AH,N SH AH,1
NG K W IH DH L,NG R IY AH L,1
AY N Z,AY Z,1
Z T UW IY,Z IY,1
HH AW S IH,HH AE Z IH,1
IH Z N,IH T S N,1
N AA T IH N,N AY N,1
AH N,AH N D N,1
 D IH S, S,1
T R,T AO R,1
T R,T R EH R,1
R OY EH V,R IY AH V,1
V ER IY F,V R IH F,1
F AY L R IH,F ER IH,1
IH L EY T,IH NG IH T,1
T IH D T,T T,1
AH T S,AH N S,3
AH T S,AH N S DH IH S,1
AH T S,AH N Z,1
AH T S,AH S,1
 AE, DH AE,3
AE L AH S AH Z,AE T W AA Z HH IH Z,1
N OW T,N AA T,1
ER DH IY,ER K IH NG,1
 B AA B P, DH AH P,1
P ER D OW V ER,P ER,1
ER L IH V IH NG R UW M M Y UH R AH L Z,ER,1
UW W AY L W,UW AA R W,2
 M IH D IY V AH L S, S,1
HH AY,HH AY L AY,1
AY R AA R K IY Z,AY T AH V M AY,1
AA SH W AO,AA CH F L AO,1
AA SH W AO,AA CH AO,2
AO T ER AO,AO R AH D AH AO,1
AO T ER AO,AO R M AO,2
AO T ER AO,AO R AO,1
 Y UW Y, Y,1
JH Y UW W,JH DH EY W,1
P Y UW T,P IY T,2
Z R AH,Z W AH,1
M TH EY R,M DH EH R,3
R W AO R N,R AA N,1
Y AO R D,Y UW D,1
Y AO R D,Y AW D,1
W AO,W AH N AO,1
AO T ER AO L Y,AO R AA N Y,1
AO T ER AO L Y,AO R OW Y,1
T ER R,T AH L R,1
M S,M Z S,1
M S,M ER S,1
P ER Z,P OW Z,1
B UH K S,B AH T S,1
S AA R F,S EH L F,1
F AO R SH,F IH SH,1
N UH K S,N OW T S,1
 AH, DH AH,11
 AH, DH AH AH,2
S K,S EH K,1
S K,S K K,2
K Y AH,K AH,1
L ER AE,L AH AE,1
IH Z G,IH T S G,1
Y AO R B,Y UW B,1
TH T,TH S T,1
L AA R IH,L AY IH,1
UW OW B EY G,UW AH G,1
 OW, DH AH OW,2
Z L AH V M IH L Y AH N EH,Z S EH,1
EH R Z,EH D,1
OW HH AE V,OW EH V,1
V HH ER,V ER,2
ER ER,ER IY T ER,1
ER EY N,ER N,1
N JH F AO R AH,N DH AH,1
AH M,AH K AE M,1
M IY T IH NG AE T T,M ER AH T,1
V IH N,V AH N,1
N F,N D F,2
L IH,L IY IH,2
L IH,L IH V IH,1
 L EH T, DH AE T,3
L AH V,L HH AE V,1
L AH V,L IH V,1
L AH V,L OW V,1
F HH IY W,F Y UW W,2
 HH IY S, IH N S,1
 HH IY S, DH EY S,1
 HH IY S, S,2
 HH IY S, Y UW S,1
T OW L,T AO L,1
T OW L,T EH L,1
B EH G,B AE G,1
B EH G,B IH G,1
G ER,G,1
 B IH F AO R TH ER Z D EY Z IH G Z AE M R IY V Y UW EH, EH,1
R M Y AH L AH,R,1
N D SH,N SH,1
L Y,L AY V Y,1
L Y,L D Y,1
 V EY, F EY,1
AW L IY,AW M IY,1
NG,NG Z,1
NG,NG G W AH JH,1
NG,NG L IY,1
S N,S AH N D N,1
 SH IY HH AE, Y AE,3
 SH IY HH AE, T R AE,1
AE D Y AO R D,AE G EH T D,1
AE D Y AO R D,AE CH ER D,1
AE D Y AO R D,AE JH IH T D,1
AE D Y AO R D,AE JH IH K D,1
S IY W,S AH N D W,2
S IY W,S IH NG W,5
S IY W,S AH N T W,3
S IY W,S W,2
S IY W,S AY W,1
S IY W,S Y UW W,2
S IY W,S T DH AH W,1
S IY W,S DH AH W,1
AO L Y IH,AO R IH Z IH,1
IH R,IH T,1
 IY CH IH Z S, S,1
 HH IH Z S, DH AH S,1
IH S T S,IH S,3
IY P F,IY V F,2
 B AE L, DH AH L,1
EY Z,EY D IY Z,1
EY Z,EY ER Z,1
AH V M,AH M,1
AH V M,AH DH ER M,1
ER AH V,ER V,1
IH D Y UW B AY,IH V AY,1
AY EH N,AY N,1
AY EH N,AY AH N,1
N IY K,N K,1
N IY K,N D K,1
W AO R AH B,W ER B,2
 IH G W, DH AH W,1
 IH G W, W,1
 IH G W, HH IY K W,1
W AA N,W AH N,2
N AH Z,N AE Z,2
N AH Z,N IH Z,1
Z AH N,Z AE N,1
Z AH N,Z N,1
N D AE,N AE,2
ER Z AA R T,ER T,1
SH IY HH AE D Y AO R D,SH IH T D,1
W AO T ER AO,W AH N AO,2
W AO T ER AO,W AH N AA R AO,2
IY T UW K,IY K,2
IY AE N OY,IY IH NG OY,2
G L AY K DH,G AA N DH,1
G L AY K DH,G DH,1
AE S T R OW F IH Z,AE Z ER L IY AE Z,1
Z IH K S,Z,1
K AE R,K EH R,2
K AE R,K AO R,5
K AE R,K Y UH R,1
K AE R,K L IH R,1
R IY IH,R IH,1
IH NG AH,IH N AH,1
D AH D AH,D ER AH,1
 IH F DH, DH,1
M IH Z,M ER Z,1
M IH Z,M AE Z,1
EH N,EH M N,1
EH N,EH M,1
N T M AH,N AH,1
AH S T,AH N T,1
T B,T S B,1
T B,T AH B,1
T B,T F EH D B,1
P EY D,P EH N AH L T IY,1
IY AA R,IY AO R,6
R W UH D B,R B,1
R B B,R B,5
ER N D P,ER AH P,4
Z IH N,Z AH N,10
Z IH N,Z N,1
AA N F,AA M F,1
F AY ER,F AA R,1
L K AE N B IY AE N,L G IH V AH N,1
N IH NG S,N ER Z M AY L ER N S,1
S P AO R T,S OW,1
ER AH AH,ER AH,1
 AA R Y AO R G, HH AY ER G,1
 S, AY S,1
 S, DH IH S,1
 S, DH AH S,1
D DH AH OY,D Y AO R OY,1
W EH N S,W AH T S,1
D AA R,D AO R,2
R OW V ER,R AO F ER,1
IH T AH,IH F AH,1
ER M,ER AH N D M,1
ER M,ER IY IH M,1
 JH EH, CH EH,1
EH F TH AO T,EH K DH AE T,1
UW AA R G,UW AY G,1
G Y UW D IH N F,G EH T AH F,1
N K L,N SH EH L,1
L IY N Z SH,L SH,1
DH AE T,DH EH R,1
DH AE T,DH EH M,3
DH AE T,DH EH N,1
Z K L,Z F L,1
ER AH N D JH,ER JH,2
S T UW S,S JH AH S,1
S P EH N,S T B IH N,1
N D IH,N IH,1
R EH N,R AH N,1
R EH N,R AE N,1
R EH N,R IH N,1
N D,N D D,1
N D,N T UW D,1
ER AH N S,ER T,1
ER AH N S,ER Z,1
 IH F P, P,2
L W ER M,L AA R M,1
S DH EH R W,S N OW W,1
 B AE S, EH S,1
K AH T B,K OW B,1
B AO L K,B AA R K,1
N G R IY S IY W,N Y UW W,1
N G R IY S IY W,N D OW AH Z N T W,1
 D IH V ER, DH AH F ER,1
ER S,ER S T S,1
ER S,ER Z S,2
ER S,ER AH N D S,1
S AH T,S IH T,1
AH V P,AH P,2
AH V P,AH Z P,1
R D DH,R DH,2
Z D DH,Z DH,4
AH N M,AH V ER M,3
AH N M,AH M,1
 IH, DH AH IH,2
 IH, HH IH,1
 IH, DH AE T IH,1
Z AA R,Z AO R,7
Z,Z S AH M,1
Z,Z AH N D,2
Z,Z S IY,1
 D AA N T AE, TH EY L AE,1
 D AA N T AE, DH AH AE,2
 D AA N T AE, AE,2
R K AE,R G AE,1
AE S T S,AE S,1
DH AH M,DH AE T M,1
DH AH M,DH EH M,1
ER D DH,ER T UW DH,1
AH P,AH P P,3
P EH K,P IH K,1
P EH K,P AE K,6
N AH B,N AY B,1
B IH G,B EH G,1
AA R K S UW,AA G Z T UW,3
AA R K S UW,AA G Z SH UW,1
UW T IH N G,UW G,4
S K F R AH,S IH V N AH,1
M HH IH Z,M B ER Z,1
HH EH D AH N D TH,HH IY R DH AE T TH,1
UW IH T AH,UW AH N D AH,1
D EH K,D EY,1
 M EY, DH EY,1
IH D,IH R D,1
IH D,IH D D,1
UH G ER B OW L DH,UH R DH AH AA N DH,1
M AE Z JH AA,M CH AA,1
IH D Z OW M,IH T S AH M,1
M IH T IH,M EY Z IH,1
IH S K,IH Z,1
IH S K,IH Z K,2
T OW V,T AH V,1
V ER L,V DH AH L AH V L,1
L UH K T,L IY D AO T,1
T DH AH OW SH AH,T ER AH,1
Z D IH G M,Z T EY K M,5
EY B AH T,EY DH AE T,3
N AH F CH,N AA T CH,1
NG IH N,NG AH N,8
N P,N D P,7
N G R,N D R,1
N G R,N K R,6
N G R,N R,2
N G R,N D K R,2
N G R,N D B R,2
N G R,N IY K R,1
N G R,N W EH R,1
N G R,N D AA R,1
R IY S,R AH S,3
R IY S,R EY S,1
R IY S,R Y UW S,2
R IY S,R IH S,1
IY W,IY V IH NG W,1
IY W,IY V W,2
IY W,IY Y UW W,1
IY W,IY N W,1
IY W,IY T W,1
K M IY T,K T T,1
K M IY T,K AH N T,1
 P AE S IH, R EH D IH,1
IH NG D AA G Z W ER G R IY T,IH T,1
R JH AH L B AA R,R T R,1
R K,R UW M Y UW,1
R K,R AH K,1
 HH IY W AA Z N T L, P AH L,1
AY K L,AY T L,1
IY T UW,IY Y UW,1
K AH M,K AE N M,1
K AH M,K AA M,1
M D AW N,M AE N,1
N W IH DH HH AA T CH IH,N AH JH M IH,1
L Z,L Y AH N Z,1
L Z,L JH AH S T,1
P T F,P AH F,1
M D IH P IH K,M AE K,1
T S,T R AH S,1
T S,T,1
R IH,R AE N T IH,1
R IH,R HH IH,1
R IH,R AE JH IH,1
IH K S,IH S,1
S P,S AH P,1
P EH K T,P EY T,1
T AH,T IH NG AH,1
AH D T UW OW B EY G,AH G,1
Z L AH V M,Z M OW D M,1
N EH R Z,N,1
N EH R Z,N AH N D,1
 SH, DH AH SH,5
T,T W AA Z AO L,1
T,T M UW V IY,1
T,T N AW,1
T,T IH Z,1
T,T L IY,1
T,T B AE D,1
T,T AH V,1
T,T AH S,1
AH T,AH N,1
AH T,AH N T,1
AA D AH,AA N T AH,1
UW HH IH,UW IH,1
HH EH M,HH AE M,1
 S W IH, DH IH,1
IH NG Y,IH S Y,1
Z Y UW K,Z AH K,1
K AE N,K,1
K AE N,K EH N,1
K AE N,K AH N,1
NG P IH L,NG,2
NG P IH L,NG D IY L,1
 SH IY HH AE D Y AO R D AA R K S UW T IH N G R IY S IY W AA SH W AO T ER AO L Y IH R,,1
D HH,D T UW HH,1
 K AH M P AH L S ER IY R IY T AY ER M AH N T AE T S IH K S T IY F AY V L UW M Z AA N AW ER HH ER AY Z AH N,,1
S AH Z AH,S DH IH S AH,1
S AH Z AH,S ER V AH,1
N IH,N IH T IH,1
N IH,N D IH T IH,1
N IH,N T IH,1
N HH,N AH HH,1
N HH,N D HH,2
AY R AA R K IY,AY ER N AY N T IY,1
 HH AW Z IH T S, AO L S OW S,1
UW F,UW W IH L F,1
F AW L,F AO L,1
S IH N,S AH N,7
N L,N D L,3
 P OW CH DH AH AE P AH L Z IH N DH IH S S ER AH P F AO R T W EH L V M IH N AH T S D R EY N DH EH M AH N D K UW L,,1
 HH UW AO, AO,1
 HH UW AO, DH AH W AO,1
 HH UW AO, DH AH AO,2
S AH K AW N T,S IH V HH OW M,1
Z DH AH,Z AH,1
 L AO, AO,1
 L AO, N AO,1
 L AO, M AO,1
IY EH L,IY EY L,1
L AH G AH,L IY AH,1
N T,N,2
N T,N OW L EH T,1
N T,N D T,2
AY Y EH,AY EH,1
L AO R W,L ER W,1
L AO R W,L OW W,3
L AO R W,L W,1
AY T,AY D AA N T,1
T AH M,T S IY DH EH M,1
T AH M,T OW,1
IY W AA,IY B AA,1
D DH AH,D Z AH,1
D DH AH,D R AH,1
D DH AH,D AH,1
AH B EH D R UW M S,AH S S,1
AH M F IH,AH B S IH,1
IH F T IY,IH D IY,1
IY N F IY,IY EH R IY,1
IY T,IY TH R OW IH T,1
 AE T D, D,1
Z G L IY K,Z K W IH K,1
L AH,L EH V AH,1
L AH,L ER AH,1
AH B AH,AH L AH,1
AH N D K,AH K,1
AH N D K,AH S K,1
 D IH D Y UW B, B,2
IY K AO,IY AO,1
D ER OY OW,D AH N EH R IY OW,1
K EH P T,K AE N R IY S T,1
T HH IH Z V IH,T R IH,1
T AH M K,T K,1
AA SH W AO T ER,AA CH M AA D ER,1
T EH S,T AE S,1
S T,S K T,1
S T,S T T,1
S T,S AY Z D,1
T S W,T W,1
DH P,DH AH P,1
 AH S, S,2
EY N T,EY T,1
T Y UW,T,1
 W IH L R, R,3
 W IH L R, DH AH R,1
W EH R AH,W ER AH,4
IH L IY,IH NG TH IH NG Z,1
W EH N R,W IH DH R,2
L AW T,L AH,1
L AW T,L OW,1
T IH N G R,T R,6
T IH N G R,T B R,1
T IH N G R,T IY DH AH K R,1
T IH N G R,T Y AO R R,1
T IH N G R,T AH V K R,1
T W AO,T AO,1
N AA,N D AA,2
N AA,N D AY D AA,1
Z F R AH M K,Z K,1
W IH L,W EH L,3
UW TH F,UW F,4
EH T,EH N T,1
EH T,EH R,1
S F R AH M B,S B,1
 IH N F, F,1
T AW ER,T ER,1
T D IH D AH,T DH AE T AH,1
L IH P,L EH P,1
N DH AH,N AH,5
OW P,OW L IY,1
OW P,OW N,2
OW P,OW DH AH,1
 Y AH, DH AH,2
AH NG CH,AH AW ER CH,1
 W, DH AH W,2
F G AH,F K AH,2
AA SH AH Z,AA ZH IH Z,1
Z AA N TH ER Z,Z AH V DH OW Z,1
Z AA N TH ER Z,Z IH K S P OW Z,1
Z D EY Z,Z N UW Z,1
Z D EY Z,Z DH EH R Z,1
D AH L G,D AO G,1
G L,G R IH L,1
G L,G Y AH L,1
IY M L,IY L,1
AH B UW M IH,AH IH,1
R EH R L,R IY L L,1
AY,AY F,1
AY,AY N,2
AY,AY V,1
F OW N IY,F AO R T IY,1
N D T,N T,7
HH AE N D,HH EH R,1
R EH G T,R EY T T,2
K AH,K AH JH AH,1
K AH,K AH P AH,1
F HH AH,F M AH,1
T HH AA,T AA,1
R D L,R AH N T L,1
F AH N,F W EH N,1
F AH N,F AY N,1
F AH N,F OW N,1
N D L,N HH IY L,1
ER N OW IH,ER D UW IH,1
NG L IY,NG,1
S AE T B AY,S EH D M AY,1
P AA N D AH N D S,P AO R T S,1
EH CH T DH AH,EH JH UH L IH N D AH,1
R EY G,R IY G,1
 B EH, DH AH EH,1
DH IY Z SH,DH AH SH,1
DH IY Z SH,DH AH IH SH,2
DH AE N B,DH AH B,1
ER CH AA R JH D,ER T ER N D,1
D EY K S W,D EH G Z W,3
AH HH,AH N HH,1
T S AH,T AH,6
 EH, DH AH EH,1
IY HH AE D Y,IY Y,1
 B AH T, DH AE T,3
D AA D AH T,D AO T,1
 AH F, F,1
L IH N,L AH N,3
 K IH, IH,1
N D ER,N AH G ER,1
ER G AA R T AH N CH,ER L CH,1
Z F AO R,Z AH N D R,1
R AO L,R OW L,1
L HH AA L AH D EY Z,L N OW DH IH S,1
 HH IY W, DH AH W,1
 HH IY W, DH EH R W,1
 W IH DH D, D,1
R AO AO,R AO,3
AO L F OW N,AO M AH N,1
IY AE K Y AH Z EY SH AH N,IY EH N,1
N Z AE T W,N IY W,1
W AH N S,W EY,1
 K AO R, AA R,1
R IY AH N D T,R T,1
IH SH P L,IH K L,1
L EY D T,L IY T UW T,1
G W IH DH B IY CH B,G B,1
Z F AO R AW,Z W ER AW,1
S M,S AH N D M,1
SH W,SH Y AO R W,1
SH W,SH T W,1
SH W,SH IH NG W,1
K IY S,K IH L ER S,1
S EY L,S EH L,2
M IH N AA,M EY AA,1
R IH N AH,R AH,1
AY AH N S,AY IH NG S,1
AH V AA,AH AE N AA,1
 AH CH, CH,2
 AH CH, TH EY V CH,1
NG EH N,NG AH N,1
N Z,N D R IH Z,1
AY M P R,AY N R,1
M R,M P AH L R,1
F TH AO T,F DH AE T,1
UW D IH,UW IH,2
UW D IH,UW IH NG IH,1
N K L IY,N T UW M IY,1
N K L IY,N G R IY,1
R AY T P ER HH,R AH N HH,1
AE P S IH,AE B Z IH,1
DH EH N,DH AE N,1
DH EH N,DH AE T,1
DH EH N,DH AE T AH N,1
N AE D,N EH D,1
AH D EH,AH T ER EH,1
V Z AH,V AH,1
S IH Z IH L,S AH N D S IY ER L,1
L N AH,L IY AE D AH,1
AH S,AH L EH S,1
S IH Z AH,S AH N S AH,1
DH AH P UW R,DH EH M F AO R,1
 W IY AO, DH AH AO,1
AY W IH DH AW,AY V ER T AW,1
S AA N,S,1
AO TH ER AY,AO K T R AY,1
AY Z D DH AH AH,AY T IH N AH,1
R EH S,R AA S,2
T IY ZH HH,T EY T HH,2
R IY D,R EH D,3
D Z DH,D DH,3
R IH S K,R IY Z K,2
 W IY K, K,1
AH S K Y AH L ER,AH SH IY N ER,1
ER AE B D OW M AH,ER IY AH,1
AH N IH,AH P IH,1
D F AO R Y AO,D AO,1
AE K,AE D,1
AE K,AE G K,1
ER Z SH,ER SH,2
D AW ER AO,D AA R AO,4
D AW ER AO,D AH V AO,1
AO L Y IH R,AO R HH IY R,1
G AE S,G EH S,1
S JH EH,S CH EH,1
N IH Z,N HH AE Z,1
M AH N TH S,M OW S,1
T UW S,T S,1
 HH AW G UH D IH, DH AH DH IH,1
IH Z Y,IH S Y,1
ER M AO R JH,ER JH,1
ER AH,ER EY SH AH,1
AH S DH EH R W UH D B IY N,AH N,1
N OW N IY,N ER L IY,1
IY D F,IY F,1
 B AA R B B, B,1
N D P,N P,1
Z IH,Z TH IH,1
Z IH,Z AA R IH,1
IH N AH B IH G B,IH NG K B,1
B AA N F,B AE K F,1
AY ER,AY R,1
IY AE N EH,IY EH,1
 Y AE L, DH AH AO L,1
AA P S M,AA CH M,1
AH N D S,AH S,1
G L AY K DH AE T,G,2
G L AY K DH AE T,G W EY,1
G L AY K DH AE T,G AA N F R AH M,1
R M R,R R,1
IY IH Z L,IY AH N D L,1
AO L P,AO R P,1
S M AH,S B AH,1
K AH P,K AA P,1
IY AE T DH AH,IY AH,1
AH SH,AH D IH SH,1
SH AO R,SH AH N AH L,1
SH AO R,SH UH R,1
SH AO R,SH OW AA N,1
Z M,Z D M,3
Z F AO R M IY,Z W AH N,1
Z F AO R M IY,Z,1
S IH T M,S DH AH M,1
W EY V Z,W EH ER Z,1
OY T,OY N T,1
AO Y,AO AH Y,1
AO L F,AO F,2
Z AE,Z DH AE,1
F AO,F AO R Y AO,1
ER JH ER,ER D ER,2
T IH,T W IH,1
T IH,T AE N IH,1
T IH,T D AH N IH,1
T IH,T AH N IH,1
IH N G R,IH L R,1
IH N G R,IH NG R,1
 IH Z IH T B IH K AO Z AH V M AY S L AH V AH N L IY N AH S DH AE T HH EH R G R OW Z AA N M AY F EY S,,1
R IH N,R AE N,1
AY IH,AY Y IH,3
Z S UW DH D B,Z B,1
IH DH DH,IH DH,3
ER N,ER AH N,2
ER N,ER M AH N,1
N M,N D M,2
V K AA M,V G AH M,2
IY AE Z,IY HH IH Z,2
IY AE Z,IY Z,1
T AH S,T AA R S,1
K IH T AH,K AH,1
EY D Z HH,EY T HH,1
EY D Z HH,EY S HH,1
S L OW,S W OW,1
L IY,L AH N,1
L IY,L AY K,1
L IY,L HH IY,1
ER V DH,ER B DH,1
ER V DH,ER F DH,1
AA AE,AA L AO NG AE,1
AA AE,AA AH N D AE,1
G R OW Z M AO,G ER AA ZH D AO,1
M DH AH AE,M T UW AE,1
NG D AW,NG ER AW,1
S T UW,S K UW,1
R IH SH,R AE SH,1
EY D T,EY T,4
 D AA N T AE S K M IY T UW K AE R IY AE N OY L IY R AE G L AY K DH AE T,,2
 D AA N T AE S K M IY T UW K AE R IY AE N OY L IY R AE G L AY K DH AE T, W AW,1
D K OW P,D W IH DH AA P,1
R AH M EY K DH AH,R AH,1
R IY P EH R,R OW K Y UH R,1
NG K L,NG L,1
L EY D,L EH G Z AA R D,1
R AY IH,R AO IH,1
 CH IY P S, S,1
W AO R N,W AA Z,2
AO NG,AO M AE N,1
AA T AH N,AA N,1
K AO R,K AA R,1
S EH D,S AY D,1
D Y UW W AO,D IY AH M AO,1
T K,T DH AH K,1
SH OW D,SH EH D,1
L IH Z,L AE Z,1
AE D Y,AE Y,1
D AA R K S UW,D AO G IH SH UW,1
K M IY,K AE R IY,1
R EH M B AH,R AE V AH,1
L EH S,L AE S,1
L EH S,L AH S,1
T HH IH,T IH,2
IY S SH,IY P AH L SH,1
T D R AH,T JH AA N M AH,1
AH NG K,AH K,1
K HH,K EY N HH,1
 HH IH Z W, W,1
DH AH F L AH,DH IH S W AH,1
AH D,AH N,2
AH D,AH N D,1
R D ER,R N ER,2
ER OY OW,ER AH OW,1
ER AO L Z,ER AH S,1
ER AO L Z,ER IH Z,1
V W AO R,V AA R,1
R AH B,R B,2
T F,T Y UW F,1
W AA N AH Z,W AO T ER Z,1
AE B D OW M AH,AE V AH N UW AH,1
IY AE T DH,IY DH,1
R,R Z,2
S L,S R IH L,1
S L,S M AO L,1
F AA F,F AO R F,1
N AH M,N IY M,1
M AH K,M IH K,1
V AE Z,V W AA Z,1
AH N T,AH D,1
AH N T,AH K T,1
AH N T,AH T,3
DH AH W,DH AE T W,1
S AE T,S EH T,3
AA N D,AA D,1
D AH N D S,D IH T S,1
K EH CH,K AE CH,1
CH T DH,CH DH,2
EY G IY,EY K IY,1
IY S,IY Z,1
IY S,IY Z S,1
IY S,IY,1
AE N B,AE T B,1
 HH ER R, DH AH R,2
 HH ER R, R,3
N EH V ER DH,N W IH DH DH,1
R D,R AH D,1
R D,R D DH AH K ER AH N T L UW D,1
R D,R AH N D,1
R D,R JH D,1
N OY L,N D AA L,1
N OY L,N D AO L,5
N OY L,N D OW N L,3
N OY L,N OW L,1
N OY L,N OW N L,1
N OY L,N AO L,2
N OY L,N ER L,3
N OY L,N D AA R HH AY L,1
R AE G L,R AY D L,1
R AE G L,R EH D L,2
R AE G L,R AA K L,1
AY Z S,AY S,1
AY Z S,AY N S,1
B OW L,B AO L,2
B OW L,B OY,1
N W,N D W,2
M AA P T,M AY T T,1
T TH IH K,T EY K,1
P AH L S,P AE S,1
P R AA P S,P AE S,1
S W,S W ER D W,1
D AH P,D P,1
R AH,R IH NG DH AH,1
R AH,R DH AH,1
Y EH L OW L IH L,Y AE NG K IY Z N EH L,1
S AA R,S AO R,3
 DH AH T, T,1
UW TH F EH,UW V EH,1
UW TH F EH,UW S P EH,2
F EH L,F IH L,3
L AE S,L AH B Z,1
R M AO,R AO,1
 D UW L, DH AH AH L,1
AY N B,AY D B,1
T HH IY T,T EY T,1
K S S,K S,1
S OW,S N OW,1
OW N L IY,OW B AA D IY,1
 SH IY B L UW HH ER N, AO R N,1
N D DH,N DH,2
UW HH OW,UW OW,1
D AO R F,D ER F,1
S T N,S N,1
 DH AH S, S,4
UW L IY,UW W IY,1
 D AA N, OW N,1
 D AA N, DH EH N,1
 D AA N, DH AH N,1
 D AA N, DH AH AH N,1
N T AE,N L IY AE,1
N T AE,N AE,2
K M,K T M,4
K M,K EH S T AH M,1
N OY,N IY TH IH NG OY,1
N OY,N D OY,3
 IH T W AA Z, DH OW Z,1
AA D ER N,AA R T AH N,1
W IH DH K,W AA Z K,1
S AH M F,S AO NG F,1
F UW L W,F AO R W,1
 V Y UW T, T,1
 K AA M B AY, DH AH F AY,1
L DH AH IH,L IH,2
S IH N AH L,S L,1
B S AE T B,B Z EH P B,1
 B EH G DH, DH AH DH,1
 B EH G DH, DH AH F AE K T DH,1
 B EH G DH, DH,1
D F AO R W AH N G,D G,1
AY DH IY Z SH,AY IH SH,1
Z DH AE N,Z AH N,1
Z DH AE N,Z D EY AH N,1
N B IY,N D V IY,1
N B IY,N P R IH T IY,1
T HH AE N,T AH N,1
S W EH N EH,S EH,1
 D AA N T AE S K M IY T, R AY T,1
T UW K AE R IY AE N OY L IY R AE G L,T L,1
 D IY N Z K, DH AH IH T K,1
 M IH D IY V AH, DH AH,1
AH L,AH HH OW L,1
AH L,AH IH L,1
AH L,AH G ER L,1
ER AA R,ER AO R,1
 K UH D DH, DH,1
DH IH S S,DH AH S,1
F AO R,F R,2
R M,R AH M M,1
 S W IH NG Y, Y,1
UW K AE N,UW,1
AY B AY,AY M AY,1
N Y UW AO,N HH IY AO,1
N Z P,N T UW P,1
N Z P,N P,1
AH B AO,AH AO,1
R IH NG N,R AH N,1
AH S UH P ER B S,AH L IY F R AH M S,1
D AA R K S,D AO G S,9
R IY AE N,R AH N,2
UW IH N,UW AE N,1
T HH ER,T ER,1
 AA, DH AH B AA,1
AA N DH IY,AA D IY,1
N R IH L,N L,1
EH M B L,EH L,1
M D IH P IH,M T UW B IY F IH,1
K T,K S T,1
T S DH,T DH,1
L AH G,L AO R G,1
OW,OW B,1
UW OW B EY,UW P EY,1
G AH,G L OW B AH,1
AH V ER M AH N,AH L Y UW N,1
T AO R D ER,T ER,1
 HH IH Z SH OW, S OW,1
OW L D ER F EH L T AE Z IH F IH T,OW AH V TH AO T,1
T W ER B R OW K AH,T AH,1
 S OW IH F AO, AH V AO,1
IY IH N B,IY AH B,1
EH D M,EH T ER M,1
L HH ER,L,1
 HH ER S, AO R S,1
P ER S,P R IY S,1
IH S T AH,IH ZH AH,1
N T L,N OW N L,1
 DH AH K AE T, G EH T,1
T S M,T M,2
AW AO L W EY Z,AW T AY Z,1
Z HH ER,Z ER,1
ER T S M,ER JH M,1
IY IH N K,IY G UH D K,1
M L AO S,M S,1
S K OW AH N S,S T R AO NG S,1
EY N M EY ER,EY T L IY ER,1
S CH ER,S T ER,1
G L OW,G OW,1
K AE R AH,K ER N AH,1
T AH M AA R OW,T UW AW ER OW,1
OW HH,OW N HH,1
R AH M,R M,2
R IY AE,R IH NG AE,1
S EH D DH,S EY DH,1
 B EY, DH EY,1
EY K S,EY S,1
 D IH, DH IH,2
S EH M B ER AH,S AH,1
AH N D JH,AH V R IH JH,1
JH AE N Y UW EH,JH EH,1
EH R IY AA R,EH K T AO R,1
S M AH N TH S,S P L EY S,1
D IH N M,D DH AH M,1
M AY AE M IY,M AH N IY,1
AW G UH,AW K UH,1
D IH Z,D DH IY Z,1
D IH Z,D EH Z,1
Z Y AO R EH N D,Z M ER D,1
 B AA R B B ER N D P, P,1
 B AE S K AH T B AO L K AE N B IY AE N EH N T ER T EY N IH NG S P AO R T,,2
F AE T SH,F EH CH SH,1
D IH,D HH IH,2
IH N L,IH M L,1
SH ER T,SH UH R,1
 IH T, DH AE T,3
 IH T, T,1
Y AH NG CH,Y AE CH,1
Y AH NG CH,Y EH P CH,1
R EY L,R AY L,1
 N EH V ER HH, IH F Y OW Y AH R HH,1
L AY F,L AE S T,1
 T UW F, F,2
HH IH Z,HH UW Z,1
R IY D Z DH,R EY T S DH,1
K AA S,K AO S,1
T UW M N,T IH NG N,1
IY EH L AH,IY AH,1
G AH N,G EH N,1
 G EH S DH AH K W EH, Y EH,1
EH S CH AH N F R AH M DH AH AE N S,EH S,1
S ER,S,1
 SH IY HH AE D Y AO R D, AH N D,1
D AA R K S UW T IH N G,D G,1
D AA R K S UW T IH N G,D AO G,1
AO T ER,AO R D ER,3
L IY R,L DH AH B R,1
L IY R,L R,2
L IY R,L D R,1
L IY R,L AH R,3
L IY R,L IH R,1
L IY R,L IH N R,1
AH B,AH V B,1
B AW T IH T S AE,B AO L D AE,1
AE P L AH K AH,AE Z AH,1
UW P IY,UW L IY,1
IY P AH L,IY V,1
 D UW Y, DH AH Y,1
 HH, DH AH HH,3
 HH, IH F HH,1
HH UW AO TH ER AY,HH OW L L AA T AH V AY,1
S AH K AW,S IH V N AW,1
AW N T,AW,1
R IH S,R AH S,1
R IH S,R IY S,1
R IH S,R IY AH S,1
 W AY, R AY,1
AY Y,AY T Y,1
Y EH L AO R,Y AE AH W IH R,1
R W ER IY,R IY,1
IY AY T AH M Z,IY IY DH ER,1
Z N AA T IH,Z IH,1
K DH EY G,K AH G,1
EY V W,EY T W,1
L D S,L S,1
F R AO S,F AE S,1
R K S UW,R Z UW,1
DH AH TH IY M,DH AE T F EY M,1
HH IY S,HH EY S,1
S UW DH,S OW DH,1
DH IH NG L,DH EY L,1
HH IH,HH IY R IH,1
HH IH,HH IY R W IH,1
IH ER Z,IH Z,1
Z W EH R,Z F AO R,1
R L,R AH L,1
L AH K W,L AO NG T EY L W,1
IY S T EH P IH N,IY D AE M D AE N,1
S UW DH D,S OW B AE D,1
D B AY DH,D DH,1
DH AH L AH G ZH ER IY AH S M AH S AA,DH AE T Y AO R CH EH R IH Z T R UW AA,1
AA ZH,AA R CH,1
IY CH AH,IY T AH,1
P AA R T,P OY N T,1
EY N M,EY M,2
B AY W,B AH T W,1
NG HH AA R,NG T AH W AO R,1
S B IY,S M IY,1
IY AH N,IY IH N,3
AY AA,AY AA N AA,1
 B AA B P EY P ER D OW V ER DH AH L IH V IH NG R UW M M Y, Y,1
Y UH R AH L Z,Y EH S,1
 W EH R W ER Y UW W AY L W IY W ER AH W, W,1
EY,EY T,1
EY,EY N,1
IY W AA SH,IY B AO SH,2
 IH N SH, SH,1
 IH N SH, DH AH SH,1
R T AH,R AH,1
R T AH,R D AH,2
R T AH,R D IY AH,1
D T UW B AA R,D M AO R,1
R OW AE N,R AH N,1
R B AO R IY AH,R M ER AH,1
AH L F,AH N D F,1
Z S,Z HH IY S,1
SH T,SH T T,1
F AA G P,F AO L P,1
F AA G P,F AY V P,1
N Z S,N IY S,7
N Z S,N D S,2
N Z S,N S,2
G R IY S,G S,1
W AA SH W,W ER S W,2
W AA SH W,W AY T W,1
W AA SH W,W EY S T W,1
W AA SH W,W AY AO R W,1
W AA SH W,W AO T ER W,1
D AA N,D AW N,1
AE S K M,AE Z M,1
UW K AE R,UW CH EH R,1
R IY,R IH T IY,1
D DH AH P,D T UW P,1
B UH K IH,B ER G IH,1
S L IY,S,1
M AH DH,M DH AE T DH,1
DH ER AH,DH EH R AH,1
N AO T,N AA R T,1
T IH S,T AH S,2
T IH K CH,T N EY M D CH,1
F AO L T,F AY V,1
L AY,L AE N D,1
Z AE T,Z IH T,1
T W AH N S,T IH Z,1
T AY M F,T AE B F,1
AH V AY,AH B AW T AY,1
G OW L Z,G AY Z,1
M HH IH,M IH,1
R HH IY K UH D T,R T,1
T EY K AE T,T AA R G AH T,1
P L EH Z AH,P ER F AH,1
M B AH L D TH,M OW TH,1
AH F AA R M Y AA R D,AH N AW AH N D,1
IH T,IH M,1
T S S,T S,2
S D IH,S B IH,1
Z IY Z AH,Z N AH S AH,1
AA SH AH,AA S AH,1
AH Z AA R V,AH S AH V,1
 P AE M G IH V Z, HH IY W AA Z,1
SH EH D D,SH IY D,1
N AE,N D AE,2
N AE,N HH AE,1
N AE,N Z AE,1
R IY S IY,R EY Z IY,6
R IY S IY,R AH F IY,1
 TH AE, DH AE,1
T L,T W IH L,1
N T IY T,N T,1
T UW IY,T IY,1
IY T B,IY B,1
D T UW D,D D,1
 AA R Y, DH AH Y,1
 AA R Y, Y,3
AY AE,AY HH AE,2
D DH AH OY L,D AO L,1
 D AH, DH AH,1
AH Z S,AH S,1
T AE,T S AE,1
T AE,T AY AE,1
 AH N, N,1
V AA K,V AW ER K,1
D N IH R DH,D DH,1
 AH B, B,2
AH F,AH F AA R M F,1
 IY T IH NG S, S,1
S AH Z S,S S,1
T T W,T S W,1
W AY,W AY AY,1
AY T AA,AY K AA,1
SH OW N W,SH AE L W,1
W AO R W,W AA Z W,2
W AO R M F,W AH N F,1
W UH L,W IH L,2
W UH L,W IH L L,1
W UH L,W EH L,2
N OW,N D OW,3
 R AE, DH AE,1
AE L F K AH N T R OW L D DH AH S T,AE T,1
T AA P W AA CH F R AH M,T M,1
M DH AH,M AH,1
AH B L IY CH,AH CH,1
CH ER Z,CH,1
S B R,S P R,1
R OW SH,R EH SH,1
SH UH R IH,SH ER IH,1
L EY T,L ER T,1
T IH V,T UW AH V,1
IH NG S,IH Z S,1
 AY, DH AH G AY,1
