AY Z L,AY L,1
HH AA T HH AH N IY AY,HH AY F AY,1
AY Z DH AE T S IH,AY V Y IH,1
IH Z,IH R Z,1
Z AH L,Z OW L,1
AH S P R IH NG T,AH T,1
R S,R AH S,1
NG AH N D AH,NG AH,1
 S T IY V W AO, DH AH D EY F AO,1
AY T R,AY B B R,1
 SH IY IH Z TH IH N ER DH AE, K AE,1
AY AE M,AY G EH T AY AH,1
AH Z AH,AH M S AH,1
AH N D AE,AH M AE,1
K DH AE T,K AH N D,1
K DH AE T,K AH B AW T,1
K DH AE T,K,4
K DH AE T,K D AY AH T,1
K DH AE T,K IH T,1
 IH T IH, HH IH,1
Z AA IH N S,Z AY S,1
AY R IH NG,AY,1
IY DH EY,IY S EY,1
EY S EH D HH IY D IH D S,EY M W AA Z AH S,1
L IY P B,L EY V B,1
B AH T,B OW T,1
B AH T,B R IH T,1
AE T HH,AE N HH,1
 AE T R, R,1
OW L,OW N,1
 R AA B S AE, DH AE,1
AH P AA N D AH N D S,AH G EH T S,1
S K EH CH T,S T,1
T DH AH S,T UW S,1
T DH AH S,T S D IH S,1
T DH AH S,T S,1
R EY G IY,R AY K HH IY,1
R EY G IY,R IY,1
S,S EH Z,1
S,S R IY T EY L,1
 B EH G DH AE, TH AE,1
AE T G AA R D F,AE NG K AY F,1
R W AH N G,R L AY K G,1
Z DH AE N B,Z S AH M B,1
IY S IY,IY Z IY,4
N T M,N M,1
 AH G, G,1
R AH S T S,R S,1
HH EH N,HH AE N,1
M IH N,M AH N,1
N AE N AH,N D IH T AH,1
 Y, DH AE T Y,1
 Y, DH AH Y,1
UW W ER IH,UW IH,1
W IY,W ER HH IY,1
R AH N T Y UW,R,1
N IH T,N,1
Z P R EH,Z B EH,1
T IY ZH HH IY AH,T EH G AH,1
M N,M Y UW N,1
N IY D AH,N Y AH,1
AH D B L,AH N F L,1
K G L,K L,3
L AH V Z T,L OW S T,1
F ER M,F AO R M,1
N T AH D B,N IY B,1
S IY M D R,S OW B R,1
R AE DH,R AH DH,1
EY EH N D AH D AH B R,EY R,1
AH P T L,AH F L,1
IY AE T,IY EY T,1
T DH AH,T AH,1
K DH IH,K HH IH,1
IH S D,IH Z D,1
UW D AW ER AO,UW AO R AO,1
T EH JH,T EY JH,1
D N IH R,D HH IY R,1
R DH AH SH AO R,R T UW JH OY N,1
IY AE M B AH,IY AH,1
AH L D,AH N D,1
AH L D,AH M D,1
D TH,D P UH T TH,1
S UW T IH N G,S IY G,1
S UW T IH N G,S OW G,1
 D AA N T, DH AE T,1
 D AA N T, DH AH AW T,1
T AE S,T S,1
T AE S,T AY EH S,1
T AE S,T EH S,1
S K M,S M,2
S K M,S T AH M,2
S K M,S T M,1
M IY T UW K,M AY DH AH K,1
T AO S,T AE S,1
Z HH IY M,Z IH T M,1
M AH G,M G,1
D AE K T S AH,D AH,1
AH V S,AH N D S,1
AH V S,AH B JH EH K T S,1
L D IH S T R IH K T S,L,1
AY EH N IY K,AY K,1
V W AO,V AO,2
T HH IH Z,T AE Z,1
Z V IH K,Z F EY K,1
K T AH,K AH,2
AH M K,AH V K,2
D AE T G,D AH G,1
N P OY N,N AA N,1
N T F AO R TH,N TH,1
 IH G, G,2
G W AA N,G Y UW AH N,1
AE L AH,AE V AH,1
Z AA R T,Z AH V T,1
Z AA R T,Z AH N D T,1
S AE T DH EH,S EH,1
EH R,EH D TH EY R,1
Z S W,Z W,1
AE D AH T IH,AE V ER IH,1
IH V Z D,IH JH T UW D,1
IH V Z D,IH JH D,1
 K IH N D ER G, G,2
G AA R,G AO R,1
T DH EH R,T Y AO R,1
R IH SH P,R EY S P,1
G L AY K DH AE,G W AH N M AE,1
AE T,AE N,2
AE T,AE S T,1
AE T,AE K,1
AH D AO R D,AH T ER D,1
R AW T,R UW T,1
Z F AO R AO,Z W ER AO,1
 HH IY W IH L AH L AW AH R EH R L AY, Y AE,1
N G R IY S IY,N AE Z HH IY,1
AA SH W AO T ER AO,AA Z AA N AO,1
M IY T,M AH T,2
M IY T,M EY T,1
M IY T,M AH N T,1
T UW K,T K,3
T UW K,T AH D K,1
T UW K,T AH K,1
IY R,IY G R,1
IY R,IY IH R,1
R AE G,R EH G,3
R AE G,R IH G,1
K AW ER IH NG P,K AY P,1
AW AO L S,AW S,1
F AA S,F AE L S,1
S F EY T S,S HH UH D Z,1
DH AH S,DH IH S,2
DH AH S,DH AE T S,1
R EY N,R AY T,1
AA R AH,AA N AH,1
AH N IY V AH,AH M IH L Y AH,1
N L IY D,N D,1
Y AH T,Y UW T,1
T AH D,T IH T,1
T AH D,T UW D,1
T AH D,T ER,1
 AH L, L,1
AW L,AW D L,2
R AE SH AH N,R EY T IY AA N,1
Z AO L EH R ER,Z AW ER ER,1
T S IH N AH G,T G,1
G AO G M,G AA D M,1
B AY Z,B AW Z,1
SH M IH L K IY,SH N UW AH V IY,1
K K,K DH AH K,1
S N AH,S P AH,1
AH G L,AH B L,1
L EH K,L IH K,1
L EH K,L AY K,2
K T DH AH P UW R,K B IH F AO R,1
K T DH AH P UW R,K M AO R,1
DH IY Z S,DH AH S,1
 D UW, T UW,1
NG AO R,NG AA R,1
L AH S,L S,1
AH N S,AH M Z,1
Z P R AH,Z AH,1
AH M OW T,AH B AW T,1
R K S,R N D S,1
R K S,R T S,1
R K S,R S,1
L Y IH R,L HH IY R,2
EY S,EY S S,1
L AY T AO R SH,L AE D ER SH,1
M AY AA D AH,M AW N T AH,1
ER D OW,ER G OW,1
OW V ER DH,OW T UW DH,1
UW M M,UW M,1
M Y UH R AH L Z,M,1
 M IH D IY, DH AE T IY,1
 M IH D IY, DH AH IY,1
N HH AY R AA R K IY Z,N P AW ER,1
B UH L,B OW L,1
IH M EH,IH P AH L EH,1
K S EH S,K S,1
EY F R AH M ER,EY AA N ER,1
L IH D,L EY T,1
 B AE S K AH T B AO L K AE N B IY AE N EH N T ER T EY N IH NG S, S,1
IY AH V,IY HH AE V,1
AH L L,AH L,1
L EH D W,L W,1
 HH IH Z S AA R K AE Z AH M W AA Z F AA L OW D B AY AH S T UW P AH D G R IH N AH V HH IH Z TH IH K M AW TH AH N D B AE D T IY TH,,1
AA G G,AA G,3
G EH T,G IH T,4
IY IH N,IY AH N D AA N,1
IY IH N,IY AH N,5
IY IH N,IY AH N D AH N,1
N AO,N F AO,1
N AO,N D AO,6
AO T AH M,AO R,1
S AH,S T AH,1
S IH NG,S AE NG,1
NG IH F F,NG AH F,2
NG IH F F,NG AH N D F,3
NG IH F F,NG DH AH F,1
 M AA M, IH M,1
K S AE,K T AE,1
AE P AH T,AE D V ER T,1
Z ER Z,Z IH NG,1
AE G L,AE N L,1
AE G L,AE D L,1
AE G L,AE T IH K L,1
 DH AH P L, L,1
L EY N,L AY N,1
N T AH,N AH,1
N T AH,N D AH,2
AH F IH,AH V IH,1
DH EY K EY,DH AE T G EY,1
P AA N,P OW N,1
N CH,N IY CH,1
IY T AH,IY D AH,1
L D IH R,L DH EH R,1
R AE T W,R W,1
EY EH K,EY AE K,1
S K L,S P L,1
R IY IH N,R AE N,1
R S S,R S,1
S IY M,S EY M,2
IH DH,IH DH DH,1
K OY L,K AH L,1
 DH AH K, K,2
IY IH N AO T AH M,IY G UH D,1
 L AE F D, W EH R D,1
 L AE F D, D,1
S AH N D S,S IH NG S,1
S AH N D S,S ER Z S,1
S IH,S EY IH,1
Z AH P AA,Z IH K AA,1
N Y UW,N AH M IY,1
N Y UW,N,1
W AA SH W AO,W AO R F AO,1
 DH AH K L IH R L IY AY D EH N T AH F AY AH B AH L EH N AH M IY K AH N T IH N Y UW D AA, AA,1
AE Z IH F N,AE V N,1
 K AA M P ER, DH EH R W ER,1
ER AH B AH L T,ER T,1
N D Z,N Z,2
N R IY K,N AH L K,1
K W AY ER Z P,K AO R P,1
ER EY JH,ER IH JH,2
ER T UW K,ER K,1
ER T UW K,ER AH N D AH K,1
AE F D,AE S T D,3
AE F D,AE P D,1
L UH R F,L ER T F,1
N AH V,N HH AE V,1
Y EH T R EY S,Y AE AY S,1
Z B Y UW,Z G UW,1
AH AE N,AH AH N,1
AH AE N,AH N,1
 HH AY, AY,1
D F R,D TH R,1
IY W EY M IY N,IY B IH N,1
M TH IH NG,M L AE NG,1
IH D DH,IH NG DH,1
AE CH,AE N CH,1
CH T HH ER S,CH EH S,1
S K ER,S T ER,1
S K ER,S IY V ER,1
ER T,ER,2
W IY M EY,W EH N DH EY,1
IH Z P,IH T S P,1
M W AA Z,M IH Z,1
T B AH T DH,T W IH DH DH,1
T IH F W,T W,1
W IY D,W UH D D,1
T L IY,T,1
 D UW W, W,1
L K L AO TH S,L Z,1
 DH AH B, R AA B,1
B EH S T W EY T UW L ER,B ER,1
ER N IH Z T,ER T,1
T UW S AA L V EH K S,T S,1
S T R AH P R AA B L AH M Z,S,1
L AH N,L IH N,1
L AH N,L ER N,1
Z P AA R T IH K Y AH L ER L IY IH,Z IH,1
M AH T IH V F,M D HH ER F,1
AA R K S UW T IH,AA G Z TH IH NG IH,1
EY L,EY Y OW L,1
D N UW Z,D M IY L Z,1
Z D,Z AH D,1
P AW T,P AA T,1
M F L,M P L,2
 R, DH AH R,2
R AE L F K,R UW T K,1
L D DH AH S T AA,L W AA,1
AA P W,AA Z W,1
B L,B IH L,1
L IY CH ER Z,L D IH NG Y IH R Z,1
CH G AA R B IH JH,CH D AE M AH JH,1
 S UW N DH, DH,1
W ER K K,W EH R AH K,1
T AY M,T AW N,1
HH EH N W,HH IY W,1
D AH N,D IH N,1
N D AO,N AO,1
DH AE N N,DH AH N,1
 P, DH AH P,3
P R AH S,P ER S,1
S IY D IH,S UW IH,1
OW L IY,OW,1
K OW L,K AO L,1
L AA AE,L AE,1
AE F T ER AY AE D,AE N D,1
AH OY L,AH B IH T,1
AH OY L,AH D IY L,1
 IH N, AH N,1
N D IH D,N D,1
K IH,K L IH,1
 IH T W UH D B, DH AH B,1
AY S,AY V S,1
S T L,S L,1
AY K R AY,AY T W AY,1
F AH,F R AH,3
AH L M,AH M,1
N EY,N D EY,1
 AE N, AH N,1
AA K T,AA N T,1
T IH L Y AH N,T N,1
N AE T AH,N OW AH,1
AH M Z N,AH N,1
N AW L EH T AH S S,N D S,1
 DH AH S AW N D AH V JH, JH,1
F AH R Z B Y UW G,F ER S P IY G,1
EY AH N D F,EY F,1
EY AH N D F,EY IH T F,1
IY N DH AH S,IY AY S,1
EY M TH IH NG,EY,1
M ER AY V IH,M IH,1
IH NG AA,IH R AA K AH N D AA,1
M AE CH T,M OW S T,1
T HH ER S,T R AH S,1
L V OW K,L DH AH K,1
AE B Y AH L EH R,AE R,1
IY K,IY ER K,1
 SH IY HH AE D Y, Y,1
AA R K S UW T IH N G,AA G,1
G R,G Z AH R,1
K T AA,K D AA,1
N AH HH,N T HH,1
HH AH B W,HH AE V W,1
 OW DH, DH,1
N D F,N F,1
 M AY, L AY,1
AH L K,AH K,1
K AH L ER D DH,K AA R DH,1
M W AO L W,M W,1
AW AH D,AW D,1
 P R AH, DH AH,1
P R,P AA R,1
R AY AH T,R T,1
R AH S,R S,1
R AH S,R EH S,1
S EH M,S IH M,1
B AH L,B AA L,1
L D IH,L IH,1
IH N,IH K AH N,1
N B,N D B,3
N B,N D HH EH L B,1
M OW L,M AH D AH L,1
 D R AA P F AY V F, DH AE T DH AE T F,1
OW AW T,OW AE P,1
 W AY P IH K M IY F AO R Y AO R P AE T S IY,,1
Z OW L,Z AO L,1
L D B,L B,1
ER OY K,ER AO R K,1
OW T AH,OW D AH,1
OW K T,OW L D,1
IH G G,IH G,1
G OW T,G AW T,1
IY AE M B,IY EY B,1
N AH CH N,N IH T S N,1
N AH CH N,N IH SH N,1
V SH AH B L,V S IH M P L,1
 Y UW W, HH IY W,1
D,D AH K R AH S,1
D,D Z,1
Z B AH L JH D D,Z P AA R T S D,1
 F OW L D IH N T UW W IH P T K R IY M AH N D AE D AH D AE SH AH V S AO L T AH N D S P R IH NG K L IH NG AH V P AE P R IY K AH,,1
DH AH M IH,DH IH,1
HH EH L,HH AH L,1
L P G,L OW G,1
EY OW N,EY AA N,3
S IH N DH AH R,S R,1
 SH IY HH AE D, D,1
 SH IY HH AE D, CH IH L D,1
D Y AO R D AA R K S UW T IH,D AY IH,1
AE S K,AE Z AH K,1
T UW K AE R,T R,1
IY R AE,IY HH AE,1
AH P EH,AH V EH,1
EY D S,EY S,1
 HH IH Z HH IH S T ER IY IH Z HH IH Z AH L OW N Y EH T IY CH M, M,1
N M AH S T R,N HH AE Z R,1
Z HH,Z D HH,1
 M AY K AH L K AH L ER D DH AH B, B,1
EH D R UW M W AO L W IH DH K R EY AA N Z,EH T ER,1
 HH EH L P G, G,1
M IH,M DH IH,1
M IH,M AH N D IH,1
IH Z AH,IH S AH,1
AA P Y AH,AA R T M AH,1
AH L ER AY,AH N T AO R AY,1
S UW T,S EH N T,1
S UW T,S IH T,1
S UW T,S ER T,1
 L, DH AH F L,1
 L, G L,1
 L, DH AH L,2
OW D JH UW AH,OW B AH,1
L B R,L T UW R,1
T TH R UW DH,T DH,1
N P AO,N F AO,1
 S AE L V, D AA V,1
V EY SH AH N R,V OW S R,1
ER D,ER,1
 DH, DH AH DH,1
 DH, DH AH F R AH M DH,1
M IH K,M EH K,1
P EH N S,P ER T S,1
S IH V P,S DH AE T AA R P,1
K T DH,K DH,4
K T DH,K IH NG DH,1
 P L IY Z D IH G M AY P, P,1
OW Z AH P B IH F,OW F,1
F AO R F R AO S,F AE M AH L IY S,1
 IH D R, DH AE T R,1
R AY D DH AH S,R IY S,1
AH B W EY B,AH N T L IY B,1
T IH N AH F CH,T CH,1
JH,JH D,1
 SH IY, S IY,1
 SH IY, HH IY,2
IY HH AE D,IY EY JH D,1
N T AE S,N EH K S,1
N T AE S,N AW N S,1
R AE G L AY,R EH D M AY,1
R AE G L AY,R AY,1
AY K DH,AY DH,1
S ER Z,S AH Z,1
ER IH N T,ER T,1
N IH N,N AH N,1
P AO R SH,P OW SH,1
N D AH,N AH,2
UW Z,UW Z ER Z,1
UW Z,UW AE Z,1
Z AH SH,Z SH,1
T AH V,T HH AE V,1
B IY IH,B IH,2
IH NG B,IH N B,1
 CH, DH AH CH,1
T AA K IH NG Z R,T AH F TH R,1
R AH N DH,R UW AW T DH,1
M TH EY R W AO R,M DH EH R,1
AE S K M IY T,AE Z T,1
R AE G L AY K,R EY K,1
K DH,K AH W EY DH,1
AY F T,AY V T,1
D AH K,D EH K,1
D D IH P,D DH AH P,1
P L,P AH L,1
IY SH AH N,IY S IH T,1
S R AE T AH L S,S ER AW N D S,1
S N EY K,S P IY K,1
P Y UW,P,1
UW IH S,UW EH K S,1
K EY P AW ER F,K AA R F,1
 CH IY P S T AA K, JH EY M Z D AO K,1
IH NG Z,IH N Z,1
M TH EY,M DH EY,1
EY R,EY AA R,1
 D AA N T D, DH OW D,1
M M EY K S B,M L EH G Z B,1
B OW,B L OW,1
OW N Z AH N,OW N,1
T IY,T UW B IY,1
IY TH S,IY S,1
 R EH, V EH,1
Z AO F AH N K,Z IH M K,1
S AO F AH,S AH V DH AH,1
Z B AH T HH,Z AO R HH,1
IH NG,IH T,1
T S HH EH,T EH,1
L TH IY ER,L HH ER,1
T SH UH G ER,T DH EH M,1
IY B AA G G EH T,IY IH T,1
T S V,T V,1
 M AA, AA,1
AA M,AA R M,1
R AO NG,R AA NG,1
L IY D,L AY K D,1
L IY D,L T UW AH D,1
S UW T IH N,S AH JH AH N,1
AY K DH AE,AY T AA N M AE,1
AH V T,AH N T T,1
NG P AA,NG HH AA,1
D AH F,D F,1
S AH P HH,S IH M HH,1
P R EH S,P EY S,1
IY ZH HH,IY T UW HH,1
IY D Z DH,IY CH DH,1
 W AY Y, Y,1
Y EH L AO R W,Y AE AY W,1
V AH N,V IH N,1
M IH L Y,M DH AH Y,1
Y ER S,Y AO R S,1
R EH P,R AE P,1
P T P,P P,1
N IY DH,N DH,1
DH ER S,DH AH AH V S,1
AY D,AY N,1
L D D,L D,1
M K IH,M F Y UW Y IH,1
IH D N AE P ER Z,IH R Z,1
N DH IH S Y,N Y,1
M W EH N,M AA N,1
M AH CH S,M ER S,1
S T AH,S AH,1
S T AH,S IY EY SH AH,1
AH D IY,AH N EH R IY,1
IY W AA SH W AO,IY AO,1
P L EY N,P OY N T AH N,1
D P R,D G R,1
Z DH AE,Z AE,2
AE T S N,AE Z N,1
R AH JH,R JH,1
S AE T B AY DH AH,S AH,1
AH P AA N,AH N,1
N D AH N D S K,N L AY K,1
K EH CH T DH,K DH,1
S T R,S IH Z JH EH R,1
R W,R AH M W,1
R W,R M W,1
R W,R AH W,1
B AY DH IY,B AA D IY,1
IY Z SH,IY SH,1
SH UW Z DH AE N,SH EY P S AH N,1
IY OW,IY SH OW,1
OW V ER CH AA R JH D,OW N,1
D Y AO R,D R,1
T W UH D B IH K AH M,T HH OW M,1
G EY,G UH D,1
W EH R OW,W ER OW,1
L AH B IH,L OW V IH,1
N D IY D B,N T AH B,1
F AY L,F AO L,1
IY W AA Z,IY IH Z,2
N HH AY,N P R AY,1
AY R,AY AO R,1
R AA R K IY,R AH T IY,1
AO R D AA R,AO R,1
T IY N,T EY N,1
N IY EH N,N IH NG N,1
N V AH L,N AW B IH L,1
OW P T,OW T,1
UW IH,UW HH IH,1
IH T S R,IH Z R,1
 DH EH R Z IH Z AH S AE, D AE,1
AE K R AH F IH SH AH L L AY F B AY ER TH L IY S,AE N S,1
S T AE N D ER,S ER,1
ER D Z,ER Z,1
IY AW AO,IY AY AO,1
 K L IH F W AA Z S UW DH D B AY DH AH L AH G ZH ER IY, IY,1
IY AH S,IY S,1
S M AH S,S T S,1
S AA ZH,S AY D,1
N T AY M,N D F AE M,1
M L,M AH L,1
DH AH B,DH B,2
M EY ER,M IY ER,1
IY B AY W ER K IH NG HH,IY DH AE T HH,1
AH NG S,AH AE N S,1
S T ER,S ER,1
IY T S,IY Z,1
K AE R IY AE N,K ER IH N,1
 W IY N, N,1
N UW DH,N OW DH,1
DH AH AY R,DH AE T AA R R,1
R AA N,R AH N,1
IH K F,IH NG F,1
 K AH, DH AH,1
AH V,AH AE V,1
ER AH JH,ER IH JH,1
AE D AH,AE T AH,1
AH D T,AH T,1
R IY M Z,R EY N Z,1
Z AE T T,Z AH N D T,1
L G EY,L D D EY,1
T HH IH Z V IH K,T AE S P EH K,1
IY IH Z TH IH N ER DH,IY DH,1
AE N AY AE M,AE T,1
G W AA,G OW AA,1
AH Z AH N D AE,AH S W IH DH AE,1
W AO R DH,W AA Z DH,1
IY AO R DH,IY B AY DH,1
Z W,Z AH N D W,1
L OW ER D,L AO R D,1
D IH N,D AH N,1
 T UW P, DH AH P,1
Y UW AA R,Y OW Y AH R,1
D IH D,D AH D,1
N N AE N S AH Z,N CH UW Z,1
 DH AE T N OY, OY,1
OY Z P,OY P,1
R D AA R K S UW,R T UW,1
R D AA R K S UW,R P IY P AH L Y UW,1
OW L D P,OW P,1
ER AA R B,ER AH B,1
S HH AE Z,S IH Z,1
Z F AA L OW D S,Z IH T S,1
S IH M P,S P,1
P AH L ER L,P L,1
L AY N,L AE N,1
R HH ER G,R DH AH G,1
D DH AH ER AY V AH,D M IH R AA B AH,1
OW B AH L P,OW S T IH M P,1
P AA R,P AO R,1
T N,T AH N,1
N ER,N T,1
N S,N D S,1
N S,N B IH Z IY,1
 P IY T, IH T,2
ER IY AH Z,ER IH R Z,2
Z AA R K,Z AH K,1
CH,CH IH M ER JH,1
V F AO R M Z,V D AA L ER Z,1
 HH ER W, DH AH W,3
N OY L IY R AE,N AO T AH M AE,1
N OY L IY R AE,N D AY AH T AE,1
AH AH B V,AH AE D V,1
N AH S,N IH S,1
ER AH S,ER S,1
N T IH L Y,N D Y,1
Y UW P,Y AO R P,1
N D M,N M,1
L DH AH AO,L D AO,1
 W AY B, L AA T B,1
AY OY L W,AY AO R W,1
W EH N Y,W IH DH Y,1
S M AY,S B AY,1
AY N,AY,1
B AO R IH NG N,B OY N,3
N AA V AH,N AO T AH,1
L IH Z AH,L AH,1
L IH Z AH,L AH S T DH AH,1
S UH P ER B S,S AA R S,1
L HH AW EH,L AY EH,1
IH B AH T DH,IH DH DH,1
 AO R DH AH B EY, M AA D ER N D EY,1
N HH IY T,N D,1
EH S T,EH Z AH N T,1
T IY ZH HH IY,T AH S K IY,1
Z DH AH W,Z T UW W,1
L AH V Z,L OW Z,1
S AH S,S AY S,1
JH EH F,JH IY F,1
L IY N D SH,L EY M Z SH,1
SH W AO,SH AO,1
 AH P, P,1
ER IH Z,ER Z,1
S ER K AH,S AO R T AH,1
AH L D HH,AH V HH,1
 R AA B S, S,1
T B AY DH AH,T AH,1
N D AH N D S K EH,N IH T G EH,1
EH CH T,EH T,1
R EY G IY S,R OY D N AY S,1
D F AO R W,D AH N W,1
W AH N,W AA N,1
N G AE L,N T Y EH L,1
L AH N AH V G AE,L AE,1
AE S,AE T DH IH S,1
 IH D R AE, M AE,1
AE DH ER N,AE N,1
N AA T B AY DH IY Z,N AH JH ER Z,1
Z SH UW Z DH AE N,Z AH N,1
W EH N EH,W AH T EH,1
D DH AH AE,D B IY AE,1
R OW TH AH V T,R EY T T,1
DH EH N W AO R N AH,DH AE T AH,1
 DH EH R AA R M AO R, AY R,1
R AA B V IY,R IY,1
AH S N IH M F OW M EY N IY AE K S AA N EH N IY P R AY,AH L AY,1
AY V AH T AY S,AY Z S,1
R B AH T R,R W EH N R,1
Z AO L,Z D AA L,1
L EH R ER,L ER,2
SH M,SH L IY M,1
IH L K IY CH W,IH N T IH D AH W,1
IH N G,IH R G,1
IH N G,IH NG G,1
EH TH AH,EH D AH S AH,1
 DH EH R W, IH T W,1
S AH V R AH G,S OW W IY G,1
R EH T,R EY T,1
T AH N D S,T S,1
 B AH T W, F AO R W,1
ER DH AE N N AE,ER AH D V AE,1
V DH,V D DH,1
ER AY AE D,ER AH N D,2
AH OW EY S,AH AA N AH S,1
S IH S W,S EH Z W,1
Z AH M,Z N T M,1
M ER AA ZH,M AY N,1
G R OW,G OW,1
T ER AO,T AO,1
IY AH V F,IY F,1
T D AH,T DH AH,1
EY Z R,EY S R,1
 AH B AW T, DH AE T,1
IY AE T DH AH SH,IY EH N D Z SH,1
N T AE S K M IY T,N T,1
AE G L AY K,AE K,1
Z AH V K,Z K,1
W AO T ER AO L Y,W AH N Y,1
K DH AE,K B AE,1
K DH AE,K S T AE,1
 HH AH Z, AE Z,1
B AH N,B IH N,1
B AH N,B IY V IH N,1
N D R,N V EH R,1
N D R,N R,1
Z B AW,Z F AW,1
K R EY,K M EY,1
AA F T JH,AA L AH D JH,1
N D N,N N,1
OW L D S T ER,OW N ER,1
 AA B JH EH K T S M EY D AH V P Y UW T ER AA R B Y UW T AH F AH L,,1
B G L,B L,1
IY P S,IY F S,1
L AY K DH AE T,L ER,1
Z N,Z IH N,1
N AY AH,N DH AH,1
L IH S,L AE S,1
NG IH,NG L IH,1
IH Z AE N,IH S AH N,1
N P L EH Z,N D TH AW Z,1
N T W,N D W,1
T DH AH SH,T IH SH SH,1
L AH D AY,L ER T AY,1
 B IH F AO R, AA R DH EH R,1
R TH ER Z,R IH Z,1
M R IY V Y UW EH,M EH,1
M Y AH L AH,M,1
W EH N,W ER AE N,1
N AY AA,N AA,1
F TH AO T Y,F AA R Y,1
AH V AH,AH N D DH AH,1
L IY N Z,L EY M Z,1
SH IY HH,SH AE NG HH,1
K S UW T IH N,K Z OW N,1
D AW T T,D HH AE V T,1
 HH IY N, DH AH N,1
IY N UW,IY D UW,1
OW L JH ER IH,OW D UH R IH,1
NG B AH T,NG DH AE T,1
AH M Z,AH B HH AE Z,1
Z IY K,Z AH K,1
AH OW SH AH N,AH ER L IY,1
HH EY V,HH AE V,1
V AH N T IH,V IH,1
AA R K S UW T IH N,AA G Z AH N,1
T T UW AH M,T ER M,1
F AH S,F ER S,1
S F AH,S T B AH,1
R AH Y,R Y,1
M AA,M W EH R AA,1
L AH N D F,L F,1
W ER,W IY R AH N T,1
T AH N D W,T W,1
 K L IH F W AA Z S, DH AH S,1
UW DH D B AY,UW ER L AY,1
UW DH D B AY,UW Z V AY,1
AY DH AH L AH,AY T S AA N AH,1
AH G ZH ER IY,AH K Y UH R IY,1
ZH,ZH B AE D L IY,1
V AH HH,V F AO R HH,1
M AH N K,M IH K K,1
Z T,Z S T,1
R IY T S,R EY N JH,1
R IY T S,R EY D Z,1
S AE T AH,S AH N D AH,1
L AE F,L EH F,1
SH W AO T ER AO,SH AA R AO,1
 DH EH R Z S, S,1
OY P UH T,OY W OW L D N T,1
T DH AH W,T W,1
F IH SH B,F ER S T B,1
T AH S D,T AE Z D,1
T HH IY IY,T IY,1
SH IY HH AE D,SH EH R D,1
Z AO L K,Z AA R K,1
 TH ER, DH AH ER,1
ER OW L,ER L,1
Z D AH P,Z DH AE T,1
R AA D Z K,R AY T S T UW K,1
Z HH ER T,Z W AA N T,1
T S M AY,T AH D T UW B AY,1
 K L IH F, G OW F,1
F W AA Z S,F AO R AH S,1
AY DH AH,AY D AH,1
 IY CH AH, IH T S AH,1
M L AO S K,M W AA Z K,1
OW AH N,OW IH N,1
AY D AH D,AY D,1
ER N M,ER M,1
M AO R M,M AY M,1
IY B AY,IY AH V AY,1
W ER K IH NG HH AA,W AA Z CH AA,1
K AA M,K AE M,1
M AH N K AE N D IY AE,M P IH NG AE,1
 T, DH AH T,2
IY B AA,IY P AA,1
AA G G EH T,AA R K IH T,1
S IH NG IH F F AO R CH AH N S,S EY M HH IY S,1
ER DH OW Z,ER D AH Z,1
OW V AH L F,OW F AO R F,1
L D S AH M IH,L Z IH,1
Z D IH,Z S T IH,1
M AY P,M AH P,1
T AY HH,T AH HH,1
HH EY V AH,HH AE B AH,1
T IH N AH,T AH,1
AH F CH,AH V CH,1
D M,D W ER M,1
 IH T M, M,1
EY B ER,EY T ER,1
ER IH,ER HH IH,1
ER TH B,ER D Z B,1
T AY D,T IH D,1
IY AE,IY V AE,1
D TH R,D F AO R,1
R UW DH,R DH,1
IY AA N DH AH AE,IY IH M AE,1
 CH UW Z K, K,1
IY AO R,IY AA R,1
AA N K,AA T K,1
DH AH K,DH AE T K,1
AH P B,AH N D B,1
 G, DH AH G,1
ER AW T G,ER AE NG G,1
G R UW HH ER,G ER,1
ER AH P B R,ER AO R,1
R IH NG IH NG IH N P,R EH V ER IY EH M P,1
P EH,P AH TH EH,1
T IY K,T IH K,1
K OW T S,K EH N D Z,1
 D AA N T AE S K M, M,1
 G AA T, DH AE T,1
R B AH T,R DH AE T,1
 G R EH G B AY Z F, F,1
F R EH SH M IH L K IY CH W IY K D EY M AO R N,F ER S T N,1
N IH NG,N AW,1
K T D,K D,1
V L IY V Z,V N EY M Z,1
IY D G,IY G,1
EY N IH R HH IH M,EY T,1
AA N D AH N,AA N,1
EH G DH,EH K DH,1
N B IY OW,N D OW,1
L N AH T,L DH AE T,1
F L IH M Z,F R EH N D Z,1
Z IY,Z,1
L EY T AH,L IY D AH,1
 HH IH, DH IH,1
IH Z IH,IH S IH,1
 JH EH F TH, AY TH,1
N Z SH,N SH,1
 F AO R W, W,1
OW V AY,OW M AY,1
S IH M,S AH M,1
M B AH L Z,M W EY Z,1
AA R K S UW T,AA G Z T,1
IY S IY W AA,IY Z AH N D K AH L AA,1
 AO SH, AA SH,1
P HH,P T UW D UW HH,1
M AE Z,M IH Z,1
IH NG AO,IH N AO,1
IY TH M,IY EH S M,1
IH Z F AO R R IY L,IH K S P L,1
L,L OW D AH D N EY T OW,1
S M AO L B,S P AA B,1
N DH AH HH UH K,N,1
W IH L B,W UH D B,1
AH L Z,AH S,1
AH L Z,AH N D,1
 SH IY HH AE D Y AO R D AA R K S UW T IH N G, G,1
K AH N,K AA N,1
S P L EY D AE,S AE,1
S DH AH P,S P,1
P AH P,P ER P,1
S D IH L,S T UW L,1
AY T DH,AY V DH,1
D AA R D,D AW ER D,1
V P AH,V K AH,1
EY T OW Z,EY N ER Z,1
M AA N HH,M HH AW DH AH HH,1
HH AE L,HH EH L,1
W IY N,W EY,1
 B AY DH, DH,1
 P R AA JH EH K T D IH V EH L AH P M AH N T W AA Z P R AH S IY D IH NG T UW S L OW L IY,,1
V DH AH K,V Z K,1
G R OW Z,G ER L Z,1
 S AH L, L,1
T AH D B IH,T IH P IH,1
IH B L,IH K L,1
AA G R,AA N Y AO R,1
R AH F,R F,1
F IY Z AH N D T EY,F EY S B IH HH EY,1
EY B AH,EY V Y ER AH,1
L Z AH,L S AH,1
AH V AH V EY,AH M TH IH NG TH EY,1
L AH B AH L,L P UH L,1
L W EH N,L IH N,1
N Y UW AO L,N DH AH OY L,1
L W EY Z,L IH Z,1
Z Y UW S M,Z M,1
S UH P ER,S AH B ER,1
B S L IY,B Z AH N D HH IY,1
IY P IH NG P IH L,IY F EH L,1
 AH K, K,1
T IH D,T,1
AE D Y AO R,AE Z AA R,1
R D AA,R N AA,1
AA R K S,AA T S,1
 HH IY AO, DH AH AO,1
M D T UW HH,M DH AH HH,1
 N OW R, DH AH R,1
AH V JH,AH JH,1
N IY V AH,N EY B AH,1
AH N L,AH L,1
AW L IY W,AW DH AH W,1
 DH AH N IH R AH S T S IH N AH G AO G M EY N AA T B IY W IH DH IH N W, W,1
 K AE, DH AE,1
R AA F IH K EH,R AO NG EH,1
S N AH G L,S L,1
D AE N,D AH N,1
N T F,N D F,1
SH TH,SH T TH,1
EY M T,EY B AH L T,1
D R AA P F AY V F AO R M Z IH N DH AH B AA K S B IH F AO R Y UW G OW AW T,D,1
R UW T L,R EH K L,1
ER S P IH,ER Z B IH,1
AE F S,AE V S,1
 AE T L, L,1
 AH N AA N K, K,1
W OW N T P,W IH L P,1
AO F F,AO F,1
F AO R DH AH W,F IH N W,1
 IY T, EY T,1
T IH NG S,T IY N S,1
P IH N,P AE N,1
R EH NG K,R AY K,1
K TH M,K M,1
SH AH B,SH IH B,1
UW T IH N G R,UW B R,1
Z W ER HH,Z AA R HH,1
IH NG AY,IH N AY,1
M Y UW,M UW,1
T AH N,T N,1
M IH L,M EH L,1
L K B,L T B,1
B AA G G,B AO L G,1
B AA G G,B AH G,1
R IY S IY W,R AH SH IH NG W,1
W EH R D IH V AY,W ER DH IY F AY,1
AY S K,AY T ER K,1
V OW N,V AA N,1
N L IY S,N S,1
N G R IY S,N ER N IH S,1
G D DH,G DH,1
L IY S,L EY S,1
M P ER HH AE P,M R EH P,1
ER K AE N B IY D AH N,ER,1
Z B Y UW G AH,Z V IY HH IH K AH,1
T AH L OW,T IH B AA D IY Z N OW,1
EY M IY,EY B IY,1
IY N DH,IY DH,1
 DH AH F AA G P R IH V EH N T IH D DH EH M F R AH M ER AY V IH NG AA N T AY M,,1
IY K AH N,IY IH N,1
T EY N,T EH N,1
IH M B AH,IH V AH,1
ER AO L Y IH R,ER AW N D HH IY R,1
ER AO L Y IH R,ER HH IY R,1
R UW TH,R EY D W IH DH,1
EY K M,EY T M,1
M IY SH,M AH N T SH,1
EH D AH N D,EH D,1
JH DH EH M,JH HH IH M,1
 HH AW G UH D IH Z Y, DH AE T Y,1
N D ER AH,N SH UH R AH,1
AA SH W AO T,AA CH IH T,1
T ER,T AA N OW V ER,1
 M IH L K P, P,1
T IH V P,T AH D P,1
DH IH S,DH AH S,1
S D R,S T R,1
R AH G,R OW K,1
T HH IH M,T,1
Z L AH,Z AH N D AH,1
NG AE T,NG IH T,1
F IH T W,F Y UW W,1
T AH N D HH,T HH,1
N EH R,N AE T M AH S F IH R,1
OW HH AE,OW AE,1
ER EY N JH,ER IH JH,1
Y ER AH,Y OW Y AH,1
AH TH,AH R TH,1
TH EY N F OW M AE,TH IH NG AE,1
AH IH V EY,AH AH B EY,1
EY Z IH V,EY S AH V,1
 K AO L, HH AH L,1
L AE,L OW AE,1
S IH S,S OW S,1
M AE,M Z AE,1
EY T AH,EY D AH,1
N T DH,N DH,1
M M Y UH R AH,M DH AH,1
 DH AH IH L EH K T R AA N, AE G N,1
AA P T IH K AH L S IH S,AA S,1
S T AH M M EY B IY IY DH ER AH M AE G N EH T,S T,1
N TH,N D TH,1
OY P UH T DH,OY W IH DH DH,1
UW W IH L B IH K,UW M EY K,1
AH M JH,AH P JH,1
S AH V DH,S IH N DH,1
 EY T, DH AE T,1
T F IY L D G,T Y AO R G,1
D IH N P AH Z IH,D T R AY IH,1
IH SH AH N,IH NG T UW,1
 HH IY R, Y UH R,1
AH B D,AH P D,1
D HH IH,D IH,1
AO,AO L,1
S IH L V,S EH V,1
V ER W,V R AH L W,1
W EH R K,W ER K,1
 P AE, DH AH AE,1
AE M G IH,AE V ER IH,1
D EY Z,D,1
S IY W AA SH W,S AH N T L AO S W,1
L AH V DH,L DH,1
 SH IY R EY D IY EY T AH D W, W,1
W AO R M TH AH,W AH,1
N D G,N G,1
P T UW T,P T,1
K UH K W,K ER D W,1
 HH IY D K, DH AE T K,1
AO L B L,AO R P L,1
L EH G AH,L AY K AH,1
AH D S,AH S,1
 AH M, M,1
