W AA Z T UW G EH T M IY IH,W ER IH,1
N B,N DH AH B,1
B EH D M AE N,B IY N,1
 K W AY AH T L, G L,1
L IY HH IY D IH,L IH,1
IH T ER M AH,IH S AH R AH,1
N D T UW F OY,N DH AH OY,1
L HH ER,L ER,1
 HH ER S, S,1
 DH AH K AE T S, Y EH S,1
S M IY AW AO L W,S Y EH S W,1
S M IY AW AO L W,S T AH W,1
W EY Z HH ER T S M,W IY M,1
S UW DH D B,S OW B,1
S UW DH D B,S AH N B,1
M AH S,M EH S,1
M AH S,M AE S,1
S AA ZH,S AH JH,1
 IY CH AH N T AY M L, D EY L,1
M L AO S K,M AE Z K,1
K OW AH,K AH,2
AH N S AY,AH L AY,1
D AH D,D IH D,1
AH HH IY T IH NG S IH S T AH M P,AH G AY Z ER P,1
 Y AH, AH,1
 Y AH, N AH,1
 Y AH, DH AH,1
AH NG S T ER Z L,AH L,1
AH NG S T ER Z L,AH N L,1
L AH V K,L OW K,2
N K AE,N HH AE,1
N K AE,N AE,1
D IY AE Z,D Z,1
Z T R,Z P R,1
Z T R,Z F R,1
R IY T S,R EH S,1
IH N G R,IH R,3
IH N G R,IH NG R,2
IH N G R,IH T R,1
IY AE N OY L IY,IY B AA D IY,1
IY AE N OY L IY,IY EY ZH IY,1
 HH EY AH N D P AE S CH ER AA R DH AH AH, AY AH,1
ER CH IY F S AO R S AH Z,ER W AY Z,1
Z AH V L AY V S T AA K F IY D,Z,1
CH AA P,CH AH P,1
P T AH M IH,P IH,1
IH Z AH M W AA Z K AH M P L IY T L IY AH,IH N Y AH,1
N JH AH S T AH F AY D,N Z,1
IY IH F IH,IY B IH,1
AH N D SH IH P SH EY P,AH S,1
EH M B L AH M D IH P IH K T S DH AH AH K,EH G Z EH K,1
R AA P AH,R AH,1
AH L AH S AO L AH,AH B AH,1
AH G L,AH L,3
P ER S AH N EH L AA R,P R,1
R IH K S P EH K T AH,R AH,1
D T UW OW B EY G AH,D AH,1
AH V ER M AH,AH K SH AH,1
N T AO R D ER Z,N,1
 OW N L IY L AO Y ER, T AW ER,1
R AH L K AH M Z,R OW Z,1
Z T AH M AA R OW HH AE,Z AE,1
AE V HH ER ER EY N,AE N,1
N JH F AO R AH,N AH,1
AH M IY T IH NG AE T T UW,AH,1
Z IH F IH T W,Z AH W,1
ER B R OW K,ER K,1
K AH N,K ER,1
K AH N,K AA N,1
N G R IY S IY W AA SH W AO T ER AO L Y IH R,N,1
N G R IY S IY W AA SH W AO T ER AO L Y IH R,N AH,1
 L EH T, DH AE T,1
 L EH T, B AH T,1
T M IY,T HH IY,1
K W OW T,K AA R T,1
T HH IH M IY V IH N M AO R,T AH R,1
R F UH L IY,R IY,1
IY F AO R HH IH Z AH,IY AH,1
AH N AE L,AH L,1
L AH S AH,L AH,1
S IH Z IH M P AO R T AH N T T UW M AY TH IY M,S,1
 HH IY S, S,4
EY Z IY F UW L,EY T AE T L,1
L HH AE F AH,L AH,1
AH L AW D,AH S,1
 B EY K S L OW L IY AE T L IY S, S,1
S T W AH,S AH,1
AH N HH AE F AW ER L AO NG G ER,AH M,1
 D IH S EH M B ER AH N D JH AE N Y UW EH R IY, HH IY,1
IY AA R N AY S M AH N TH S T UW S,IY S,1
EH N D,EH D,1
D IH N M AY AE M IY,D,1
D IH N M AY AE M IY,D L IY,1
AW G UH,AW K UH,1
IH Z Y AO R EH N D ER AH N S,IH T,1
 IH F P IY P AH L W ER M AO R JH, JH,1
AH S DH EH R W UH D B IY N OW N IY D F AO R W EH L,AH L,1
L F EH R,L,1
 B AA R B B ER N D P EY P ER AH, AH,1
AH N D L IY V Z IH,AH G R IH,1
IH N AH,IH P AH,1
 B AE S K AH T B AO L K AE N B IY AE N EH N T ER T EY N IH NG S P AO R T,,1
 B R IH K S AA R, AO R,1
 F AE T SH OW, S OW,1
OW D IH,OW IH,1
N L UW S R,N R,1
OW L Z,OW Z,1
OW L Z,OW Z IH Z,1
Z B IH,Z IH,1
IH N IY TH DH AH SH ER T,IH Z,1
 IH T S, S,4
S AH F ER Z F R,S UW P R,1
R AH M,R IY M,1
R AH M,R M,2
R AH M,R IH M,1
L AE K AH V Y,L IY Y,1
IY D ER SH IH P,IY AH V,1
S L IH P T,S EH T,2
S L IH P T,S ER T,1
AH N D S,AH S,3
NG K AH,NG G AH,1
OW P,OW,4
L UW M,L M,1
S IH L V ER W EH R,S AH R,1
IY F L IH M Z,IY P R EH Z,1
Z IY,Z AH N T,1
 Y AH NG CH IH L, SH EH R HH OW L,1
L D R AH N SH UH D AH V OY D,L D,1
D IH K S P OW ZH ER,D ER,1
ER T,ER Z T,1
ER T,ER,4
 W EH DH ER P R, HH IY R,1
 W EH DH ER P R, AY D AA N T HH IY R,1
R UW F G AH L,R IH L,1
L AA SH AH,L EY T S AH,1
AH Z AA R V,AH V,1
IH V Z,IH Z,3
Z D R,Z R,3
AY V IH,AY D IH,3
AH N Z AA N TH ER Z D EY Z,AH R Z,1
 M EH N IY, HH IY,1
IY S AH L,IY L,1
L EH K SH AH,L IY G AH,1
AH N Z AA R DH EH M S EH L,AH L,1
L V Z,L IY Z,1
Z K AH N V IH N S IH NG K AA N T R AH B Y UW SH,Z EY SH,1
N Z T,N T,1
UW DH IH,UW D IH,1
S AH P,S P,1
P R EY,P L EY,1
EY Z AH L,EY,1
DH EY W EH N T D AW N S T EH R Z L,DH AH AO L,1
L OW D AH D AH T,L T,1
T R EY,T ER EY,1
T R EY,T EY,1
EY L AE V IH SH,EY SH,1
SH L IY,SH AH N Z,1
 N EH V ER HH, HH IY HH,1
AE P IY ER,AE D ER,1
ER IH N M AY L,ER L,1
L AY F,L,1
 HH UW, UW,1
UW AO TH ER AY Z D DH AH AH,UW S AH,1
AH N L IH M,AH M,1
M AH T AH,M AH,1
AH D IH K S P EH N S,AH S,1
AH K AW N,AH N,2
 T UW F ER DH ER, ER,1
ER HH IH,ER IH,1
IH Z P R EH S,IH S,1
T IY ZH HH IY,T AH T IY,1
IY AH K EY ZH AH N AH L,IY L,1
L IY R IY,L IY,1
IY D Z DH AH,IY AH,1
AH W AO L S T R IY T JH ER N,AH N,1
L AO R IH S K AA S T UW M N IY D AH D B L AE K G L AH V Z T UW B IY K,L OW K,1
M P L IY T,M OW T,1
T L IY EH L AH G AH N T,T IH V,1
 W AY Y EH L AO R, D AA R,1
W ER IY OW V ER S IH,W IH,1
IH L IY AY T AH M Z,IH N,1
 G EH S DH AH K W, IH N W,1
W EH S CH AH N F R AH M DH AH,W AH,1
AH AE N,AH N,1
AH AE N,AH EY N,1
N S ER,N,1
N S ER,N D ER,1
 D AA N T AE S K M IY T UW K AE R IY AE, AH CH AE,1
AH B AW T IH T S,AH V AO L S,1
S AE P,S P,1
P L AH K AH B IH L AH T IY T UW P IY P AH L,P AY S,1
 D UW Y, Y,1
K AH V M,K M,1
S IH Z N AA T AH,S EH D AH,1
AH P R OW G R,AH R,1
AH V S,AH S,1
AH V S,AH N S,1
 HH UW AO TH ER AY, AH V DH AH AY,1
DH AH AH N L IH M AH T AH,DH AH,1
AH D IH K S P EH,AH EH,1
AH K AW N T,AH M IY Z HH IY,1
AH K AW N T,AH,1
P R EH S,P ER S,1
S T IY ZH HH IY AH K EY,S W EY,1
N AH L IY R,N R,2
R IY D Z DH AH W AO,R IH K AO,1
L S T R IY T JH ER N AH L,L D,1
 L AO, AO,1
R IH S K AA S,R P AE S,1
M N,M EH N,1
IY D AH D B L AE K G L AH V Z T,IY T,1
IY EH L,IY K AA L,1
L AH G AH N T,L IH JH,1
AY Y EH,AY HH EH,1
L AO R W,L AH W,1
L AO R W,L ER AY W,1
W ER IY,W EH R IY,1
IY OW V,IY AH V,1
V ER S,V DH AH S,1
V ER S,V S,1
AO R D AA R K S,AO N P ER S,1
N G R IY S IY,N AH L IY,2
 P OW AH T S M AO, AO,1
R OW V ER D W EH L AA N HH Y UW M AH N P AE SH,R EY SH,1
 IH T W AA Z N AA T IH G Z AE K T L IY P AE N IH K DH EY G EY V W EY T UW B AH, AH,1
AH T DH,AH DH,1
DH EY K UH D N AA T JH AH S T S IH T DH EH R,DH ER Z,1
 W IY K AE N, IH N,1
N D AY T UW W IY K AE,N AE,1
N D AY L AY K R IY L P IY P AH,N AH M AH,1
 DH AH K L AH M Z IY K AH S, P EH S,1
AH M ER S P IH L,AH L,2
L D S AH,L AH,2
L D S AH,L IY Z EY SH AH,1
AH M IH K S P EH N,AH N,4
S IH V P ER F Y UW M,S AO R,1
 DH AH V Y UW P OY N T OW V ER L UH K T DH AH OW SH, AO R EY SH,1
 P, S P,1
P L,P AA T L,1
L IY Z D IH G M AY P AH,L AH,1
AH T EY T,AH T,1
OW Z AH P B IH F AO R F R AO S T,OW,1
OW Z AH P B IH F AO R F R AO S T,OW EH V ER,1
R AY D DH AH S,R IY S,1
R AY D DH AH S,R IY IH N S,1
S AH B W EY B AH T AY HH EY V AH N T IH,S ER CH IH,1
IH N AH F CH EY N JH,IH Z,1
 G R AE N D M AH DH ER, HH ER,1
T G R UW HH ER AH P B R IH NG IH NG IH N P EH T IY K,T L UH K,1
K OW T S,K,1
R IY S IY W AA SH W AO T ER,R AH TH AH HH ER,1
DH AH TH IY M M EY B IY DH AH F AO R,DH EH N EH R,1
M EY SH AH,M AH,1
P F R AH,P AH,1
S IH V AA L V,S,1
S P OW K S UW DH IH NG L,S AH L,1
IY,IY N,1
IY,IY D,1
IY,IY AH,1
HH IH ER Z W,HH IY R W,1
W EH R L,W ER AH L,1
AH K W,AH V W,1
N AO R M AH L IY S T,N AA T,1
T EH P IH N,T HH AE V,1
 DH AH K AE, HH AE,1
 DH AH K AE, IH T HH AE,1
AE T S M IY AW AO,AE Z N OW AO,1
Z HH ER,Z P ER,1
Z HH ER,Z,1
ER T S M,ER M,1
M AY IH,M IH,1
IH R Z,IH T S,1
Z S UW DH D B AY DH AH,Z AH,1
AH G ZH ER IY AH,AH F EH R AH,1
AH S M AH,AH K AH,1
AH S AA ZH,AH,1
 IY CH AH N T, T,1
T AY M L IY IH N,T AA R AH N,1
AH M L,AH L,2
L AO S K OW AH,L AH,1
S AY D AH D W,S W,1
EY K D AW N AH V AH HH IY T,EY T,1
T IH NG S IH,T AE M IH,1
IH S T,IH T,3
T AH M P AA R T,T IY,1
 JH EY N, EH N,1
 JH EY N, AE N,1
 JH EY N, DH EH N,1
N M EY ER N M AO R M AH N IY B AY W ER,N T ER,1
ER K IH NG HH AA R D,ER D,1
K AA M,K AH M,1
M AH N K AE N D IY AE Z,M OW T IH V IH Z,1
AA SH W AO T ER,AA Z L OW ER,1
AA SH W AO T ER,AA Z AA N HH ER,1
AO L Y IH R,AO R,4
T AE S K M,T M,1
M IY T UW K AE R IY AE N,M AH N OW N,1
M IY T UW K AE R IY AE N,M EH D IH S IH N OW N,1
 W AH T SH AE, S AE,1
AE L DH IY Z,AE R AH Z,1
Z IH F EH K T,Z EY T,1
T S B IY,T,1
Z DH,Z D DH,1
V B AY R,V AH R,1
Z P IY S F AH L,Z B IH HH OW L,1
 B OW N, W AH N,1
N D K,N K,1
T AH L AH,T AH,2
JH T R AE N,JH IY N,1
N Z M IH,N AH IH,1
IH T P UW R L IY AH N,IH N,1
T EH N,T ER N,1
AH AH L T R AH,AH AO F AH,1
AH S AA N IH K S,AH S,1
S IH G N AH,S AH,1
S T R OY EH,S OW EH,1
IY F AY,IY W AY,1
 AE L AH, AH,1
AH S AH Z AH B IH L,AH M IY L,1
L AH T IY T UW W ER,L Y ER,1
ER K W IH TH AW T S UW P ER V IH ZH AH,ER EY SH AH,1
 B AA B P EY P ER D OW V, V,1
V ER DH AH,V AH,1
AH L IH V IH NG R,AH R,1
R UW M M Y UH R,R IY R,1
UW W AY L,UW AO L,2
 M IH D IY, HH IY,1
 M IH D IY, P IY,1
IY V AH L S,IY W AA Z S,1
T AA N HH AY,T F AO R F AY,1
AA R K S,AA T S,3
AA R K S,AA N S,1
AA R K S,AA S,1
AA R K S,AA D S,1
 N AA T S, K R IH S,1
S ER P R,S K R,1
R AY Z IH NG L IY DH,R AO S T DH,1
DH IH S AH,DH AH,1
P R,P UW R,1
R OW CH D IH D N AA T W ER K,R,1
AH N TH IH NG HH IY TH AO T N OW B,AH B,1
IY N OW Z,IY W AA Z,1
AW T IH T Y EH T,AW T,1
 IH N SH, SH,1
SH AO R,SH UH R,1
SH AO R,SH AW ER,1
SH AO R,SH OW,1
SH AO R,SH AH N,1
R T AH N,R AE N,1
N D T UW B,N B,1
B AA R OW AE,B AE,1
AE N AA R B AO R,AE R,1
AH L F R EY,AH B EY,1
Z S L AE SH T IH M B ER,Z AH Z,1
AH S AW N,AH N,2
D AH V JH,D JH,2
N AH F AH R Z B Y UW G AH L S K EH R D DH AH AE N T AH,N ER AH,1
 HH AY, AY,6
AY W EY AH,AY AH,1
AY W EY AH,AY R AE N AH,1
AH N D F R,AH G R,2
IY W EY M IY N DH AH S EY M TH IH NG,IY Z,1
 DH AH F AA G P R IH V EH, W EH,1
EH N T IH D DH EH M F R,EH L AO R,1
R AH,R G AH,1
R AH,R IY AH,1
R AH,R DH AH,1
R AH,R EY S IY AH,1
AH M ER AY V IH NG AA N,AH N,1
N T AY M,N IY Z D,1
N T AY M,N S AH M,1
N T AY M,N D,1
N T AY M,N,1
 D AE F N Z S W, HH IY W,1
W IY D IH,W IH,1
SH N IY D AH L P OY N T S K AA R F M AE CH T HH ER S K ER T,SH IH Z,1
L V OW K AE B Y AH,L EH L AH,1
AH L EH R IY K AH,AH G AH,1
AH N T EY N,AH N,1
N Z S,N S,3
S IH M B AH L Z,S,1
ER AO L Y,ER AH N D Y,1
ER AO L Y,ER AH Y,1
N T AE S K M IY,N IY,1
D DH AH P R,D T UW R,1
R EH Z AH,R IH K AH,1
AH N T B UH K IH,AH V ER IH,1
V EH N L,V AH L,1
L AY T AH N M AH N T,L EY T,1
IY HH IH Z W,IY W,1
ER B R,ER R,1
R AH DH ER S EH D B R,R IH T AY R,1
R EH TH L AH S L IY,R D,1
 IH Z DH AH M, AY M,1
M AH DH ER,M EY D OW V ER,1
ER AH V AE,ER HH AE,1
AE N AO T IH,AE F HH IH,1
IH S T IH K CH,IH Z CH,1
AE T F AO,AE Z P AO,1
L T,L,1
D R AH,D AH,1
ER EY T DH EH R,ER AO R,1
R K L AE S R UW M Z,R AH T IY Z,1
Z F AO R AO,Z W ER AO,1
AA L AH D,AA R D,1
D EY Z,D,2
 W IH DH D R AO, AO,1
 W IH DH D R AO, SH AO,1
OW N IY,OW L IY,1
IY AE K Y AH Z EY,IY EY,1
EY SH AH,EY T IY AH,2
Z AE T W AH N S,Z,1
R IH SH P L EY D T AE G W IH DH B IY,R IY,1
IY CH B AO,IY K AO,1
 R AY, AY,1
AY T N,AY AE N,1
N AW M EY,N EY,1
EY N AA T,EY AY T,1
T B IY DH AH,T AH,1
AH B EH S,AH S,1
S T T AY M,S M,1
IH Z N AH S,IH S,1
 D AA N T AE S K M IY T UW K AE R IY AE N OY L IY R, AY AH SH UH R,1
S T UW D AH,S EH V AH,1
T S CH OY S AH Z,T OW Z,1
AH V AY D,AH IH D,1
IY L EH JH AH K,IY AA T IH K,1
K EY SH AH N AH L G,K G,1
G OW L,G ER L,1
Z AA R N,Z AH N,1
N AA T AA,N D AH V AA,1
B AH T,B IH T,2
T R EH R IY AO R W IH M Z IH K AH L,T ER,1
DH EH M W,DH AH W,1
L F R AH M HH IH Z HH AE P,L SH EY P,1
P IY P IH R IY AH D,P T,1
 M AO R, R,1
R HH IY K UH D,R EH Z IH D,1
D T EY K AE T L EH ZH ER,D AH N S,1
 DH AH B AH NG G AH L, IH L,1
L OW W AA Z P L EH Z,L OY Z,1
Z AH N T L IY S IH CH UW EY T IH D N IH R DH AH SH AO R,Z,1
 AH B IH, AY IH,1
 AH B IH, IH,1
 AH B IH, AY TH IH,1
IH G G OW T,IH N AA R T,1
IH G G OW T,IH NG K N AA T,1
T AY D L IY AE M B AH,T IH K Y AH,1
L D TH R UW DH AH,L AH,1
AH F AA R M Y AA R D,AH T,1
AH F AA R M Y AA R D,AH B AE D,1
IH NG S,IH N S,3
S P IH,S IH,1
N AH CH N AY T L IY IH,N S IH,1
IH N K R IY S AH Z S T R,IH R,1
R EH NG K TH M ER AE K Y AH L AH S L IY,R,1
R EH NG K TH M ER AE K Y AH L AH S L IY,R IY,1
 AE T T W AY, AY,1
AY L AY,AY AY,1
AY T AA N,AY AH N,1
N DH AH T W EH L F TH,N ER TH,1
TH D EY W EH L HH AE V SH AH B L IY,TH T,1
S IY W AA SH,S IH Z AH SH,1
S IY W AA SH,S OW AH SH,2
Z B IH HH EY V Y ER,Z IY G ER,1
ER AH N D D IH F EH N,ER T UW T IY N,1
N D AH D IH T,N IY T,1
 K IY, HH IY,1
IY P DH AH,IY AH,1
AH D,AH N D,1
AH D,AH V,1
Z ER T,Z AA R T,1
T S S,T S,1
S IH M P AH L F,S OW F,1
R UW T,R IY S T,1
T D AH Z N,T OW N,1
N AY S L IY,N,1
 N UW AY, AY,1
Z F AO R,Z AA R,1
NG N UW T R IH,NG AH D IH,1
N K EY M W IH DH DH AH S,N HH IY S,1
S T AH D IY,S IY,1
IY AH V S OY L,IY L,1
L T R IY T M AH,L AH,1
IY S L IH P T AH N D S P R,IY K AO R,1
R EY N D HH ER AE NG K AH,R JH AH,1
S L OW,S OW,3
L UW M AH,L UH K AH,1
L UW M AH,L AH,1
AH M S IH L V ER,AH DH ER,1
ER W EH R K AE N AO F AH N B IY F L IH M Z IY,ER,1
AH NG CH,AH CH,1
N SH UH D,N HH AE D,1
D IH K S P,D AH D P,1
P OW ZH ER T UW K AH,P AH,1
AH N T EY,AH S EY,1
EY JH AH S D IH Z IY Z AH,EY T AH,1
R UW F G AH,R DH AH,1
Z AA R V,Z AH V,1
V EH R IY Y UW S F AH L IH N S IY AE T AH L,V HH ER AY Z,1
R AY V,R EY V,2
NG L EH S AH N Z AA N TH ER Z D EY Z,NG Z,1
R D AA R K S,R IY L AE P S,1
S IY W AA,S IH NG AA,1
AA SH W AO T,AA R CH IY AH T,1
AA SH W AO T,AA T,1
IY T R,IY R,1
R UW F AO R,R IY P R,1
R N IH T AH D F AE B R IH K S,R IY V,1
 IH F HH IY EH, DH AH EH,1
S AH CH AH TH IH NG AH G EH N,S Y UH N,1
N SH EH D D AY,N AY,1
AY AH V SH EY M,AY T HH IH Z,1
 W AH T IH T D AH Z, AE Z,1
S T IH,S IH,1
S T IH,S CH IH,1
M Y AH,M AH,1
L EY T S R,L EH R,1
R UW M AH N AE K T IH V AH,R AH,1
S L IH,S UW P ER IH,1
IH P T,IH N T,1
T AH N,T EH N,1
T AH N,T IH N,1
T AH N,T IH Z N,1
D S P R EY N D,D IH D,1
D HH ER AE NG K AH L AA N DH,D DH,1
L UW M AH N,L OW N,2
M S IH L V ER,M W ER,1
ER W EH R K,ER K,1
K AE N,K AH N,1
N B IY F L IH M Z IY,N,1
D IH K S P OW ZH ER T UW K AH N T EY JH AH S,D L AO S,1
S D IH Z IY Z AH,S AH,1
 W EH DH ER P R UW, HH IY L UW,1
UW F G AH,UW Z AH,1
AH Z AA R,AH R,1
AH Z AA R,AH K R,1
R V,R EY V,1
V EH R IY Y UW S F AH,V AH,1
AH L IH N,AH N,3
N S IY AE T AH L,N,2
D R AY V,D HH EH V,1
V IH NG L EH S,V IY N AH S,1
S AH N Z AA N TH ER Z D EY Z,S,1
 D AA N T AE S K M IY T UW K AE R IY AE N OY L IY, EH V ER IY,1
AH T F AE K,AH K,1
K T ER Z K AH,K S EH SH AH,1
N DH AH D IH G R,N F R,1
IY AH V R,IY R,1
N AE T V,N AH V V,1
S T AY,S K AY,1
AY M Z AH N,AY N,1
D P,D Z P,1
P L EY S AH Z,P AY Z,1
 TH AE T L B IY P, P,1
N T IY T,N T,1
T UW IY,T IY,1
IY T B AY,IY,1
 Y UW S ER T AH N L IY K AE N T IH K S P EH K T DH, DH,1
N F IY L D T UW D UW EH N,N EY N,1
N IY B EH T,N AH T,1
T ER DH AE N IH T D IH D L AE S T Y IH R,T IY Z,1
HH AY ER AO,HH EH R AO,1
DH AE N N AE N S AH,DH AH,1
 P R AA JH, JH,1
JH EH K T D IH V EH L,JH UW AH L,1
L AH P M AH N T W AA Z,L ER Z,1
Z P R AH S IY D IH NG T UW S L OW L IY,Z,1
 S ER V DH AH K, AY K,1
K OW L S L,K AA L,1
L AA AE F T ER,L ER,1
ER AY AE D,ER D,1
 DH AH OW EY S IH S W, AE Z W,2
 DH AH OW EY S IH S W, HH IY W AA Z AE Z W,1
Z AH M ER,Z HH ER,1
 DH AE T N, N,3
N OY Z P,N OW P,2
M G R OW Z,M W AA Z,1
NG IY CH D EY,NG,1
R K S UW T IH,R IH,2
R K S UW T IH,R L IH,1
R K S UW T IH,R D AY W UH D IH,1
R K S UW T IH,R D AH D IH,2
S K M IY T UW K AE R IY AE N OY L IY R AE G L AY K DH AE T,S EH V ER AH T,1
S K M IY T UW K AE R IY AE N OY L IY R AE G L AY K DH AE T,S,1
 D AH Z S AH S AY, AY,1
AY AH T IY R IH,AY W IH,1
L IY IH,L IH,1
AE Z AE N EH,AE T EH,1
N T AH T IY,N IY,1
ER AH N D AH,ER AH,1
V DH AH AH G L AA M,V F AO R M,1
M ER EY,M EY,1
AH N OW T AH,AH V AO L AH,1
AH V AA K EY M,AH M,1
N T UW HH IH Z,N TH IY Z,1
S EH T AH,S AH,1
AH S AY D,AH D,1
AH S AY D,AH N D,1
D T UW D R,D EH R,1
AY W IH DH L IH D AA N SH UH G ER B OW L,AY AH S,1
 DH AH B AH NG G AH L OW W AA Z P L EH, N AW R EH,1
EH Z AH N T,EH S T,1
T L IY S IH,T IH,1
IH CH UW,IH T UW,1
UW EY T IH D N,UW SH AH N,1
N IH R DH AH SH AO R,N,1
 AA R Y UW L, L,1
R EH M P L OY M AH,R W AH,1
IH G G,IH T G,1
IH G G,IH G,1
OW T AY,OW Z AY,1
OW T AY,OW AY,2
IY AE M B AH L,IY AO L,1
IY AE M B AH L,IY L,1
L D TH R UW DH,L DH OW DH,1
P IH N,P AE N,1
N AH CH N AY,N IH SH L AY,1
L IY IH N K R IY,L IY,2
IY S AH Z S,IY S,1
S T R EH NG K TH M ER,S ER,1
ER AE K Y AH L AH,ER IY N AH,1
 AE T T W AY L, P AH L,1
 AE T T W AY L, AH L,1
AY T AA N DH AH T,AY T,1
T W EH L,T L,1
T W EH L,T K AO L,1
L F TH D EY W,L IY W,1
V SH AH B L,V S OW L,1
 B R IH NG M IY DH AH F AY, AY,1
AY ER K R AE K ER Z,AY HH EY T,1
 DH AH SH EH L T ER SH OW N W UH D P R AH V AY D AO L M, CH IY Z M,1
M OW S T AE B S AH L UW T F AO L AW T P R AH T EH K SH AH,M AH,1
 HH IY L AY V D AH N D B R, G R,1
R IY DH D F AO R DH AH M AY N IH NG K AH M P AH N IY,R EY T,1
 DH AH B EH, EH,1
EH S T W EY T UW L ER N,EH M AH N,1
N IH Z T UW S AA L V EH K S T R AH,N EY SH AH,1
AH P R AA B L AH M Z,AH N,2
AH P R AA B L AH M Z,AH S IY Z,1
IY W AO R W,IY W,1
R M F L IY S IY W UH L AH N OW,R OW,1
ER AO L Z,ER,4
ER AO L Z,ER Z,1
 R AE L, L,1
 R AE L, W EH L,1
L F K AH,L AH,2
AH N T R OW L,AH V L,1
L D DH AH S,L EY S,1
S T AA P W AA CH F R AH M DH AH B L IY CH ER Z,S,1
S T AA P W AA CH F R AH M DH AH B L IY CH ER Z,S AO,1
R IH Z P,R AH P,1
P AA R T IH K Y AH L ER L IY,P IY,1
IY IH N,IY N,1
IY IH N,IY AH N,2
N F AO R M AH T IH V F AO R AH P R AH,N AH,1
S P EH K T,S T,1
T IH V B AY,T P AY,1
AY CH AA R JH M AH N IY,AY HH IY,1
IY F AO R S AH CH G AA R,IY R,1
R B IH JH,R,1
EY T IH V N,EY SH AH N,1
N AO R M Z,N Z,1
NG S AH B G R UW P S AH,NG DH AH,1
AH N D R,AH R,1
AY Z L,AY L,1
T HH AH N,T M EH N,1
 AH S P R, R,1
R IH NG T R,R AA R,1
R AE P F AO R S AA L,R AH W UH L,1
AH D M,AH N M,1
M AW N,M AO R N,1
N T IH,N IH,1
D T R AE,D DH AE,1
AE P AA,AE T AA,1
D Y UW B AY EH N,D AH N,1
N IY K,N K,1
K AO,K W AO,1
R D ER,R T ER,1
ER OY OW,ER AO R OW,1
 S T IY V W, DH AH W,1
R AH B R AY,R ER AY,1
AY T R EH D,AY V D,1
D K AE ZH M IH R,D AH Z UH R,1
R S W EH T ER,R AH L AY N,1
 DH AH G AH, AH,1
N M AH,N AH,1
N M AH,N DH AH,1
AH N K EH P T HH IH Z V IH K T AH M K,AH DH ER K,1
ER D,ER AH N D,1
ER D,ER HH EH D,1
ER D,ER,1
D AE T G AH,D AH,1
AH N P,AH P,1
 IH G W AA N, DH AH AE N,1
 IH G W AA N, JH OW N,1
AH Z AH N D AE L,AH T OW L,1
AH G EY T ER Z,AH N Z,1
EH P T,EH D T,1
IY HH AE D Y AO R D,IY D,1
T IH,T IH D IH,1
T IH,T R IH,1
T IH,T S IH,1
T IH,T HH IH,1
M IY T UW K AE R IY AE N OY L IY R,M EH ZH ER IH NG AH R,1
AE G L AY K,AE D AH K,1
AE G L AY K,AE T IH K,2
 IH T IH Z, AE Z,1
Z AA IH N,Z W AH N,1
S P AY R IH NG,S,1
IY DH EY S,IY HH IY S,1
D HH IY,D DH IY,1
IY D IH D S L IY P B,IY Z B,1
T S OW SH AO R T L,T TH ER L,1
IY AH N D F IH,IY IH,1
T F AH,T W UH M AH,1
AH L IY DH AE T HH IY F ER G AA T,AH N,1
 AE T R, R,1
T IH Z AH K AE ZH AH W AH,T HH IY R S AH,1
AH L S T AY L,AH L,1
IH N AH K R AH,IH S AH,1
AH SH T,AH T,1
T AH N L AY N D W,T IH NG W,1
AY T L,AY L,1
L EH DH ER,L,1
N AO L DH AH,N AH,1
AH IH N G,AH G,1
IY D IY AH,IY N AH,1
IY D IY AH,IY JH AH,1
AH P AA,AH K AA,1
AA N D AH,AA M AH,1
N D S K EH,N T EH,1
EH CH T DH AH S T R,EH R,1
R EY G IY,R IY,1
DH AE T G AA,DH AH HH AA,1
R D F AO R W AH N,R P UW N,1
N G AE L AH,N AH,1
AH N AH V G AE S,AH R,1
 IH D R AE DH ER, AY N EH V ER,1
ER N AA T B AY DH IY Z SH,ER HH AE V HH AE D SH,1
Z DH AE N,Z AH N,1
IY OW V ER CH,IY CH,1
AY T HH,AY D HH,1
HH AE,HH IH M AE,1
HH AE,HH AE V AE,1
AE N D EY K S W,AE T W,1
W EH N EH,W AH T EH,1
DH AH B AE R AH,DH AH,1
AH M EH T R IH K P,AH P,1
P R EH,P ER EH,1
P R EH,P AH Z EH,1
EH SH ER CH EY N,EH N,1
N JH AH,N TH AH,1
Z,Z SH OW N,1
T UW K AE R IY,T ER IY,1
 DH EY AO, HH IY AO,1
EH S T IY ZH AH N D S,EH S,1
S IH K Y UH R AH T,S T,1
 AH G UH D M, T UW M,1
OW T UW Y UW M,OW M,1
 B R IH, HH IH,1
IH JH AH Z,IH Z,1
Z T AH N AH L Z AH N D F,Z HH AW S F,1
F EH R IY Z AA R,F R,1
R DH AH,R AH,1
M EH TH AH D,M IY D,1
D Z AH V R IH V ER,D IY OW K ER,1
ER K R AO S IH NG Z,ER Z,1
R AH N IY V AH,R AH,2
R AH N IY V AH,R W AH,1
L IY D IH,L IH,2
IH S T R IH B Y AH,IH M AH,1
L AW L,L OW L,1
W EY HH,W IH DH HH,1
HH IY R B AH,HH ER AH,1
AH T R,AH G R,1
R AE SH,R EH SH,1
N AH L AY Z,N Z,1
L EH,L DH EH,1
DH AH N IH R AH,DH AH,1
AH S T S,AH S,1
AH S T S,AH N S,1
G M EY N AA T B IY W IH DH IH N W AO K IH NG D IH S T AH N S,G,1
 G R EH G B AY Z, IH T IH Z,2
 G R EH G B AY Z, HH IH Z,1
Z F R,Z P R,1
R EH SH M IH L K IY,R IY,1
IY CH W IY K D EY M AO R N,IY Z EH N,1
AA F IH K EH K AH,AA R D AH,1
AA F IH K EH K AH,AA V R AH,1
N AA M IH K K AH T,N T,1
T B AE K S N AH G L,T L,1
EH K T,EH F T,1
EH K T,EH T,1
EH K T,EH N T,1
T DH AH P UW R,T,1
UW T IH,UW N IH,1
W AO T ER AO L Y,W AH N Y,1
 DH IH S IH Z M AY, AY,1
HH EH N L EH,HH EH,1
EH JH ER HH IY IH N F AO R M D HH IH M IH N AE N,EH N,1
AH B Z,AH Z,1
Z AO R B D W EY,Z IY IY,1
 Y UW W ER IH N, AH N,1
N AH HH,N D HH,1
HH ER IY W IY,HH IY,1
IY R AH N T Y UW,IY,1
 Y EH T DH, IH F DH,1
EY TH R,EY D R,1
V D AA,V AA,1
N IH T,N,2
 HH UW AO, AO,1
ER AY Z,ER IY Z,1
AH N L,AH L,1
M AH T,M IH T,1
T AH D IH K S P EH N S AH,T EY SH AH,1
F ER DH,F AA DH,1
EH S T IY ZH HH IY AH,EH Z AH,1
AH K EY,AH N T EY,1
EY ZH AH,EY SH AH,1
IY D Z DH AH W AO L,IY T EY L,1
IY D Z DH AH W AO L,IY L,1
T JH ER N AH L,T AE T,1
 L AO R IH S K AA, AE Z P AA,1
AA S T UW M N IY D AH D B L AE K G L AH V Z,AA Z,1
Z T UW B IY K AH,Z AH,1
AH M P L IY T,AH T,1
T L,T IH V L,1
IY EH L AH G AH N T,IY,1
L AO R W ER,L ER,1
ER IY OW V ER S IH L,ER B EH L,1
IY AY T AH M Z,IY Z,1
N F R AH,N AH,1
AH M DH,AH V DH,1
T ER AO L,T AH L,1
T ER AO L,T EH L,1
T UW K AE R IY AE N OY L,T AH L,1
Z T UW P R,Z AA R,1
R IY P EH R,R AO R,1
R F ER,R D ER,1
ER M EH N T AH D B EH V R IH JH IH Z,ER Z,1
 N ER S, S,1
S AH Z T,S T,1
N IH NG HH IY R D OW AH Z N T K,N EH V ER K,1
AA S T EH N IY TH IH NG,AA Z,1
S IY M D R,S AE N G R,1
R AE DH ER HH OW P L AH,R AH D AH,1
S K Y AH L,S T L,1
L ER AE B D OW M AH N IH,L IY V IH,1
IH Z G UH D F AO R Y AO R B,IH T B,1
AE K,AE D,1
 DH AH K AA Z W EY EH N D AH D AH B, AO L R AY T B,1
AH P T L IY AE T DH,AH DH,1
DH AH SH AO R,DH ER,1
 DH OW Z M, M,2
UW Z IH SH AH,UW S AH,1
AH N Z HH AA R M AH,AH T IY AH,1
 P L IY Z, AE Z,1
Z T EY K DH IH,Z IH,1
IH S D ER T,IH T,1
T IY T EY B AH L K L AO TH T,T HH IH R AE F T,1
T UW DH AH K L IY N ER,T ER,1
ER Z F AO R M IY,ER,1
T K L IY,T IY,1
IY N ER,IY ER,1
ER Z SH AE M P UW D AW ER,ER W ER,1
ER AO R IY,ER IY,1
IY EH N T AH L R AH G,IY D,1
AA R K S UW T,AA T,1
W AO T ER AO L Y IH R,W UH D,1
AE S K M IY T UW K AE R IY AE N OY L IY R AE G L AY K DH AE T,AE V ER IH JH,1
DH IH S G R UW P IH Z S,DH AH S,1
K Y AH,K AH,1
AH L ER IH,AH N D IH,1
IH S T AH N,IH Z IH N,1
N D DH EH R P,N AH P,1
M T EH N,M AH N,1
D Z T UW B IY T EH K N AH,D DH AH,1
 G AA T AH HH, HH IY HH,1
HH EH K AH V AH B AY,HH AE D AY,1
AY AA N DH IH,AY R IH,1
IH S D ER T CH IY P,IH SH,1
S K AA L AH P T EH JH IH Z P AA R T IH K Y AH L ER L IY AH P IY L IH NG,S,1
AH B AH,AH AH,1
AH NG G,AH G,1
G AH L,G AE L,1
L OW W AA Z P L,L AH L,1
L EH Z,L AH Z,1
Z AH N T L IY S,Z S,1
UW L UH K IH NG F AO R EH M P L OY M AH N T,UW,1
G OW T AY,G AY,1
D L,D AH L,1
L IY AE,L AE,1
L IY AE,L EY AE,1
M B AH,M P AH,2
L D TH,L TH,1
AH F AA R,AH AO R,1
R M Y AA R D,R CH ER D,1
S P IH N AH,S T AH,1
AH CH N,AH N,1
N AY T,N T,1
IY S AH,IY AH,1
AH Z S T R,AH G R,1
L AY T AA N DH AH T,L IH T,1
L F TH,L IY TH,1
TH D EY W EH L HH AE V SH,TH ER SH,1
AA R K,AA K,2
IY W AA SH W AO T ER AO L,IY AH N AE L,1
AE S K,AE Z K,2
AE S K,AE Z EH K,1
R IY AE N OY L IY R AE G L,R AH L,3
R IY AE N OY L IY R AE G L,R AH T AH AY ER L,1
HH IY M EY T AO,HH AO,1
AO S K OY N Z HH IY M EY T EY K S,AO R S,1
S L IH P S P EY P ER F R AH M AH G R AE B B AE G,S SH UW,1
 W IH DH, DH,1
DH IH N,DH EH N,1
N DH IH,N HH IH,1
IH S F R,IH Z B R,1
EY M W,EY N W,1
K W AH T F AA L,K AO L,1
L OW D W AA Z S,L AH V DH AH S,1
N D IY,N IY,1
K AA B R AH,K AH,1
AH,AH V ER,1
 W AH N V, V,1
K T S,K S,2
S AH V S,S EH S,1
S K UW,S T UW,1
UW L D IH,UW HH IH,1
IH S T R IH K T S,IH Z,1
AY EH N IY K AO R,AY AH R,1
R D ER OY,R OY,1
OW V ER AO L Z,OW Z,1
W AO R AH B R AY T R EH D,W ER IY D,1
 DH AH G AH N M AH N K, HH IY K,1
Z V IH K T AH M K,Z F EY S K,1
ER D AE T G AH N P OY N T F AO R TH R,ER AA R,2
R IY AW ER Z,R,1
IY IH Z TH IH N ER DH AE,IY S AE,1
AH Z AH N,AH S N,1
N D AE L AH G,N AO R G,1
EY T ER Z AA R T R AA P IH K AH L R EH P T,EY T,1
R K S UW,R D T UW,1
UW T IH N G R,UW R,1
AA SH W AO,AA Z M AO,1
AO T ER AO,AO R AO,2
AO T ER AO,AO AH K AH AO,1
S K M IY,S IY,1
 W AY SH, SH,1
SH UH D DH IH S B IY,SH IY,1
 AO L DH AH, AY R AH,1
AH W AY L SH,AH SH,1
SH IY S AE T,SH T,1
IH N Y UW IY AA,IH NG ER AA,1
Z S W,Z W,1
ER CH EH S T,ER D IH D,1
T CH AA,T SH AA,1
R T K,R P K,1
D B R,D V EH R,1
IY F L IY,IY P IY,1
IY T EH L Z Y UW W IH,IY V IH,1
IH CH AE,IH SH HH AE,1
AE D AH T IH V,AE V,1
V Z D UW W AH T,V,1
D EH,D AH R EH,1
K ER EY T,K T,1
T DH EH,T R EH,1
EH R K L AE S,EH S,1
S R UW M Z,S AH Z,1
IY W IH L,IY L,1
L AH L AW AH R EH R L AY,L EY B ER D,1
AO AO L F OW N,AO AH N,1
N IY AE K Y AH,N D AH,1
Z EY SH AH N Z AE T W AH N S,Z IY IY,1
T R IH SH,T EY SH,1
SH P L EY D T,SH AH N R AY T,1
T AE G W IH,T IH,1
IH DH B IY,IH N IY,1
CH B AO L,CH L,1
L Z F,L OW F,1
AW M EY,AW DH EY,1
N AA T B IY,N OW M IY,1
IY DH AH B EH S T T,IY IH P IH T,1
Z N AH S M,Z M,1
M ER JH ER Z,M AA R K S,1
N OY L IY R AE G L AY K DH,N W ER DH,1
N OY L IY R AE G L AY K DH,N W IH DH,1
 S OW L ER, AW ER,1
Z K UH D P,Z IH T P,1
NG L AO NG P IH R IY AH D Z,NG ER Z,1
V F L AH,V B AH,1
AH D AO R D R,AH T ER G R,1
AW T,AW N D,1
 K AH, AH,1
AH M HH,AH HH,1
 D EY AE, Y AE,1
AE F T ER D EY,AE DH EY,1
EY S AH M,EY IH M,1
M N UW EH P AH,M AH,1
AH S OW D IH,AH T EY T IH,1
IH Z R IY P AO R T AH D,IH D,1
AA R T AH N CH,AA D CH,1
T DH EH R K,T AH K,1
M Z F,M F,1
W IH L AH L,W EH L,1
L AW AH,L AH,1
R L AY,R AY,1
N IY AE,N AE,2
R IH SH P L EY D T AE,R AY Z B AY AH AH V AE,1
AE G W IH DH B IY CH B AO L,AE L,1
L Z F AO R AW ER,L ER,1
M ER JH ER,M AA R K ER,1
 SH IY HH AE D Y AO R D AA, AA N AA,1
 SH IY HH AE D Y AO R D AA, T AA,1
IY W AA,IY OW AA,1
AA SH W AO T ER AO L Y IH R,AA R,3
AA SH W AO T ER AO L Y IH R,AA N DH AH,1
 M EH N IY S, AH S,1
S K AW ER IH NG P AW D ER Z N,S N,1
N AW AO L S OW,N OW,1
OW K AH,OW AH,1
AH N T EY N F AA S F EY T S,AH V P AY AH S,1
 HH IY W AA Z OW N L, AY L,1
L IY V EY G L IY AH W,L AY K W,1
W EH R AH V DH AH S L UW S IH NG R,W AY Z R,1
R EY N,R AY T,1
 N OW P AH L IH T AH K AH L AO, AO,1
R D ER AO,R AO,1
R EH K,R K,1
K AH N AA,K AA,1
M IH K S IH S T AH,M AH,1
AH M IH Z S,AH S,1
S OW K L IH R L IY K AA N T R EH,S EH,1
IY T UW N EY CH ER,IY ER AY Z IH NG,1
 AE G R, R,2
R AH K AH L CH ER AH L P,R EH S IH P,1
R AH K AH L CH ER AH L P,R IY P,1
AA D AH K T S,AA S,1
S AA R AH N IY V AH N L IY D IH,S IH,1
T R IH B Y AH T AH D,T IY,1
L AW L IY W,L DH AH W,1
R AE SH AH N AH,R EY Z AH,1
AH L AY Z AO L EH R ER Z,AH Z,1
AH L AY Z AO L EH R ER Z,AH,1
