T IH N,T AH N,85
N G,N D G,76
N G,N D DH AH G,2
DH IH S,DH AH S,2
S D AY,S T AY,1
AY V S,AY L S,1
 P, IH T W AA Z AO L P,1
 P, IH N P,1
N M EY,N W IH L DH EY,1
R D AA R K,R AH T AE K,1
 AA HH AA HH IY TH, AY TH,1
D AH V,D IH V,1
R S,R S S,1
 D, AY D,3
 D, IH F Y UW D,2
 D, T UW D,1
 D, Y UW D,2
 D, W EH L D,1
 D, AY D EH F AH N AH T L IY D,1
N G R,N K R,7
N G R,N D R,2
N G R,N B R,1
S IY W AA SH,S AH Z IH N OW SH,1
SH W,SH AH N W,1
SH W,SH AH N D W,1
SH W,SH IH NG W,1
 SH, W EH L SH,4
 SH, IH F SH,25
 SH, AY N OW SH,1
 SH, DH AH SH,1
 SH, W EH N SH,4
 SH, AY SH,2
 SH, W IH SH,2
 SH, AY W IH SH,1
K S UW,K T UW,1
UW T IH,UW IH,1
UW T IH,UW D IH,1
S IY W,S DH AH W,2
S IY W,S AH N T W,5
S IY W,S Y AO R W,1
S IY W,S IH NG W,4
S IY W,S AH N D W,1
S IY W,S W,1
IY AE N OY,IY DH AH OY,1
S AH Z,S HH AE Z,1
ER R AE N HH IH M AO F,ER AH F,1
F HH IY R S IH K S Y,F Y UW Y,1
 K L IH F W, AY W,1
Z S UW DH D B AY DH AH L,Z R IH L,1
L AH G ZH ER IY,L IY,1
IY AH S M AH S AA,IY SH UH R IH F G AA,1
AA ZH,AA SH,1
T IH N G,T AH G,3
T IH N G,T G,23
T IH N G,T DH AH G,2
T IH N G,T AH D G,1
 B IY IH, Y UW IH,1
 AH B IH, EH P IH,1
IH G G,IH K G,1
D L,D AH L,1
D L,D DH AH L,1
L IY AE M B,L IH NG EY B,1
L D TH R UW,L T UW,1
 IY T IH NG S, S,1
R EH NG K TH M,R IY T S M,1
TH D EY,TH DH EY,1
W EH L,W IH L,3
V SH AH B,V JH UW B,1
B L,B AH L,1
 DH AH S, S,5
L D DH,L DH,3
 W AY CH AA R JH M AH N IY F AO R S AH CH G AA R B IH JH,,1
 HH IY, SH IY,1
 HH IY, IH T K UH D B IY,1
L IH T,L AH N T,1
W UH D JH,W IH DH JH,1
 B R, R,1
OY L,OY AH L,1
OY L,OY IH NG L,1
S AO L AH,S W AH,1
AH G L OW,AH N,1
V HH ER ER,V ER,3
V HH ER ER,V AO R ER,1
JH F,JH D F,3
NG AE T,NG IH T,3
D Y AO R D,D AH D,2
D Y AO R D,D D,3
D Y AO R D,D HH ER D,1
AA R K,AA K,1
S UW T IH N,S HH UH N,1
S UW T IH N,S AH N,1
N G R IY S IY,N D SH IY,1
AA SH W AO T ER AO,AA CH AO,1
K M,K HH IH M,1
K M,K T M,1
M IY T,M T,1
IY AE N,IY IH NG AA N,1
IY AE N,IY AH N,6
IY AE N,IY AY D AA N,1
IY AE N,IY AA N,1
IY AE N,IY IH T AA N,2
IY AE N,IY IH N,1
N OY L IY R,N AH R,2
N OY L IY R,N DH AH IH R,1
AE G L,AE NG L,1
AE G L,AE K L,2
N AE Z S UW N,N AH N,1
N AE,N D AE,3
 IH F N EH S AH S EH, D IY EH,1
EH R IY T UW R IY P L,EH L,1
L EY S B OW,L K K OW,1
OW TH HH AE V Z,OW D Z,1
Z AA N G R IH L S IH R K AH T S AH,Z AH,1
 B IH F, F,2
EY Z IH,EY IH,1
M R IY V Y,M IH F Y,1
UW EH V ER IY,UW W AA N T T UW B IY,1
N Z SH,N SH,2
T IH N G R,T R,6
T IH N G R,T AO R,1
T IH N G R,T AH R,1
AA SH W,AA CH W,2
ER AO L Y IH R,ER AA N,2
ER AO L Y IH R,ER,1
ER AO L Y IH R,ER HH IY R,1
ER AO L Y IH R,ER AA N DH EH R,1
 D AA N, N OW W AH N,1
N T AE,N AE,1
IY AE N OY L IY R,IY DH AH W EY T AH V DH AH R,1
IY AE N OY L IY R,IY DH AH R,1
 Y UW T, IH T T,1
K W IH DH L,K R IY AH L,1
AY N Z,AY Z,1
Z T UW IY,Z IY,1
D AH,D IY AH,2
AH T S,AH N S,2
AH T S,AH N Z,1
N OW T,N AA T,1
 B AA, AH L AA,1
AA B P,AA T AH V P,1
P EY P,P IY P,1
P EY P,P AY P,1
P ER D OW V ER L IH V IH NG R UW M M Y UH R AH,P AH,1
L Z,L D AA N T,1
L Z,L,2
AY R AA,AY ER AA,2
IY Z,IY,2
UW K AE R,UW G EH T V EH R,1
UW K AE R,UW SH EH R,1
G L,G AH D L,1
G L,G Z L,1
 Y, W EH N Y OW Y,1
 Y, Y AO R Y,1
 Y, IH F Y,1
Y UW Y,Y AH R Y,1
N DH AH S,N S,2
Z R AH,Z AH,1
N DH,N D DH,1
N DH,N Z DH,1
R W AO R N,R AA N,1
T ER R,T AH L R,1
 DH, IH F DH,6
 DH, IH Z DH,1
 DH, AY TH IH NG K DH,1
 DH, W EH L DH,1
D AW ER AO,D AA R AO,3
L AH,L DH AH,2
L AH,L Y AH,1
OW,OW B,2
Z L,Z IH L EH V AH N M IH L,1
AH V M,AH N M,1
NG AE T T,NG T,2
NG AE T T,NG AH N D T,1
R IY S,R L EY S,1
R IY S,R EH S,1
R IY S,R AH S,2
R IY S,R EY S,6
 HH, IH F HH,3
 HH, Y AE HH,1
 HH, HH IY HH,1
 HH, AY N OW HH,1
 HH, AY HH,1
 HH, AH N D HH,1
 HH, IH T HH,1
UW B IH L IY V,UW W EY V,1
V IH N,V AH N,1
N F,N D F,1
L IH V EH,L IY DH AH F EH,1
N T S,N S,1
S AO R W,S W,1
 N, AY N,1
 N, AY D IH D N T N,1
N AW DH,N OW DH,2
IY N IH,IY T IH,1
 V EY, F EY,1
R AH N IY,R IY,1
S N,S IH N N,1
N AH G,N IH G,1
T DH,T IH NG DH,1
T DH,T UW DH,1
 D AA N T AE S K M IY T UW K AE R IY AE N OY L IY R AE G L AY K DH AE T,,3
 IY CH IH, IH,1
IH Z S,IH T S S,1
S T K,S K,1
M AO L B,M AA R T B,1
W ER M,W AO R M,1
M AA N,M AH N,1
N DH AH HH UH K,N D,1
B AE L,B IH L,1
ER AO L Z,ER,1
M K AO R N ER D AE,M AE,1
 IH G W, L AY K W,1
W AA N,W AH N,1
N AH Z,N IH Z,1
Z AH N,Z AE N,1
N D AE,N AE,1
Z AA R,Z AO R,1
SH IY HH AE D,SH EH D,1
SH IY HH AE D,SH EH R D,2
M IH Z,M ER Z,1
R N,R AH N,1
R N,R,1
R B B,R B,5
R B B,R T B,1
ER N,ER AH AH N,2
ER N,ER AH N,1
AE D Y AO R D,AE Z AH D,4
AE D Y AO R D,AE T AH JH IY D,1
AE D Y AO R D,AE CH AH D,1
S AH S,S IH Z,1
S AH S,S AY S,1
UW IH N IH,UW IH,1
 S ER, AY R IH Z ER,1
D DH AH OY,D Y AO R OY,1
F TH AO T Y,F S EH D Y,1
F TH AO T Y,F DH OW Y,1
L IY N Z SH,L EY M D SH,1
S AH Z AH N D F,S EH S F,1
R EH N D ER,R JH ER,1
ER AH N,ER N,1
N S,N IY,1
N S,N AH T S,1
 B, IH N B,1
S P AO,S K AO,1
R T,R,1
 SH IY HH, IH F Y UW HH,2
 SH IY HH, Y AW V HH,1
 SH IY HH, IH T HH,1
R D DH,R DH,2
T AH,T S AH,1
 B AH, W AH,1
 B AH, AH,1
L L,L AY L,1
AH V W IY G IH V,AH V,1
V HH IH M,V,1
IY S AH F,IY Z EH F,1
ER D IH N HH ER AO,ER T AO R AO,1
N N,N D N,1
 M, IH T S M,2
D DH AH B,D B,1
D DH AH B,D Z B,1
P EH K,P AE K,5
S T D,S D,1
 M EY, IH T S B EY,1
EY K,EY S IH K,1
L IH D F AO R SH,L IY AH SH,1
Z JH AA,Z CH AA,1
L IH,L IY IH,1
L IH,L AE S T Y AE TH EY V B IH,1
L IH,L W IH,1
IH D Z,IH Z,1
 DH AH K, K,4
K T DH,K IH NG DH,2
K T DH,K S DH,2
K T DH,K DH,2
 IH D R, AY R,2
 G, M AY G,1
 G, AY G,4
 G, IH T S G,1
UW HH ER AH,UW DH EH M AO R AH,1
NG IH N P EH T IY K OW T S,NG,1
AH K AO,AH N F AO,1
R JH AH,R CH AH N AH,1
AH L B AA,AH T P AA,1
R K,R T,1
R K,R AH K,2
P T F,P IH NG F,1
 S, IH K S,1
 S, Y AE S,1
 S, IH N S,1
 S, W EH N S,1
 S, AE Z S,1
 S, DH AH S,1
S T AE K,S P EH K,1
 OW N L IY L, L,2
V M IH L,V F EY L,1
Y AH N EH R Z,Y ER,1
 IH F K AE R AH L K AH M Z T AH M AA R OW HH AE V HH ER ER EY N JH F, F,1
R AH M,R M,2
R AH M,R IH M,1
AH T,AH N,1
AH T,AH D T,1
AA D AH,AA N T AH,1
HH EH M,HH AE M,1
 K, AY K,1
 K, IH N K,1
 K, DH AH K,3
 K, W IH K,1
 K, B IH K,1
 K, IH F DH AH K,1
N Y,N Y OW Y,1
Y UW AO,Y AH R AO,1
Z Y UW S M,Z M,1
Z B IH,Z V IH,1
Z B IH,Z F IH,1
Z IY F,Z AH T F,1
AY AA,AY N AA,1
 AE L, EY L,2
L AH S AH Z,L Z IY Z,2
 HH AW Z IH T S, AO L S OW S,1
S IH N L,S AH V L,1
CH DH,CH T DH,1
 HH UW AO TH ER, W AA Z S ER,1
ER AY,ER P R AY,1
Z D DH AH AH N L,Z IH NG L,1
L IH M AH T AH D IH,L IY IH,1
S AH K AW N T,S IH V,2
 L AO R IH, HH IH,1
IH S K,IH Z K,1
 SH IY HH AE D Y AO R, DH AH R,1
 SH IY HH AE D Y AO R, T EH T R,1
R D AA R K S,R IY S,1
N G R IY S IY W AA SH,N T F L AE SH,1
SH W AO T,SH L EY T,1
ER AO L,ER AE L,1
ER AO L,ER OW N L,1
ER AO L,ER HH OW L,1
L Y IH R,L AH G EY T ER,1
L Y IH R,L IY,2
L Y IH R,L OW V ER,1
M S AH,M Z AH,1
AH M F,AH N D F,1
IY N F,IY F,1
B AH N D K,B K,1
ER AH,ER Z AH,1
DH AH G AH N M AH N K,DH AE T K,1
Z AH N D AE,Z AE,3
T Y,T AE N IH K S K Y,1
UW,UW S,1
UW,UW W ER K IH NG,1
 DH AH F, D IH F,1
UW TH F,UW F,1
F EH L,F IH L,2
AH M R UW M,AH M,1
M K L ER K S F,M F,1
S IH V,S AH V,1
V Y UW N AH T D IH D AH,V DH AH,1
AH G UH D JH,AH JH,1
L IH P,L EH P,1
N DH AH,N AH,1
M AH N,M IH N,2
M AH N,M AE N,1
R K AE N AO,R AO,1
AH N B IY,AH V IY,1
IY F L IH M Z IY,IY S T T EH N AH S IY,1
W EH DH ER,W AO T ER,2
S UW T IH N G,S OW L G,4
ER AO,ER M AO,1
ER AO,ER IH T AO,1
AO L Y,AO R Y,1
 W, IH T W,1
W IH DH D,W AA Z AH D,1
R AO AO,R AA P AO,1
R AO AO,R AO,1
AO L F,AO F,2
F OW N,F P OY N,1
N IY AE K Y AH,N T AH N D P AH,1
Z EY SH,Z IH SH,1
AH N D T,AH T,1
R EH G T,R EY T T,1
R EH G T,R EY K T,1
P OW AH,P AH L AH,1
S AE T,S EH T,3
S AE T,S EH N T,1
D AH N,D IH N,3
N D S,N S,2
N D S,N T S S,1
DH IY Z SH,DH AH SH,3
DH AE N,DH EH N,4
 HH ER R AY T HH AE N D EY K S W EH N EH V ER DH AH B AE R AH M EH T R IH K P, P,2
UW T IH N G R,UW P R,1
S IY,S AH P IY,1
V AH,V W AH,1
V AH,V DH AH,1
AH HH,AH N HH,1
M D AA,M DH AH AA,1
 L, AH L,1
 L, Y AE L,1
 L, AY AO L,1
 L, IH N DH AH L,1
 L, G L,1
D OW M F,D AA N T F,1
IH N,IH T,1
Z AE T W AH N S,Z,1
N D T,N T,6
N D T,N T T,1
AA R K S UW T IH N G,AA G,2
AA R K S UW T IH N G,AA G Z G,2
G R,G Z R,2
IY W,IY V W,2
IY W,IY AH N T W,1
IY W,IY AH N D W,1
 AO R D AH Z, IH T HH AE Z,1
Z HH IY G,Z S AH M G,1
 DH AH, AH,2
 DH AH, Y OW Y AH,1
 DH AH, IH T W AA Z AH,1
 DH AH, AY R IY AH,1
OY P UH T,OY T,1
OY P UH T,OY K L IH K T,1
T DH AH W,T UW W,1
ER M AA N DH AH,ER IY AH,1
AH HH UH K,AH B AW T,1
 AH CH, CH,2
NG EH N,NG IH N,1
N Z AY,N S AY,1
AY M P,AY D P,1
B EH G ER,B EY K ER,1
Y UW AA,Y AW D AA,1
T P,T AO R P,1
Z D,Z D AH N D,1
L AY Z AO,L IY AO,1
T S F,T F,1
AH S T S,AH S,1
 W AY Y EH L AO R W ER IY OW V ER S IH L IY AY T AH M Z,,1
P L,P AH L,1
IY Z T,IY S T,1
ER Z SH,ER SH,5
 IH T W, HH IY W,1
N IH Z,N HH AE Z,1
 IH F P, P,1
N D P,N DH AH P,1
N D P,N T AH P,1
Z IH N,Z AH N,1
N AH B,N D B,1
G B AA N,G ER G AH N,1
N F AY ER,N Z,1
 Y AE L, W IY AO L,1
AA P S M,AA CH T M,1
 SH IY S, AY S,1
S IY W AA SH W AO T,S AH N T,1
T ER AO L,T L,1
R M,R AH M,1
R M,R M M,1
IY IH Z,IY HH AE Z,1
Z M,Z D M,5
Z F AO R M IY,Z,1
D AH K,D AE K,1
R AO S,R AH S,1
S IH T,S T,1
T M,T AH K M,1
 D UW, IH F Y UW,1
 D UW, IH N JH UW,1
UW N AA,UW D AA,1
AA T,AA N T,1
T UW T AY T,T AH D EY,1
AW AH R,AW R,1
R EH R L,R IY L,1
L AY,L T AY,1
AY,AY M,1
AY,AY V,1
AY,AY K,1
DH AE T HH EH,DH AH EH,1
 T, AY T,1
 T, IH N T,1
D AH N D G,D AE T G,1
IH N D,IH D,1
D AE Z DH AH R,D R,1
L IH F,L AH F,1
UW DH D,UW D,1
S M AH,S S AH,1
AH S AA ZH,AH M ER,1
IH DH DH,IH DH,1
AH N K,AH T K,1
IY AE Z,IY Z,1
IY AE Z,IY IH Z,1
 B AH T AH S, IH F S,1
AH T M,AH N M,1
K IH T AH,K HH ER AH,1
 HH IY W, IH T W,1
R IH SH,R AE SH,1
EY D T,EY T,1
S M ER JH ER,S P AA R T N ER,1
OW P R,OW B R,1
AH M AO,AH K AO,1
R N IH,R D IH,1
NG D UW,NG T UW,1
UW AA N DH,UW DH,1
B G L IH S AH N D IH N DH,B DH,1
 CH IY P S T AA K IH, AY IH,1
IH NG Z,IH Z,1
Z R AH N DH,Z DH,1
M TH EY R,M DH EH R,1
W AO R N,W AA Z,1
 S IY D Z AH, AH AH,1
IY N,IY N Z AH N,1
N K,N D K,1
N K,N T K,1
D S,D Z S,1
S EH D,S AY D,1
SH OW D,SH UH D,1
L IH Z,L AE Z,1
R EH M B AH,R AE V AH,1
T D R,T T R,1
AH NG K HH,AH M P HH,1
V W AO,V AO,1
W IH D,W IY D,1
D OW N,D UW N,1
DH IH S D,DH OW Z D,1
TH T,TH S T,1
UW D AW ER AO,UW T UW AO,1
UW D AW ER AO,UW AO R AO,2
UW D AW ER AO,UW AO,1
F AA F,F OW F,1
N AH M,N IY M,1
M AH K,M IH K,1
TH V EH,TH EH,1
IY F L UW AH,IY AH,1
AH N T,AH Z,1
S AE T B AY,S EH D F AY,1
AY DH AH P,AY T ER P,1
P AA N D AH,P AY L AH,1
AH N D S,AH T S,1
K EH CH,K AE CH,3
CH T DH,CH DH,4
R EY G IY S,R AY K IH Z,1
EH G DH AE T G AA,EH K ER K AA,1
AY Z S,AY S,1
AA P T,AA K T,1
P AH L S,P AE S,1
AA P,AA M P,1
P S,P T S,1
W IH L,W EH L,1
B AH N W,B ER T W,1
OW L IH L,OW B EH L,1
AY N B,AY B,1
B OW L W IH DH HH EH V IY,B AH T TH AE T D B IY,1
 DH AH T, T,1
K AH M W EH N R,K AO L R,1
UW TH F EH,UW S P EH,1
T IH N G R IY S IY W,T W,4
AH F EH R L,AH TH ER OW L,1
N M OW,N HH OW,1
 V Y UW T, IH T T,1
S IH N F,S F,1
V K AW,V T AW,1
N T IY Z,N Z,1
Z T,Z AO R T,1
Z T,Z ER L IY T,1
AA N D AH N,AA N,2
D S K,D K,2
 B EH G DH, T EY K DH,1
 B EH G DH, DH,2
T G AA,T K AA,1
 HH ER R, R,1
D EY K S W,D EH G Z W,1
D IY N Z K,D EY T S K,1
 B AA B P, W AO L P,2
UW M M,UW M,2
M Y UH R AH L Z,M,2
 AH N, N,1
K UH D DH,K AO Z DH,1
 P L, AE T L,1
Z P R,Z R,1
 AH B AO R IH NG N AA V AH L IH Z AH S UH P ER B S L IY P IH NG P IH L,,1
R AE SH,R AH SH,1
SH AH N IH,SH T IH,1
IH NG P R AA B AH B L IY W IH L B IY N EH S AH S EH R IY,IH T,1
UW IH N AE K T HH ER R,UW F AO R,1
R IH N,R IY N,1
 AA N DH IY Z DH EY F, AY F,1
L DH EY K AE N R IH L,L L,1
EH M B L,EH L,1
EH M B L,EH N V AH L,1
EY G AH V ER M AH N T AO,EY AO,1
V M IH L Y AH N EH R Z,V,1
F K AE R AH,F DH AH,1
AH L,AH G ER L,1
OW HH,OW AY HH,1
 HH IH Z SH, DH AH SH,1
W ER B,W AA Z B,1
 S OW IH, IH,1
IY IH N B,IY AH B,1
AE N Y,AE D Y,1
 K W, W,1
AY AH T L,AY D L,1
L IY HH IY,L IY,1
UW F,UW DH AH F,1
L HH ER,L Z,1
 HH ER S, AO R S,1
T AH N,T IH N,1
T AH N,T EH N,1
T AH N,T AO N,1
N D SH,N SH IH P SH,1
V M IH,V B IH,1
 IH, DH IH,1
IH F K,IH S K,1
ER B R,ER R,1
OW K AH,OW JH AH,1
N M AO R F UH L IY F,N EH N V OY F,1
AE F AH,AE TH AH,1
B EY K S,B IH G S,1
D IH N,D L AE N,1
D IH N,D AH N,1
N M AY AE M IY,N D,1
R EH N D ER AH N S,R TH AO T S,1
B AA R B B,B IY B,1
B ER N D P,B P,1
 N EH V ER HH AE P IY ER IH, IH,1
 HH UW AO TH ER AY Z D DH, DH,1
DH AH AH,DH AH,1
AH N L,AH L,1
IH M AH T,IH N T,1
T AH D IH,T UW IH,1
 T UW F, F,2
R IY D Z DH,R AY T S DH,1
R IH S K,R AH K,1
AY Y EH L,AY JH EY L,1
 SH IY HH AE D Y AO R D AA R K S UW T IH, IH,1
IY AE N OY L,IY AO L,1
L IY R,L DH AH R,1
L IY R,L R,1
L IY R,L AH R,2
L IY R,L IH R,1
R AE G L,R EH K L,2
R AE G L,R EH D L,1
R AE G L,R AA K L,1
AH B,AH V B,1
B AW T IH,B AA B IH,1
IH T S AE,IH Z AE,1
Z D DH,Z DH,2
Y EH L,Y EY L,2
W ER IY,W EH R IY,1
IY AY T AH M Z,IY,1
ER,ER Z,1
AE SH AH N Z,AE S T,1
NG IH N,NG AH N,3
N P,N D P,5
D AA R K S UW,D AO G F UW,1
IY S IY,IY D IY,1
IY S IY,IY Z IY,1
R IY AE,R AE,1
N OY L,N AO L,2
N OY L,N D OW N L,2
N OY L,N D AO L,2
N OY L,N T R IH L,1
N OY L,N OW N L,1
N OY L,N ER L,2
N OY L,N AH M AH L AY L,1
N OY L,N AH G L,1
AH TH IY M,AH F EY M,1
M M,M AO R M,1
 HH IY S P OW K, IH N DH AH K,1
K S,K EY S,1
K S,K T S,1
S UW DH IH NG L,S B AH L,1
L IY,L K S OW,1
R L AH K W,R AY W,1
AY IH,AY N UW Y IH,1
P AA R,P AO R,1
EY N M,EY M,2
M AH N K,M IH K K,3
IY AE Z T,IY T,1
IY AE Z T,IY AH N D T,1
IY AE Z T,IY AH S T,1
T SH AE L DH IY Z IH F EH K,T M EY K,1
K T S,K S,2
S B IY,S M IY,1
IY AH N,IY K AA N,1
M M Y UH R,M Z IH R,1
R AH L Z,R OW Z,1
 W EH R W ER Y UW W AY L W IY W ER AH W EY,,1
R AA R K IY Z,R AY Z,1
AW T IH T Y EH T,AW T,1
N D T UW B AA R,N IY M AO R,1
R OW AE,R AE,1
SH T,SH T T,1
S AW N,S AE N,1
D AH V JH EH N,D D UW N,1
N AH,N DH AH,1
N AH,N D AH,1
N AH,N T AH,1
F AH R Z B,F ER S T B,1
D AE F,D EH F,2
F N,F AH N,2
N Z S,N AH T L IY S,2
N Z S,N IY S,5
N IY D AH L P OY N T,N EY T,1
T S,T OW S,1
S L IY,S,1
R L AY,R,1
L F OW N IY AE,L DH AH AE,1
Z AE,Z DH AE,1
G L AY K DH AE T,G,3
IY AE M B AH L D TH,IY TH,1
F AA R M Y AA R D,F OW N,1
SH AH B L,SH IH P L,2
D IH,D HH IH,1
IH T,IH M,1
T S S,T S,2
S IH M P AH,S AH,1
AH L F,AH N D F,1
EY Z,EY,1
ER P R UW F,ER IH T F,1
F G,F IH T S G,1
IH V Z D,IH F T S D,1
IY HH AE D Y,IY K EH P T Y,1
 AA R Y, IH F Y,1
R G R,R R,1
EY D Z HH,EY T S HH,1
 S ER V DH AH K, K,2
AE D DH AH OY L,AE T AO L,1
M G R OW,M ER OW,1
M AE N,M EH N,1
M AE N,M AH N,1
 AH N OW T, AW T,1
V AA K,V AO L K,1
M IH N,M AH N,1
 AH B IH G G, G,1
T AY,T UW AY,1
S AH,S DH AH,1
S AH,S HH AE V AH,1
AH Z S,AH S,1
 AE T T, AH T,2
 DH AH SH, HH IH Z SH,1
SH OW N,SH AO N,1
T F,T L IY F,1
N D B R IY DH D F,N W EY T F,1
DH AH M AY N IH NG K AH,DH AH,1
M P AH,M AH,1
R W,R AH W,4
R W,R AH M W,1
 R AE, W IY AE,1
AE L F K,AE S K,1
K AH N T,K T,1
T R OW L D DH AH S,T HH ER T UW S,1
P W AA CH F R AH M DH AH B L IY CH ER Z,P,1
R AH P,R P,2
AY Z L,AY L,1
T HH AH,T AY S AH,1
N IY AY Z DH AE T S,N D S,1
 AH S, S,1
P F AO R,P S AA R,1
D M AW N T IH NG AH N,D AA N,1
N D AH,N AH,2
K AO,K W AO,1
R D ER,R T ER,1
ER OY,ER R OY,1
T IY V W AO,T EY F AO,1
ER D AE,ER AE,1
 SH IY, S IY,1
 SH IY, CH IY,1
 IH G, AY G,1
AH Z,AH IH Z,1
 SH IY HH AE, S T R AE,1
 SH IY HH AE, IH F Y UW K AE,1
Z AA IH,Z AE N IH,1
L IY DH EY S EH D HH IY,L IY,1
IY D IH D S,IY S,1
P B AH T S OW SH,P SH,1
Z AH,Z DH AH,1
L IH N,L AH N,1
N D W,N W,1
B OW L,B AA R,1
AY DH AH,AY HH IH Z AH,1
AY DH AH,AY D AH,1
P AA N,P OW N,1
CH T DH AH S,CH D IH S,1
R EY G,R IH K T G,1
DH AE,DH EY TH AE,1
AE T G,AE NG K G,1
AA R D,AA D,1
DH IY Z,DH OW Z,1
Z DH AE N,Z AH N,3
N B,N D B,3
ER CH AA R,ER T R,1
R JH D,R AY B Z,1
T IH,T D IH,1
T IH,T AH D IH,1
IH N G,IH S AH G,1
IY S IY W,IY Z DH AH W,1
IY S IY W,IY K W,1
IY S IY W,IY Z AH N W,2
UW R,UW L,1
N G R IY,N DH AH V IY,1
HH EH N,HH IH N,1
N L,N T L,2
ER HH IY IH,ER B IH,1
IH N F,IH F,1
R M D HH IH M,R DH AH T EH N M,1
N AE N AH,N AH T AH,1
AH B Z AO R B D W,AH W,1
Y UW W ER IH,Y OW Y AH R IH,1
ER IY W IY,ER IY,1
IY R AH N T Y,IY Y,1
Z P R EH,Z B EH,1
T IY ZH HH,T EY JH HH,1
IY R IY,IY M IY,1
IY D Z DH AH,IY T S AH,1
L AO R IH S K,L W EY Z K,1
M N IY D AH D B,M B,2
V Z T UW B IY K AH M P L IY T L IY EH,V D EH,1
EY EH N D AH D AH B R,EY R,1
AH P T L,AH F L,1
JH IH Z,JH AH Z,1
SH AH B,SH IH B,1
 HH IY M, Y UW M,1
Z HH IY M,Z AH N D M,1
S P,S AH V P,1
S P,S T P,1
M AH G,M G,1
 W IH DH IH N DH IH S F R EY M W ER K W AH T F AA, HH AA,1
L OW D,L AH D,1
D W AA Z,D EY Z,1
Z S T R EY N D IY,Z IY,1
 D IH, IH,1
IH D Y,IH T S Y,1
Y UW B AY EH N IY K AO,Y AO,1
R D ER OY,R R OY,1
OY OW V ER AO L,OY AH L,1
AH N M,AH V ER M,1
T F AO R TH,T TH,1
Z AA R T R AA P IH K AH L R,Z R,1
N G R IY S IY W,N D W,5
L HH,L DH AH HH,1
ER AO L Y,ER W AH N Y,1
 R AY T, W AH T,1
M EY N,M AY T N,1
N F AA S F,N F,1
EY T S,EY S,1
R EY N,R AY T,1
L EH R ER,L ER,1
ER Z,ER TH,1
ER Z,ER,1
S T,S T UW T,1
 K AO L AE, DH AE,1
AE N AE M B Y AH L AH N S F AO R M,AE T IH T M,1
L AH S IH S T AH N S,L,1
W IH,W IH NG IH,1
 AH B, IH T S B,1
 AH B, B,1
M AY AA D AH,M AW N T AH,1
P ER D OW V ER,P ER,1
ER DH AH L IH V IH NG R UW M M Y UH R AH L Z,ER,1
Z B EY S T AA N HH,Z HH,1
HH AY R AA R K IY Z,HH AW ER D,1
IY HH AE D,IY S EH D,1
D AA R K S UW T IH N G,D AO G,2
G R IY S IY W,G W,2
UW AA R IH N AO R M AH S,UW,1
S K L,S G L,1
EY F R AH M ER,EY Z ER,1
 B AE S K AH T B AO L K AE N B IY AE N EH N T ER T EY N IH NG S P AO R T,,1
IY AH V,IY HH AE V,1
R P IY S AH N D R,R R,1
ER EY JH,ER IH JH,4
ER T UW K UH K W,ER W,1
S AH N D S,S S,1
 M AA, IH S L AA,3
 M AA, B AA,1
AE P AH T,AE D V ER T,1
Z ER Z,Z IH NG,1
 DH AH P, P,1
 DH AH P, IH T P,1
 DH EY K, AY K,1
IY T AH,IY D AH,1
L D IH R,L DH EH R,1
S S,S T S,1
S IY M,S EY M,1
IH DH,IH DH DH,1
K OY L,K OW AA L,1
AH V K,AH K,1
AA G G,AA G,4
G EH T,G IH T,2
S IH,S EY IH,1
N R,N AH L F AO R,1
R IY K W AY ER Z P,R AH S T P,1
AO T AH M,AO R D ER,1
NG IH F F,NG AH N D F,1
NG IH F F,NG AH N F,1
NG IH F F,NG DH AH F,1
AA M S,AA B S,1
S AE P AH T AY Z,S Y UW Z,1
 HH AY, AY,1
EY AH N,EY IH N,1
N D F,N F,1
IH D DH,IH NG DH,1
 D UW W, W,1
IH TH AW T,IH DH DH AE T,1
AH L K L,AH L,1
L AO TH S,L,1
AH B L IY CH,AH P IH K CH,1
Z P AA R,Z R,1
R T IH,R IH D IH,1
AH L ER L,AH L,1
L IY IH N F AO,L AH S AO,1
AO R M AH,AO F AH,1
AH T IH V F,AH N F,1
P R AH S,P ER S,1
B AY ER,B AH T ER,1
EY L,EY Y OW L,1
IY W AO,IY P AO,1
W UH L,W IH L,1
W UH L,W EH L,1
L AH N,L AA N,1
L AH N,L IH N,1
Z P,Z N T P,1
UW S L,UW G EH T L,1
L OW L,L AH V L,1
OW L S,OW S,1
S L AA AE,S OW V OW AE,1
ER AY AE D DH AH OY L,ER AO L,1
Z DH EH N D,Z D,1
K IH,K L IH,1
L S,L Z S,1
IY D IH SH N,IY T AH S T N,1
K R AY,K W AY,1
F AH,F R AH,1
AH L M,AH M,1
 AE N, TH EY R N,1
AA K T,AA T T,1
T IH L Y AH,T OY Z AH,1
N AE T,N D AY T,1
T AH S,T S,1
EY AH N D F,EY F,1
EY M IY,EY B IY,1
IY N DH,IY DH,1
M TH IH NG,M,1
K T AA N,K S D AW N,1
B W AA Z S,B S,1
T IH L,T IY L,1
R AH K CH,R EH CH,1
K AH,K AH P AH,2
N HH AE,N DH AH T AE,1
L AH W IY N,L IH B AE N,1
 P R, F AO R,1
AY AH,AY AO R AH,1
S EH M,S IH M,1
AH L D IH N B OW L,AH L,1
 P IY T, IH T,1
ER IY AH Z,ER EY IH Z,1
Z AA R K,Z K,1
 P UH T DH, DH,1
P F AY V F,P DH AE T F,1
T S AH,T AH,1
V OW N L IY S,V S,1
SH AO R,SH AW ER,1
 Y UW W, HH IY W,1
S IH N T,S T,1
JH D D,JH D,1
P G,P T G,2
 AH F, F,1
W UH D Y,W AH T Y,1
S AH P EH,S EH,1
EH R,EH D,1
EH R,EH R AA R,1
EY D S,EY S,1
 HH IH, IH,2
IH Z HH,IH T S HH,1
IY IH Z HH IH Z,IY S EH Z,1
Z AH L OW N Y EH T,Z DH AE T,1
HH EH L P G,HH AE V G,1
HH AW S,HH AE S,1
S IH N DH AH,S AH,1
AH R IH M OW T K AH N T R IY S AY D,AH L,1
 L AY, AY,1
AY T AH D W,AY W,1
W IH N,W EH N,1
N D OW Z G L,N T T UW S K UW L,1
L OW D JH UW,L K AA Z Y UW,1
UW AH L,UW W OW L,1
L B,L D N T B,1
B R AY,B AY,1
AY T TH R UW DH,AY DH,1
D AW N P AO R,D AE M,1
L D S AH M IH,L Z IH,1
Z D IH G M,Z T EY K M,2
 G R AE N D M AH DH ER AW T G R UW HH ER AH P B R IH NG IH NG IH N P EH T IY K OW T S,,1
D AA R K S,D AO G S,6
R AE G,R IH G,1
S ER Z,S AH Z,1
Z R IH JH EH K T IH D DH,Z DH,1
AH AO R D ER IH N T,AH T,1
N IH N,N AH N,1
N V,N D V,1
UW Z,UW Z ER Z,1
Z AH SH,Z SH,1
SH IH P M,SH UH D M,1
EY T AH,EY K AH,1
AH V B IY IH NG B IH HH AY N,AH F AE N,1
N D DH IH S,N,1
N D IH,N IH,1
 CH, IH N CH,1
Z R,Z F AO R,1
R AH N DH,R DH,1
M TH EY R W AO R,M DH EH R,1
IY Z D ER,IY S T ER,1
ER T IY,ER D IY,1
IY R,IY N R,1
IY R,IY IH R,1
L AY F T EH N AH N T,L AW D T,1
T Y UW,T UW,1
G EH T IH,G IH V IH,1
P Y UW,P,1
ER AA R B,ER B,1
M TH EY,M DH EY,2
EY R,EY AA R,2
 R EH, V EH,1
AE F D AE N,AE S T S EH N,1
N S AH,N T AH,1
AH T ER,AH D ER,1
 Y AW V, W IY V,1
IY D Z,IY CH AH Z,1
L AO R,L AA R,1
R IH S,R JH AH S,1
R IH S,R IY AH S,1
S K,S T K,1
K AA S,K AH S,1
T UW M,T AH M,1
K G L,K L,1
K G L,K K L,1
L AH V Z,L AE B Z,1
L AH V Z,L OW DH Z,1
L AO R W,L AY W,1
V AH N,V IH N,1
N D DH,N DH,1
N IY DH,N DH,1
DH ER S,DH AH S,1
CH S T AH D IY,CH L ER N IH NG,1
K S UW T IH N G,K G,2
SH W AO T ER AO,SH AO,1
IY B IH K,IY K,1
K AO Z,K AA Z,1
R AH JH,R JH,1
D F AO R W,D W IH DH W,1
 HH ER R AY T HH AE N D EY K S W EH N EH V ER DH AH B AE R AH M EH T R IH K P R EH SH ER CH, CH,1
N JH AH Z,N Z,1
AE D Y,AE Z Y,2
W EH R OW,W ER OW,1
Z IH N D,Z AH D,1
IY D B ER,IY P ER,1
ER EH F,ER R IH F,1
 AE, IH T S AE,1
ER D OW V ER DH,ER IH N DH,1
 M IH D IY, AE N IY,1
T IY N,T AY N,1
UW IH,UW HH IH,1
IH T S R,IH Z R,1
R Z IH Z,R Z,1
 DH AH K AE T, IH T,1
T S M IY AW AO,T AO,1
S M AY IH R Z,S,1
 JH, IH F JH,2
M EY ER,M IY ER,1
R D,R D AH N D,1
R D,R AH S D,1
IY T S,IY Z,1
Z AE Z,Z HH IH Z,1
DH AH AY,DH AE T AY,1
T AH V AH,T AA N DH AH,1
Z AE T T,Z T,1
Z AA R T,Z AH V T,1
W AH N,W AA N,1
N D ER D,N T AH D,1
W AO R DH,W AA Z DH,1
IY AO R DH,IY AH N D DH,1
IH Z D,IH T S D,1
AW Z W,AW N W,1
Y UW AA R,Y OW Y AH R,1
D IH D,D AH D,1
 DH AE, AY K AE,1
AE T N,AE N,1
N OY Z,N AO L W EY Z,1
T UW D,T AH D,1
EY T DH,EY DH,1
V P Y UW T ER,V IY DH ER,1
R AE G L AY K,R AA K,2
K DH AE T,K,2
 M AY OW N IH, IH T S AH B AW T IH,1
S HH AE Z,S IH Z,1
S IH M P AH L ER L AY N Z,S EH D,1
R HH ER G,R G,1
D DH AH,D AH,1
AH ER AY,AH R AY,1
L AH V HH ER M OW B AH L P,L R IY P,1
 P UH T DH AH B, B,1
IH N DH,IH DH DH,1
DH AH G,DH AE T G,1
 D R AA, G AA,1
AA P F,AA T F,1
UW T IH N G,UW P ER G,1
IY AE N OY L IY R AE G L,IY IH T L,1
AH AH B V,AH AA D V,1
ER AH S,ER S,1
N T,N D T,1
T IH L Y UW,T UW,1
N D M,N M,1
 AH, DH AH,2
 AH, IH F AH,1
 AH, IH T S AH,2
 AH, IH T W AA Z AH,1
 AH, IH N DH AH,1
L IH Z AH,L AH,1
S UH P ER B S,S T S,1
S L IY P IH,S IH,1
IH NG P IH L,IH N DH AH B AH R B Z,1
 AO R DH, AA N DH,1
AH B EY,AH D EY,1
Z IH N HH IY T,Z,1
 HH UW, T UW,1
IY D Z DH,IY CH DH,1
M N,M Z N,1
L AO,L OW W AO,1
R W ER IY,R IY,1
IY OW V ER,IY ER,1
ER S,ER W AA Z S,1
ER S,ER Z S,1
M AH B EH,M DH EH,1
EH G ER,EH R,1
AY AA D,AY AH D,1
N,N AH L,1
N,N T,1
JH EH F,JH IY F,2
L IY N D SH,L EY M Z SH,1
D HH ER,D ER,1
TH AY Z,TH AE Z,1
DH AE T G,DH AH G,1
F AO R,F R,1
SH IY HH,SH AY HH,2
SH IY HH,SH Y UW HH,1
 DH EH R AA, AA,1
R AA B V IY AH S N IH M,R DH EH M,1
M F OW M,M M,1
S N AH G L,S B IH L,1
L EH K T,L AO NG T,1
AE G L AY K,AE D AH K,1
K DH AE,K AH L AE,1
AE T,AE K T,1
T,T S,1
 DH EH R W, IH T W,1
 B AH T W, F AO R W,1
V DH AH,V D AH,1
AH OW EY S,AH R AH S,1
IH S W,IH Z W,1
Z AH M,Z N T M,1
M ER AA ZH,M AY L AY N,1
AA R K S UW T,AA G Z L EH T,1
T IH N G R IY,T M IY,1
T IH N G R IY,T EY P IY,1
T DH AH,T M AH,1
AH SH AO R,AH Z UH R,1
R,R IY,1
ER N D P,ER AH P,2
N IH NG S,N M AH N T S,1
Z B AW,Z F AW,1
B AH N D N,B N,1
 AH TH AO R AH T IY Z S EY DH AE T OW L D S, S,1
S T ER Z AA,S AA,1
R AH P R AY M T AA R G AH T,R IY,1
B G L,B L,1
S AH N,S AY D,1
R IY S IY W AA SH W,R OW CH K W,1
AO T,AO R T,1
B AH T,B R IH T,1
T DH AH SH,T IH SH SH,1
 HH IY S, IH T W AA Z S,1
 HH IY S, S,1
T OW L,T IH L,2
AH D AY,AH T AY,1
AY M F R AH M,AY M,1
M AH B,M B,1
M R IY V Y UW EH,M EH,1
 DH EY EH, AY EH,1
F TH AO,F G AO,1
AO T Y,AO R D AH N Y,1
AH F Y UW JH,AH L AO R AH N JH,1
K L IY N,K R EY N,1
L JH ER,L ER ER,1
ER IH NG B AH T M,ER EY M,1
 DH AH V Y UW P OY N T OW V ER L UH K T DH, DH,1
DH AH OW SH AH,DH AH,1
AH N,AH,1
AH N,AH Z N,1
F CH,F T UW CH,1
F AH S,F EY S,2
S F,S T UW F,1
S OW,S M OW,1
OW L D M,OW M,1
N DH IH S Y IH R,N,1
AY Z DH EY,AY S T EY,1
W ER,W AO R M,1
N D R,N R,1
D W EH L,D OY L,1
S M AY IH,S F AO R Y IH,1
N M,N D M,1
 HH IY TH, TH,1
T HH IY S,T Y UW S,1
Z DH AE,Z AE,1
P F,P T F,1
AA K S B,AA N D Z B,1
 HH ER W, IH F Y AO R W,1
 HH ER W, W,1
 HH ER W, DH AH W,1
AH T IY,AH N D IY,1
IH NG AE,IH Z AE,1
AE T AH,AE D AH,1
UW D W IH L N,UW N,1
 OW, IH F OW,1
JH UW N Y ER D,JH EY R D,1
HH IY IY,HH IY,1
IY T OW,IY D OW,1
AO L K,AO R K,1
 TH ER, IH T S ER,1
ER OW L,ER L,1
AY Z,AY IH Z,1
Z D AH P,Z DH AE T,1
R AA D,R AY D,1
 K L IH, IH,1
IH F W,IH T W,1
UW DH D B AY,UW Z V AY,1
 Y AH NG S, AE N S,1
S T ER,S ER,1
G EH T S V,G IH Z V,2
 Y UW S, AY OW N L IY S,1
P G R,P B R,1
L D,L Y UW D,1
ER AH P B,ER AE T B,1
IH K K,IH K,1
K AH T B AE,K IH M P AE,1
 W AH, IH T D OW AH,1
K T D,K D,1
 DH AH M EH, EH,1
IY D G,IY G,1
HH AE D,HH ER D,1
IY S,IY Z S,1
AA N K L IY N,AA N,1
OW V,OW AE D V,1
AY S AH Z,AY Z ER Z,1
 AO SH, OW SH,1
P HH IY S,P S,1
IY TH M,IY Z M,1
T DH AH W ER M AA,T AA,1
 DH EH M, AY AE M,1
S DH AH,S AH,1
AH P,AH N D P,1
D AA R D,D AW ER D,1
 M IY, IH T N IY,1
IY T S DH,IY D Z DH,1
 P R AA JH EH K T D IH V EH L AH P M AH N T W AA Z P R AH S IY D IH NG T UW S L OW L IY,,1
AH OW EY S IH,AH L AY Z D DH IH,1
IY Z AH,IY AH,1
L W EH N,L AH N,1
N Y UW AO L,N D OY L,1
L W EY Z Y UW S M AY N,L,1
L UW M,L IH M,1
 HH IY AO, DH EY AO,1
D HH,D IH T HH,1
DH AH N IH R,DH EH R,1
R AH S T S,R S,1
D AE N,D AH N,1
N T F,N D F,1
SH TH,SH T TH,1
 P IY T S ER IY AH Z AA R K AH N V IY N Y AH N T F AO R AH K W IH K L AH N CH,,1
P AO,P B AO,1
N D V,N V,1
S UW T IH N G R,S OW L R,1
AH IH,AH D IH,1
IH N S,IH S,1
IH N S,IH Z V OY S S,1
T T UW D,T IH V D,1
 DH AH B, B,2
P IH N,P AE N,1
N AH CH N,N IH SH N,1
EY W EH L HH AE V SH AH B L IY,EY,1
UW HH IH M,UW,1
OY L IY R,OY DH AH R,1
W EH R D IH V,W ER TH DH AH V,1
IY K AE N L EH D,IY,1
 P UH T, B AH T,1
V EH,V AE N EH,1
M F L,M OW S T L,1
 R, P R,1
R AE L F,R AA F,1
M P ER HH,M Y UW HH,1
AE P S S,AE V S,1
ER K AE N B IY D AH N,ER,1
M IY N DH,M EY D DH,1
 DH EH R AA R AO, AY AO,1
OW AA,OW W AA,1
T S IY K,T UW IH K,1
K ER Z AE F T ER T R,K S P IH R,1
R UW TH,R IY AH N S,1
EH D AH N D,EH D,1
AY S,AY Z,1
AW G UH D IH,AW IH,1
R EH N,R IH N,1
N D ER AH,N SH UH R AH,1
